,date,retweet,text,,
883,Jul 10,False,"""Hillary is not somebody who fears the future. She believes that it is ours to shape."" —@POTUS pic.twitter.com",,
884,Jul 10,False,"""You can count on her, and how she won’t waver, and she won’t back down, and she will not quit."" —@POTUS pic.twitter.com",,
885,Jul 10,False,"When Donald Trump's casinos failed, hundreds of people lost their jobs, but he walked away with millions.http://hrc.io/29GWuWz ",,
886,Jul 10,False,"As the President has reminded us, the arc of the moral universe is long but it bends toward justice.https://amp.twimg.com/v/ecfe52ef-9d89-41df-b558-3043a9315d38 …",,
887,Jul 9,False,"""I saw how she treated everybody with respect. That's how you judge somebody."" —@POTUS on Hillaryhttps://amp.twimg.com/v/8cfdb454-3c9f-4e05-955c-8a595f2e9261 …",,
888,Jul 9,False,"Congrats, @serenawilliams on your record-tying 22nd Grand Slam title! #Wimbledon pic.twitter.com",,
889,Jul 8,False,"“Let us not grow weary in doing good, for in due season, we shall reap, if we do not lose heart.” —Galatians 6:9",,
890,Jul 8,False,"""When the 24-hour news cycle moves on, I won’t.” —Hillary on preventing gun violence and addressing racial injustice",,
891,Jul 8,False,"""Elie Wiesel once clarified for us that 'the opposite of love is not hate—it’s indifference.' ... None of us can afford to be indifferent.""",,
892,Jul 8,False,"""Let’s ask ourselves, what can I do to stop violence and promote justice? How can I show that your life matters to me?"" —Hillary",,
893,Jul 8,False,White Americans need to do a better job of listening when African Americans talk about the seen and unseen barriers you face every day.,,
894,Jul 8,False,"We cannot, must not, vilify police officers. Remember what those officers were doing when they died. They were protecting a peaceful march.",,
895,Jul 8,False,"""I will bring law enforcement and communities together to develop national guidelines on the use of force by police officers."" —Hillary",,
896,Jul 8,False,“Gun violence is ripping apart people’s lives. They are trying to tell us. We need to listen.” —Hillary,,
897,Jul 8,False,There is clear evidence that black Americans are more likely to be killed in police incidents than any other group. We have to do better.,,
898,Jul 8,False,"There is something wrong with our country. There is too much violence...too much senseless killing, too many people dead who shouldn’t be.",,
899,Jul 8,False,"I mourn for the officers shot while doing their sacred duty to protect peaceful protesters, for their families & all who serve with them. -H",,
900,Jul 7,False,We have a responsibility to fight for the next generation. All of us. #TBThttps://amp.twimg.com/v/f2fd877d-4b37-44ea-9358-6651298ed0fc …,,
901,Jul 7,False,Too many African American families are mourning. Too many young black men and women have been taken from us. pic.twitter.com,,
902,Jul 7,False,"Alton Sterling Matters.
Philando Castile Matters.
Black Lives Matter. pic.twitter.com",,
903,Jul 7,False,Trump got ahead by cheating working people like Andrew Tesoro. Now he wants to do the same thing to our country.https://amp.twimg.com/v/0697121c-7131-4bbb-b406-87f1aacf93d9 …,,
904,Jul 7,False,America woke up to yet another tragedy of a life cut down too soon. Black Lives Matter. #PhilandoCastile -H,,
905,Jul 7,False,We can't let Trump's approach to the economy anywhere near the White House. pic.twitter.com,,
906,Jul 6,False,Do you want to build a strawman?https://twitter.com/realDonaldTrump/status/750865499660091393 …,,
907,Jul 6,False,"""The death of Alton Sterling is a tragedy, and my prayers are with his family."" —Hillary pic.twitter.com",,
908,Jul 6,False,Let's make sure @realDonaldTrump never has the chance to bankrupt America the way he bankrupted his businesses.https://amp.twimg.com/v/ddefc426-248a-423c-991a-840a56b922aa …,,
909,Jul 6,False,Let's make it so that no student has to take on debt to go to a public college or university in their state.http://hrc.io/29saXp8 ,,
910,Jul 6,False,"Praying for a safe Eid Al-Fitr. My heart breaks for families struck by terror in Turkey, Iraq, Saudi Arabia, and Bangladesh this Ramadan. -H",,
911,Jul 6,False,"Who got hurt when Trump abandoned Atlantic City?
Small businesses
Vendors
Local builders
Casino workershttps://amp.twimg.com/v/feeba773-e7cd-4dc6-b5e3-c8f5ec9d8a36 …",,
912,Jul 6,False,"""In America, we don’t begrudge people being successful…but we do if they get rich by destroying other people."" —Hillary",,
913,Jul 6,False,“No major company has filed Chapter 11 more often in the last 30 years than Trump’s casinos.” —Hillary,,
914,Jul 6,False,"Donald Trump called the Trump Plaza Casino and Hotel ""the biggest hit yet.""

Now, it's abandoned. pic.twitter.com",,
915,Jul 6,False,"Trump made millions while bankrupting his businesses, laying off workers, and stiffing contractors. Here's how:https://amp.twimg.com/v/77dcd631-7137-4bbe-a3dd-219ac3b5455f …",,
916,Jul 6,False,Hillary heard you: College costs are too high in America. It's time to fix it. pic.twitter.com,,
917,Jul 6,False,Donald Trump's praise for brutal dictators like Saddam Hussein knows no bounds. pic.twitter.com,,
918,Jul 5,False,What @POTUS said. pic.twitter.com,,
919,Jul 5,False,"""I'm here today because I believe in Hillary Clinton."" —@POTUS at his first campaign stop of 2016https://amp.twimg.com/v/7245cf7e-9b9b-48f2-bfd2-76e8c940950c …",,
920,Jul 5,False,Fired up. Ready to go. pic.twitter.com,,
921,Jul 5,False,"Thanks, Obama. pic.twitter.com",,
922,Jul 5,False,"""The fact is, Hillary is steady. Hillary is true. … That’s how real change and real progress happen.” —@POTUS",,
923,Jul 5,False,"""Don’t boo, vote! Booing doesn’t help. You need to vote.” —@POTUS on Donald Trump’s dangerous policies",,
924,Jul 5,False,"""There has never been any man or woman more qualified for this office than Hillary Clinton. That's the truth."" —@POTUS",,
925,Jul 5,False,"""I saw how she treated everybody with respect...that's how you judge somebody. How they treat others when the cameras are off."" —@POTUS",,
926,Jul 5,False,"“I don’t know about you, but we’re fired up and ready to go!” —Hillary pic.twitter.com",,
927,Jul 5,False,"""In America, we don’t tear each other down, we lift each other up.

We build bridges, not walls."" —Hillary",,
928,Jul 5,False,"""Someone who has never forgotten where he came from. And Donald, if you’re out there tweeting: It’s Hawaii."" —Hillary on @POTUS",,
929,Jul 5,False,"Q: ""Will you condemn David Duke and say that you don't want...white supremacists' [votes]?""

Trump: ""I don't know.""https://amp.twimg.com/v/d8176f2e-08c6-45b5-b791-7f7def312891 …",,
930,Jul 5,False,"In a new interview, @POTUS talks about why Hillary has everything it takes to be president.https://amp.twimg.com/v/a7b7fad7-571e-4b9e-9e0d-cb696b96684b …",,
931,Jul 4,False,"Happy Fourth of July! Today let's celebrate the best of America—our freedom, diversity, and the values we share. -H pic.twitter.com",,
932,Jul 4,False,"""To be great, we can't be small. We have to be as big as the values that define America."" —Hillary pic.twitter.com",,
933,Jul 4,False,Here's to 240 years of progress. pic.twitter.com,,
934,Jul 3,False,A message from @realDonaldTrump on America.https://amp.twimg.com/v/a5165c67-ef4d-491d-80a0-a9462181e8e9 …,,
935,Jul 3,False,"Looking forward to hitting the campaign trail together, @POTUS.https://amp.twimg.com/v/77ba5595-51b0-4ff9-8eaf-0b561c711f1b …",,
936,Jul 3,False,Today's attack in Baghdad is another horrific example of ISIS's savagery. We will defeat them. My prayers are with the victims' families. -H,,
937,Jul 3,False,Every American should have the opportunity to live up to their God-given potential.https://amp.twimg.com/v/90f972f2-68e4-43d8-a2a5-e071cd3149c8 …,,
938,Jul 2,False,"""We join all those around the world in mourning his loss"" —Hillary and @BillClinton on the passing of Elie Wiesel pic.twitter.com",,
939,Jul 2,False,We're not going to turn back the clock on progress. pic.twitter.com,,
940,Jul 2,False,"Just like he shouldn’t have his finger on the nuclear button, Trump shouldn’t have his hands on our economy.http://hrc.io/29aqPKS ",,
941,Jul 2,False,"Born July 2, 1951, trans activist Sylvia Rivera was an early LGBT leader whose work paved the way for progress. pic.twitter.com",,
942,Jul 1,False,Praying for the safety of the hostages in Bangladesh. To the terrorists: We will never succumb to fear and hate. -H,,
943,Jul 1,False,"""If the space you’re in doesn’t have room for your voice don’t be afraid to carve out a space of your own."" —Hillaryhttp://hrc.io/298jn3i ",,
944,Jul 1,False,"Trump says people should have pride in ""Made in the USA"" products, but where does he make his?

(Hint: not here.)https://amp.twimg.com/v/a2304043-e6f8-4333-9378-88a3efd7b596 …",,
945,Jun 30,False,Our economy is always stronger with a Democrat in the White House.  http://wpo.st/HYfj1  #TBT pic.twitter.com,,
946,Jun 30,False,"Pride Month is coming to a close, but our march toward equality continues. Onward. pic.twitter.com",,
947,Jun 30,False,"If Republicans actually wanted to protect women's health, they'd support Planned Parenthood—not attack it.https://amp.twimg.com/v/bae671b1-6e18-4c9c-938e-0de05540ae61 …",,
948,Jun 30,False,Scenes from New York City Pride with Team Hillary.https://amp.twimg.com/v/f222e82a-35fb-4e94-8d57-35b170946f7f …,,
949,Jun 29,False,"""I will fight with the people of Puerto Rico to put the island’s economy back on a stable and prosperous path."" pic.twitter.com",,
950,Jun 29,False,"We're not going back, @realDonaldTrump. pic.twitter.com",,
951,Jun 29,False,"They were made in places like:

Mexico
China
Vietnam
Honduras
Hong Kong
Taiwan
South Korea
Singapore
Bangladesh
Omanhttps://twitter.com/realDonaldTrump/status/383599018518929408 …",,
952,Jun 29,False,"Two words: free WiFi.

In train stations, airports and other public spaces.http://hrc.io/294rDTB ",,
953,Jun 28,False,"""All Americans stand united with the people of Turkey against this campaign of hatred and violence."" —Hillary pic.twitter.com",,
954,Jun 28,False,Pat Summitt's record is legendary. Her work ethic—second to none. We need exactly that kind of commitment to end Alzheimer's. -H,,
955,Jun 28,False,"Trump's speaking about outsourcing right now.

Here’s one of his shirts—made in Bangladesh:  http://amzn.to/29lxPpL  pic.twitter.com",,
956,Jun 28,False,It's almost as if Trump only cares about himself.https://twitter.com/washingtonpost/status/747756529353392128 …,,
957,Jun 27,False,Donald Trump proves every day that he’s not in it for the American people—he’s in it only for himself.https://amp.twimg.com/v/b60e5c36-db77-4215-8492-a9cc039c031e …,,
958,Jun 27,False,Today's #SCOTUS decision upholding reproductive rights is a major victory—but we can't take it for granted.http://hrc.io/29iudo8 ,,
959,Jun 27,False,"""This election is about values, so let's just do a few: Donald vs. Hillary."" —@elizabethformahttps://amp.twimg.com/v/581fdaea-8554-4e2e-b488-ab2350283af5 …",,
960,Jun 27,False,"Thanks to the Children's Health Insurance Program, eight million kids like Kayla are covered. Watch the new ad:https://amp.twimg.com/v/6e38fa6c-6d14-4f8e-b0a1-122472e121e8 …",,
961,Jun 27,False,"""You can’t just talk someone into trusting you. You’ve got to earn it ... I believe what you say matters."" —Hillary pic.twitter.com",,
962,Jun 27,False,A great day to hit the campaign trail in Ohio with @ElizabethForMA. pic.twitter.com,,
963,Jun 27,False,"""Hillary believes that racism, hatred, injustice, and bigotry have no place in our country."" —@ElizabethforMAhttps://amp.twimg.com/v/581fdaea-8554-4e2e-b488-ab2350283af5 …",,
964,Jun 27,False,We are not going to let Donald Trump bankrupt America the way he bankrupted his casinos.,,
965,Jun 27,False,"Imagine Trump sitting in the Oval Office the next time America faces a crisis.

Imagine him in charge, with your job and savings at stake.",,
966,Jun 27,False,"Trump rails against other countries and talks about making America great, but his own products are made in places that aren’t named America.",,
967,Jun 27,False,"We'll reward companies that share profits with employees and pay a good wage. If they can do it for executives, they can do it for workers.",,
968,Jun 27,False,"This fight isn't over: The next president has to protect women's health. Women won't be ""punished"" for exercising their basic rights. -H",,
969,Jun 27,False,"SCOTUS's decision is a victory for women in Texas and across America. Safe abortion should be a right—not just on paper, but in reality. -H",,
970,Jun 26,False,Discrimination against LGBT people is all too common—and goes against everything we stand for as a country. pic.twitter.com,,
971,Jun 26,False,When you're in office Americans count on you for real solutions. You can’t respond with a snarky tweet—you have to actually deliver results.,,
972,Jun 26,False,Not even a sit-in in Congress could convince Republican leadership to move forward on gun violence prevention. Americans deserve better.,,
973,Jun 26,False,"No person should be gunned down while learning, teaching, praying, or dancing. It's time for us to come together to strengthen our gun laws.",,
974,Jun 26,False,"""There are more mass shootings in the United States than any other country in the world...We cannot accept this. Not now—not ever."" —Hillary",,
975,Jun 26,False,Happy #NYCPride! pic.twitter.com,,
976,Jun 26,False,"One year ago, love triumphed in our highest court. Yet LGBT Americans still face too many barriers. Let's keep marching until they don't. -H",,
977,Jun 26,False,"Every LGBT American deserves to live, work, and marry free from discrimination or violence.https://amp.twimg.com/v/b783eee2-56af-40b6-b4c0-0dd29496c229 …",,
978,Jun 26,False,One year later (still one of our favorite maps). pic.twitter.com,,
979,Jun 25,False,"To the LGBT community: We're with you.

Love, @HFA.https://amp.twimg.com/v/c8f4e85e-b6f1-46d8-9d77-43a28567f1bc …",,
980,Jun 25,False,"In some states, LGBT Americans can get married on Saturday and fired on Monday. That's not who we are. pic.twitter.com",,
981,Jun 25,False,.@BarneyFrank on the time he marched in NYC's gay pride parade with the First Lady of the United States in 2000.https://amp.twimg.com/v/564d0011-2bd7-41f1-b3b6-545fe5ad065d …,,
982,Jun 24,False,LGBT kids are perfect the way they are. They deserve love and acceptance—not bullying and violence. pic.twitter.com,,
983,Jun 24,False,"Thank you, @POTUS, for marking another important milestone on LGBT Americans' march toward equality. -Hhttps://twitter.com/WhiteHouse/status/746372476804882432 …",,
984,Jun 24,False,"Hours after the #BrexitVote, Donald Trump was in the U.K.

Talking about how he, personally, would benefit.https://amp.twimg.com/v/d0ab5e8c-7150-48d9-8cf1-c9131a0c2f26 …",,
985,Jun 24,False,"""This time of uncertainty only underscores the need for calm, steady, experienced leadership in the White House."" —Hillary #BrexitVote",,
986,Jun 24,False,Our first task has to be to make sure that the economic uncertainty created by these events does not hurt working families. #BrexitVote,,
987,Jun 24,False,"""We respect the choice the people of the United Kingdom have made."" —Hillary #BrexitVote pic.twitter.com",,
988,Jun 23,False,"People in Scotland are not thrilled about Trump coming to their country.

We know the feeling.https://amp.twimg.com/v/7afafdc6-7aba-4b8b-9000-58d682cf72e8 …",,
989,Jun 23,False,"Thank you, #DemocraticSitIn. Your determination has exposed Republican inaction on gun violence and demanded better. We can't give up. -H",,
990,Jun 23,False,"44 years since #TitleIX passed, truer than ever: All students deserve equal opportunity, no matter their gender. pic.twitter.com",,
991,Jun 23,False,"The Supreme Court's Fisher decision is a win for us all. The doors to higher education should be open to every American, not just some. -H",,
992,Jun 23,False,Today's heartbreaking #SCOTUS immigration ruling could tear apart 5 million families facing deportation. We must do better. -H,,
993,Jun 22,False,It’s ridiculous that teachers and nurses have a higher tax rate than many hedge fund managers. pic.twitter.com,,
994,Jun 22,False,"You*

*offer not valid for Muslims, women, Latinos, African Americans, LGBT Americans, middle-class families ...https://twitter.com/realDonaldTrump/status/745733029289615361 …",,
995,Jun 22,False,"House Republicans may have cut the cameras, but they can't cut off our voices. We have to act on gun violence. -Hhttps://twitter.com/repjohnlewis/status/745717018947629056 …",,
996,Jun 22,False,No company in America should be able to pay women less for the work they do. pic.twitter.com,,
997,Jun 22,False,"We can’t let Trump bankrupt America the way he did his casinos.

We need a new chapter in the American Dream – and it can’t be Chapter 11.",,
998,Jun 22,False,"We should support our teachers, not scapegoat them. pic.twitter.com",,
999,Jun 22,False,“The heart of my plan will be the biggest investment in American infrastructure in decades.” —Hillary pic.twitter.com,,
1000,Jun 22,False,"""As we Methodists like to say: do all the good you can for all the people you can in all the ways you can."" —Hillary",,
1001,Jun 22,False,This is what real leadership looks like.https://twitter.com/igorvolsky/status/745638278406242304 …,,
1002,Jun 22,False,FACT: No major company has filed for Chapter 11 more often in the last 30 years than @realDonaldTrump's casinos. pic.twitter.com,,
1003,Jun 21,False,"""Trump's economic plans would destroy the U.S. economy."" —@TheAtlantichttps://amp.twimg.com/v/a7b20130-a48a-45a2-939c-be0c0f637eaa …",,
1004,Jun 21,False,"Trump says, “I love playing with debt.” Someone should tell him our economy isn’t a game.http://hrc.io/28MhzPK ",,
1005,Jun 21,False,"Trump's plan would cut more taxes for the 120,000 richest families than it would for 120 million working Americans.https://amp.twimg.com/v/96d7e7c6-d9dd-4c43-bd59-e7b248fc61f9 …",,
1006,Jun 21,False,".@realDonaldTrump has written a lot of books about business, but they all seem to end at Chapter 11.https://amp.twimg.com/v/86372716-ccb0-4e23-b969-54520820b713 …",,
1007,Jun 21,False,"In America, we don’t begrudge people being successful – but we know they shouldn’t do it by destroying other people. pic.twitter.com",,
1008,Jun 21,False,".@realDonaldTrump, only someone who’s never actually faced the consequences of his mistakes would brag, “I play with bankruptcy.”",,
1009,Jun 21,False,Trump has written a lot of books about business—but they all seem to end at Chapter 11.,,
1010,Jun 21,False,"""President Trump"" would undo so much of the progress we’ve made over the past 8 years under President Obama.

We can't let that happen.",,
1011,Jun 21,False,"What is Trump spending his meager campaign resources on? Why, himself, of course.https://twitter.com/derekwillis/status/745082013321990145 …",,
1012,Jun 21,False,"""Trump's economic proposals could produce a prolonged recession...and reduce employment by 3.5 million jobs."" —@WSJhttps://amp.twimg.com/v/4786d925-75da-4388-b404-9e656c9c949e …",,
1013,Jun 21,False,"Trump's gotten rich driving companies into the ground. What will he do to the U.S. economy?

Oh wait—we know:https://amp.twimg.com/v/4786d925-75da-4388-b404-9e656c9c949e …",,
1014,Jun 20,False,".@JoeBiden is right—Donald Trump’s worldview doesn't reflect our values, and it’s not who we are.https://twitter.com/VPLive/status/744957781917188096 …",,
1015,Jun 20,False,It’s time to demand more than thoughts and prayers from our elected officials.  http://hrc.io/28O4e9p  #DisarmHate pic.twitter.com,,
1016,Jun 20,False,Enough. -H pic.twitter.com,,
1017,Jun 20,False,"An overwhelming majority of Americans (and gun owners) support steps to reduce gun violence.

RT if you're one of them. #DisarmHate",,
1018,Jun 20,False,"America has always been a nation of immigrants and refugees. On #WorldRefugeeDay, let's reaffirm our commitment to welcoming them. -H",,
1019,Jun 20,False,This is just common sense. It's time for Congress to act. pic.twitter.com,,
1020,Jun 20,False,Happy first day of summer. pic.twitter.com,,
1021,Jun 19,False,Gay rights are human rights and human rights are gay rights. Being LGBT does not make you less human.https://amp.twimg.com/v/6453ed51-7157-48a3-aec7-f5fae0f348aa …,,
1022,Jun 19,False,"What a joy being with our new grandson, Aidan. So grateful. -H pic.twitter.com",,
1023,Jun 19,False,"Happy Father's Day, @BillClinton! pic.twitter.com",,
1024,Jun 18,False,"“I’m supporting Hillary Clinton because she’s a fighter, a fighter with guts.” —@SenWarren to the @BostonGlobehttp://bos.gl/1DXZ4vD ",,
1025,Jun 18,False,"If your business or organization is hiring and needs someone to get the job done, hire a veteran.https://amp.twimg.com/v/2a43c3ae-0f7f-4871-b2bc-adc24233f022 …",,
1026,Jun 18,False,"On June 18, 1983, Sally Ride became the first American woman and first LGBT astronaut to go to space. pic.twitter.com",,
1027,Jun 17,False,"Gun violence and hate aren't isolated—homophobia in Orlando, racism in Charleston. We need to fight them together. pic.twitter.com",,
1028,Jun 17,False,One year ago we lost 9 lives in Charleston. 49 in Orlando on Sunday. 26 in Newtown. Too many others. This has to stop. We need to change. -H,,
1029,Jun 17,False,"You don't have to be LGBT to stand with the LGBT community. We all have a stake in equality. Thank you, Michael.http://hrc.io/24VTsB1 ",,
1030,Jun 17,False,"Donald Trump says he's ""the real friend"" of the LGBT community.

Yeah, no.https://amp.twimg.com/v/b3afb2a3-1b6f-43d3-845d-4811ef514fb4 …",,
1031,Jun 17,False,Helpful.https://twitter.com/NYTMetro/status/743448057065398273 …,,
1032,Jun 16,False,Hard to believe it's only been a year since Trump announced his candidacy for president.https://amp.twimg.com/v/0e0fa0af-7eb2-454a-bd2e-b04b7c480661 …,,
1033,Jun 16,False,"""It is cruel and terrible that her life was cut short by a violent act of political intolerance"" —Hillary on Jo Cox: http://hrc.io/1Xst4iT ",,
1034,Jun 16,False,.@oprah Thank you. It’s an honor to have the support of someone who's shattered so many glass ceilings.http://et.tv/1YsNqYy ,,
1035,Jun 16,False,"Thanks Chris, for showing what leadership looks like. I hope GOP senators take note. Looking forward to the vote. -Hhttps://twitter.com/ChrisMurphyCT/status/743400931237199872 …",,
1036,Jun 16,False,Hillary helped get health care for 8 million kids. One of the first ads of the general election:https://amp.twimg.com/v/e8bc74be-0df8-4a26-9b95-d8369acdb9f5 …,,
1037,Jun 16,False,"One year ago today, @realDonaldTrump announced his campaign for president.

And what a year it's been.https://amp.twimg.com/v/0e0fa0af-7eb2-454a-bd2e-b04b7c480661 …",,
1038,Jun 16,False,"It's absurd that people with suspected terrorist links can buy a gun in America, no questions asked. pic.twitter.com",,
1039,Jun 15,False,"Belgium: Donald Trump's favorite ""city.""https://amp.twimg.com/v/8200e91b-711f-4c13-a5d1-8e4c98430ef0 …",,
1040,Jun 15,False,"Thank you, @SenWarren. Proud to be in this fight with you. pic.twitter.com",,
1041,Jun 15,False,Some fights are too important to stay silent. Preventing gun violence is one of them. Stand strong @ChrisMurphyCT.https://twitter.com/ChrisMurphyCT/status/743104582520307712 …,,
1042,Jun 15,False,Your @GOP presidential nominee responding to a terrorist attack with lies and conspiracy theories.https://amp.twimg.com/v/ff014d32-b1dc-4a0b-82e8-019d102cde44 …,,
1043,Jun 15,False,Donald Trump is an expert at distracting people from the fact that he has nothing substantive to say for himself. pic.twitter.com,,
1044,Jun 14,False,"America has always been a country of ""we,"" not ""me."" And we've always been stronger together. pic.twitter.com",,
1045,Jun 14,False,"We just won Washington, D.C.! Grateful to everyone who voted. pic.twitter.com",,
1046,Jun 14,False,"This is one nation under God, indivisible, with liberty and justice for all. Not just for those who look or love or worship one way—for all.",,
1047,Jun 14,False,"People can’t board planes with full shampoo bottles—but people being watched by the FBI for terrorism can buy a gun, no questions asked?",,
1048,Jun 14,False,Trump's statements are lies—but he tells them because he has to distract from the fact that he has nothing substantive to say for himself.,,
1049,Jun 14,False,"Trump's Muslim ban is wrong, dangerous, and in this instance, nonsensical. The terrorist in Orlando was born in Queens—just like Donald.",,
1050,Jun 14,False,"People of different faiths, backgrounds, sexual orientations, and gender identities are coming together to say: we won’t let hate defeat us.",,
1051,Jun 14,False,Gun violence prevention laws might not stop every shooting or terrorist attack—but they will save lives. pic.twitter.com,,
1052,Jun 14,False,"If you’re too dangerous to get on a plane, you're too dangerous to buy a gun in America.https://amp.twimg.com/v/8de8036e-2bf7-4ef6-b0bc-069c8ff76690 …",,
1053,Jun 13,False,Weapons of war like those used in Orlando and San Bernardino have no place on our streets.https://amp.twimg.com/v/8de8036e-2bf7-4ef6-b0bc-069c8ff76690 …,,
1054,Jun 13,False,Our diversity isn’t a liability in the fight against terrorism. It’s an asset. It makes us stronger. pic.twitter.com,,
1055,Jun 13,False,We have to stand together and be proud together. There is no better rebuke to the terrorists and all those who hate. pic.twitter.com,,
