,date,retweet,text,,
1731,Feb 26,False,Sometimes running for president involves crashing a bachelor party. pic.twitter.com,,
1732,Feb 26,False,It's outrageous that students are being asked to pay interest rates higher than you would pay to buy a house.https://amp.twimg.com/v/e0dae76e-6c8c-49e2-b1f8-31569a95f4ff …,,
1733,Feb 26,False,"Obamacare saved this woman when she needed emergency surgery. Let's build on its progress, not start over.https://amp.twimg.com/v/d980ef6e-b164-4bf6-8493-cbc45063e9aa …",,
1734,Feb 26,False,"It's been less than a week since a mass shooting tore apart a community, and now another. This has to end. Praying for Hesston, KS. -H",,
1735,Feb 25,False,"No matter which Republican is nominated, we can’t afford to let him in the White House. Add your name if you agree.http://hrc.io/1Rrjmbm ",,
1736,Feb 25,False,We live in a world with serious foreign policy challenges. We need serious leadership. #GOPdebate pic.twitter.com,,
1737,Feb 25,False,"Affordable health care should be a human right in America, not a privilege. We will not let Republicans repeal the ACA. #GOPdebate",,
1738,Feb 25,False,Planned Parenthood provides critical health care to millions of Americans. Republicans vow they'll defund it. Not on our watch. #GOPdebate,,
1739,Feb 25,False,".@POTUS is doing his job to fill the vacancy on the Supreme Court. @marcorubio, @tedcruz, and GOP senators should do theirs. #GOPdebate",,
1740,Feb 25,False,"We should build a path to citizenship, not a wall on the border. #GOPdebate",,
1741,Feb 25,False,Let's break down barriers—not build new walls. #GOPdebate pic.twitter.com,,
1742,Feb 25,False,We are not going to deport 12 million people. Demonizing immigrants is beneath our values. #GOPdebate,,
1743,Feb 25,False,"The #GOPdebate candidates all hold backward views on LGBT rights, women, and health care.  http://hrc.io/1KOZakv  pic.twitter.com",,
1744,Feb 25,False,America never stopped being great. We just need to make it work for everyone. #GOPdebate pic.twitter.com,,
1745,Feb 24,False,"Follow @HFA to hear from the millions of volunteers, supporters, organizers, and donors who power this campaign. pic.twitter.com",,
1746,Feb 24,False,"The Puerto Rican senate just confirmed Maite Oronoz Rodríguez, making her the first LGBT chief justice in the US. pic.twitter.com",,
1747,Feb 24,False,Joining @IAmSteveHarvey today to continue the conversation he's been having on guns in America. Don’t miss it!https://amp.twimg.com/v/ee487289-d4b9-43a3-94b9-398ea961bc93 …,,
1748,Feb 24,False,Proud to have Senator Reid on this team.  http://hrc.io/1XN50o8  pic.twitter.com,,
1749,Feb 24,False,It isn’t right that we have kids trying to learn in crumbling classrooms. We need to invest in neglected communities.,,
1750,Feb 23,False,Recognizing privilege and dismantling systemic racism is on all of us. #DemTownHallhttps://amp.twimg.com/v/643f297e-e4df-4753-8527-5c3861e2b5d6 …,,
1751,Feb 23,False,"""I'm most concerned about the kids who are left out and left behind."" #DemTownHall",,
1752,Feb 23,False,We will never let Republicans privatize Social Security. We will protect it and expand it. #DemTownHall,,
1753,Feb 23,False,"People who are working hard should get the respect, dignity, and income they deserve. Middle-class families need a raise. #DemTownHall",,
1754,Feb 23,False,We need to make college affordable. We also need to lift the enormous burden of student debt that millions carry right now. #DemTownHall,,
1755,Feb 23,False,"Systemic racism is found in our criminal justice system, housing, education—but it's also cultural. We have to combat it all. #DemTownHall",,
1756,Feb 23,False,"If this team wins the White House, Virginia is invited to come by and dance any time.  http://hrc.io/1KIbG5m  pic.twitter.com",,
1757,Feb 23,False,Wall Street can never be allowed to wreck Main Street again. No bank can be too big to fail and no executive can be too powerful to jail.,,
1758,Feb 22,False,"In Ohio and across the country, Republicans are once again attacking women's health. We won't stand for this.http://hrc.io/1PTP6Wh ",,
1759,Feb 22,False,“She is the 'what can I do?' candidate.” @BillClinton on Hillary’s commitment to helping communities left behind.https://amp.twimg.com/v/ef8a830f-232c-4678-8552-7ded7006e6e9 …,,
1760,Feb 22,False,".@clairecmc If ever cancer picked the wrong person to mess with, it's you. Stay strong and take care of yourself. I'm in your corner. -H",,
1761,Feb 22,False,How one law gives gun makers immunity from accountability and could derail justice for Sandy Hook families.http://hrc.io/1Q6tfsD ,,
1762,Feb 22,False,It's 2016. A woman's place is...wherever she wants it to be.https://twitter.com/thomaskaplan/status/701803313734533120 …,,
1763,Feb 22,False,What’s at stake in this election is whether or not we’re going to help every kid reach their potential.https://amp.twimg.com/v/0e0e5a79-e504-4998-b570-c574d60eddce …,,
1764,Feb 22,False,"If we face the reality of systemic racism, we can begin to reform our broken criminal justice & immigration systems.http://hrc.io/1mSIM6I ",,
1765,Feb 21,False,Torture doesn't work. It's wrong. These dangerous words from Republicans have no place in our country. http://hrc.io/1Q0xTIl  -H,,
1766,Feb 21,False,Behind the scenes *right* after our win in Nevada.https://amp.twimg.com/v/7f190e19-b79c-44f3-a8e0-1ab9bd8b1cd9 …,,
1767,Feb 21,False,"Together, this is the kind of world we can build for the next generations.https://amp.twimg.com/v/18b11a5a-2728-49e6-abe9-f5a49f65b002 …",,
1768,Feb 21,False,Our hearts are in Kalamazoo today. We must end this epidemic. Communities across the country are paying the cost for inaction. -H,,
1769,Feb 21,False,"Our schools should lead students towards opportunity, not prison. pic.twitter.com",,
1770,Feb 20,False,"This is a campaign to break down every barrier that holds us back. If we work together, anything is possible.https://amp.twimg.com/v/1e974da7-9e81-430a-82e5-1683da435dba …",,
1771,Feb 20,False,"Some may have doubted us, but we never doubted each other.http://hrc.io/1ReVAzk ",,
1772,Feb 20,False,“I’ve never believed in dividing America between ‘us’ and ‘them.’ We are all in this together. We all have to do our part.” —Hillary,,
1773,Feb 20,False,No one can get this done alone—not even the President of the United States. It’s got to be the mission of our entire nation.,,
1774,Feb 20,False,"The truth is, we aren’t a single-issue country. We need more than a plan for the big banks. The middle class needs a raise.",,
1775,Feb 20,False,"“To all my supporters out there—some may have doubted us, but we never doubted each other. This one’s for you.” —Hillary in NV",,
1776,Feb 20,False,"Together, we can win the nomination and keep working to break every barrier holding Americans back. Chip in now:http://hrc.io/24ikEN0 ",,
1777,Feb 20,False,"The feeling is mutual, Nevada. pic.twitter.com",,
1778,Feb 20,False,To everyone who turned out in every corner of Nevada with determination and heart: This is your win. Thank you. -H,,
1779,Feb 20,False,"Nevada: If you're in line, stay there—and talk to your neighbors about Hillary! pic.twitter.com",,
1780,Feb 20,False,"In a few hours, Nevadans will head out to caucus. RT if you're standing with Hillary. pic.twitter.com",,
1781,Feb 20,False,"Will Ferrell has a message for you, Nevada: Caucus for Hillary today at 11AM. Your location: http://hillaryclinton.com/nevada https://amp.twimg.com/v/102319d2-ee57-4183-8e78-9ce059b8fa82 …",,
1782,Feb 20,False,The Nevada caucus is TODAY! Now is the time to stand with Hillary. Join the team:  http://hrc.io/NVCommit  pic.twitter.com,,
1783,Feb 19,False,"Do all the good you can, for all the people you can, for as long as you can.https://amp.twimg.com/v/c917f6c4-b768-470d-9dd0-bbd22dfd6180 …",,
1784,Feb 19,False,"Kids being sent into the criminal justice system instead of school is a civil rights issue, and it needs to end.https://amp.twimg.com/v/74dff3e8-cffa-4be4-a735-95988f086265 …",,
1785,Feb 19,False,Too many kids are being criminalized instead of educated. Here's how we will end the school-to-prison pipeline: http://hrc.io/1Ww20eS ,,
1786,Feb 19,False,.@POTUS' achievements speak for themselves. The idea that supporting him is a ploy to win black votes is baffling.https://twitter.com/ABCLiz/status/700435385856331776 …,,
1787,Feb 19,False,So proud to have Congressman Jim Clyburn on this team. pic.twitter.com,,
1788,Feb 19,False,“We feel very blessed with opportunity—like we’ve reached our American dream. That started with an immigrant story.”https://amp.twimg.com/v/78a8ab0b-e3cb-4f9c-b125-715a71c7d2da …,,
1789,Feb 18,False,We will have legislation to enact comprehensive immigration reform before Congress within my first 100 days in office.,,
1790,Feb 18,False,You voted for it. http://hrc.io/1LwjmlS  #DemTownHallhttps://twitter.com/BernieSanders/status/700520348438016002 …,,
1791,Feb 18,False,"""You are more likely to get a mortgage application if you're white than if you're black or Latino. That has to end."" #DemTownHall",,
1792,Feb 18,False,"""I am a progressive who likes to make progress. I don't make promises I can't keep."" —Hillary #DemTownHall",,
1793,Feb 18,False,"“I’m going to do everything I can so you don’t have to be scared. Let me do the worrying, is that a deal?”https://amp.twimg.com/v/4128aaf9-fe13-482a-a17d-a753d99bfad0 …",,
1794,Feb 18,False,"It's 2016. Women deserve equal pay. Thanks for leading this effort in Oklahoma, @RepEmilyVirgin & @jdunnington. -Hhttps://twitter.com/RepEmilyVirgin/status/700110430652362752 …",,
1795,Feb 18,False,We cannot back down from breaking the barriers that keep us from living up to our full potential. pic.twitter.com,,
1796,Feb 18,False,"""She has been truly loyal to President Obama and is the best person to protect & build on his legacy."" —Bill Murphyhttp://hrc.io/211ANHB ",,
1797,Feb 18,False,No child should have to live in fear of losing her parents. We need to support DREAMers and keep families together.https://amp.twimg.com/v/b58c0387-9a73-48eb-ae88-6c378702dfb3 …,,
1798,Feb 18,False,We need to face up to the reality of systemic racism and then work to dismantle it. pic.twitter.com,,
1799,Feb 17,False,We honor Sandra Bland's memory by acting to reform policing practices. Proud to have her mom Geneva on this team. pic.twitter.com,,
1800,Feb 17,False,"Thankful for @Pontifex's visit to the border and call for immigration reform. We need to keep families together, not break them apart.",,
1801,Feb 17,False,The inequities that persist in our justice system undermine our shared vision of what America can and should be. pic.twitter.com,,
1802,Feb 17,False,Anyone asking for your vote has to grapple with the reality of inequality in America—and offer real plans to fix it. pic.twitter.com,,
1803,Feb 17,False,No American should work 40 hours/week and still struggle to make ends meet—not in Alabama and not anywhere else. http://hrc.io/217av3a  -H,,
1804,Feb 16,False,These are not only issues of economic inequality—they are also issues of racial inequality.https://amp.twimg.com/v/ca6c7a5a-ec78-4d13-94b9-942078495879 …,,
1805,Feb 16,False,Something’s wrong when the median wealth for black families is a tiny fraction of what it is for white families.http://hrc.io/1oIiCW0 ,,
1806,Feb 16,False,"""We need to recognize our privilege and practice humility, rather than assume that our experiences are everyone’s experiences."" —Hillary",,
1807,Feb 16,False,"""White Americans need to do a better job of listening when African Americans talk about the seen & unseen barriers that you face every day.""",,
1808,Feb 16,False,"""Ending systemic racism requires contributions from all of us—especially those of us who haven’t experienced it ourselves."" —Hillary",,
1809,Feb 16,False,"""I’ll be the first to admit...I’ve made my own mistakes; I've walked my own journey. But I believe with all my heart that we can do better.""",,
1810,Feb 16,False,"Anyone asking for your vote has a responsibility to grapple with reality—to see things as they actually are, not just as we want them to be.",,
1811,Feb 16,False,"""Something’s wrong when black kids get arrested for petty crimes but white CEOs get away with fleecing our entire country."" —Hillary",,
1812,Feb 16,False,"It’s not a coincidence that the Flint water crisis was allowed to happen in a largely black, largely poor community.",,
1813,Feb 16,False,"We need a president who will tackle all the issues we face, from systemic racism to LGBT discrimination.https://amp.twimg.com/v/2fba5951-730e-4bc5-9c59-0dfbb345c089 …",,
1814,Feb 16,False,"We need Wall Street and campaign finance reform, but that's not enough. We need to break down barriers that hold back communities of color.",,
1815,Feb 16,False,.@POTUS is doing his job by nominating a new Supreme Court justice. Tell Senate Republicans to do theirs:http://hrc.io/216ELLv ,,
1816,Feb 15,False,"11 So, a message for Senate Republicans: Fill this vacancy. @POTUS will do his job. Do yours. -H",,
1817,Feb 15,False,"10 As for complaints that this is an election year: 1988 was an election year, too—and Justice Kennedy was confirmed 97-0. -H",,
1818,Feb 15,False,9 There are 339 days until the next president takes office. The Senate has never taken more than 125 days to vote on a SCOTUS nominee. -H,,
1819,Feb 15,False,"8 I have news for Republicans who would put politics over the Constitution: Refusing to do your duty isn’t righteous, it's disgraceful. -H",,
1820,Feb 15,False,2 The need to fill the Supreme Court vacancy is not an occasion for politics as usual. This has real and urgent stakes for Americans now. -H,,
1821,Feb 15,False,"1 Until Jan. 20, 2017, it's @POTUS' job to nominate Supreme Court justices—it's right there in the Constitution. -H pic.twitter.com",,
1822,Feb 15,False,"Can we get back to politics, please? (Great job, @HamiltonMusical.) #Grammys",,
1823,Feb 15,False,"Today, Planned Parenthood re-opens in Colorado Springs—a testament to hope in the face of hostility and violence. http://hrc.io/20WlYG2  -H",,
1824,Feb 14,False,"The ability to exercise your reproductive rights should be a reality for all, not just those who can afford it. pic.twitter.com",,
1825,Feb 14,False,Black families are denied mortgages nearly 3x as often as white families. We need to tear down barriers of systemic racism that still exist.,,
1826,Feb 14,False,Obamacare has brought millions of Americans health care they need. They can't wait for promises that can't be kept.https://amp.twimg.com/v/dcb7f4d0-d3f0-4b70-a0ea-5ce2fcb4a642 …,,
1827,Feb 14,False,"Obama is president until Jan. 20, 2017. It's his job to nominate a justice, the Senate has a responsibility to vote. pic.twitter.com",,
1828,Feb 14,False,Happy Valentine’s Day! pic.twitter.com,,
1829,Feb 13,False,Takeaway from #GOPdebate: We can't let one of these guys rip away the progress we've made. Sign on if you agree:http://hrc.io/1oALbVj ,,
1830,Feb 13,False,"If anyone needed a reminder of how important it is to elect a Democratic president, look at the Supreme Court.https://amp.twimg.com/v/9d855093-a5b2-4125-b62e-70c384cac05c …",,
1831,Feb 13,False,"Demonizing immigrants, dangerous foreign policy proposals, and nonstop bickering—no need to live-tweet #GOPdebate. We've seen enough.",,
1832,Feb 13,False,"""All of us Democrats have a responsibility to make sure a Republican doesn’t win and rip away all the progress we've made."" —Hillary in CO",,
1833,Feb 13,False,"""Elections have consequences. The president has a responsibility to nominate a new justice and the Senate has a responsibility to vote.""",,
1834,Feb 13,False,"""Barack Obama is President of the United States until January 20, 2017—that is a fact, whether the Republicans like it or not."" —Hillary",,
1835,Feb 13,False,"""It's outrageous that Republicans...have already pledged to block any [Supreme Court] replacement that President Obama nominates."" —Hillary",,
1836,Feb 13,False,Statement on the passing of Supreme Court Justice Antonin Scalia: pic.twitter.com,,
1837,Feb 13,False,There are six Republicans left in the race for the White House—and we can’t afford to let any of them near it.http://hrc.io/1O8JD9K ,,
1838,Feb 13,False,This is a fight for everyone who's ever been knocked down—but refused to be knocked out. pic.twitter.com,,
1839,Feb 12,False,A socialist feminist on why she'll vote for Hillary:http://hrc.io/1TXXFCq ,,
1840,Feb 12,False,"Excited to announce the #ImWithHer concert at Radio City with @katyperry, @eltonofficial, & @AndraDayMusic! Join us:http://hrc.io/1PRWtP5 ",,
1841,Feb 12,False,"If we solved our problems with Wall Street tomorrow, we'd still have discrimination holding too many Americans back.https://amp.twimg.com/v/65b25ce4-ffd3-4561-930d-d680842dfd24 …",,
1842,Feb 11,False,"""I am not a single-issue candidate and I do not believe we live in a single-issue country."" #DemDebatehttps://amp.twimg.com/v/c1475b49-0336-4813-9364-4bfd2ff69b3a …",,
1843,Feb 11,False,RT if you agree. #DemDebate pic.twitter.com,,
1844,Feb 11,False,President Obama doesn't get the credit he deserves. His accomplishments shouldn't be up for debate at a #DemDebate.,,
1845,Feb 11,False,"Yeah, @BernieSanders—she's got a *bit* of experience. http://hrc.io/20rNoOE  #DemDebate",,
1846,Feb 11,False,A vote in 2002 is not a plan to defeat ISIS in 2016. #DemDebate,,
1847,Feb 11,False,There are two candidates on stage at the #DemDebate. Only one is ready to be commander in chief.,,
1848,Feb 11,False,"We need to knock down the barriers of racism, sexism, and discrimination holding Americans back. #DemDebatehttps://amp.twimg.com/v/f9d7b048-3a42-48c7-bc56-717f1fd03ff2 …",,
1849,Feb 11,False,"""We are not going to deport 11 or 12 million people in this country."" #DemDebate pic.twitter.com",,
1850,Feb 11,False,"When we talk about criminal justice reform, we also have to talk about jobs, education, and housing. #DemDebate pic.twitter.com",,
1851,Feb 11,False,"We need a leader on women's health—not just somebody who votes right, but somebody who leads the effort. #DemDebate pic.twitter.com",,
1852,Feb 11,False,"""I think we still have some barriers to knock down—that's why this has been at the core of my campaign."" #DemDebate pic.twitter.com",,
1853,Feb 11,False,Cheering her  on at tonight’s #DemDebate? RT this to let her know. pic.twitter.com,,
1854,Feb 11,False,"""More than anyone else in America today, she is prepared to be president...day one."" —@repjohnlewishttps://amp.twimg.com/v/96602b4e-5b0e-4ea9-be99-cc164712e922 …",,
1855,Feb 11,False,Let's dispel with this fiction that @POTUS doesn't know what he's doing. He knows exactly what he's doing.http://hrc.io/1PPFU6s ,,
1856,Feb 11,False,Asking Tamir's family to pay for his ambulance is heartless. Cleveland should drop this fee. http://hrc.io/1RtmTrF  -H,,
1857,Feb 11,False,HBCUs graduate the majority of African American teachers in our country. We should support and reward HBCUs and the vital role they play.,,
1858,Feb 10,False,We're going to fight for real solutions that make a real difference in people's lives. pic.twitter.com,,
1859,Feb 10,False,The next president could transform SCOTUS for decades. Whether we fight climate change or sit by is at stake. http://hrc.io/1o02X3y  -H,,
1860,Feb 10,False,"It’s not whether you get knocked down that matters, it’s whether you get back up.https://amp.twimg.com/v/d7ed68a6-e0f4-4e7a-a936-8fecfbfa27d0 …",,
1861,Feb 10,False,"Glowing with pride in Columbia, South Carolina. pic.twitter.com",,
1862,Feb 10,False,Fighting to improve the lives of kids and families—and never giving up.https://amp.twimg.com/v/593d15e2-b324-44b3-93c6-b03be5412599 …,,
1863,Feb 10,False,You’re the reason we’re going to win this nomination and then win this election together.http://hrc.io/1V3tubk ,,
1864,Feb 9,False,This is only the beginning. We fought hard for every vote—now we take this campaign to the entire country. http://hrc.io/1T5Si3f ,,
1865,Feb 9,False,"If you’re standing with Hillary tonight, let her know. pic.twitter.com",,
1866,Feb 9,False,To everyone who supports this campaign: Thank you. You’re the reason we’re here. http://hrc.io/1PBehdU https://amp.twimg.com/v/d63ff279-eb2a-468f-b8c9-287657745635 …,,
1867,Feb 9,False,Add your name if you're with Hillary and ready to fight twice as hard.http://hrc.io/1QU8VN9 ,,
1868,Feb 9,False,"""A president has to make sure nothing holds you back—not debt, not discrimination, not a deck that’s always stacked for those at the top.""",,
1869,Feb 9,False,"""People are angry. And they have every right to be. But I know they’re also hungry. They’re hungry for solutions."" —Hillary",,
1870,Feb 9,False,"To @BernieSanders, congratulations. To New Hampshire, thank you. And to our volunteers: I’m so grateful for what you built. Now, onward. -H",,
1871,Feb 9,False,Say “Hillary”! pic.twitter.com,,
1872,Feb 9,False,"It's New Hampshire Primary Day! If you're with Hillary, let her know why by tweeting #ImWithHer. pic.twitter.com",,
1873,Feb 9,False,"Granite Staters, today's your day. RT this to remind everyone voting today why we need Hillary in the White House. pic.twitter.com",,
1874,Feb 9,False,"Good morning, New Hampshire! See you at the polls. pic.twitter.com",,
1875,Feb 8,False,"""She's never stopped fighting for children."" 4 people explain why they canvass for Hillary:  http://hrc.io/23TMS0i  pic.twitter.com",,
1876,Feb 8,False,"""I will get up every day and do everything I can to make a real difference for you, your families, and our country."" —Hillary in NH",,
1877,Feb 8,False,"""It's not enough for a president to stop bad things from happening...I think it's important to try to start good things."" —Hillary in NH",,
1878,Feb 8,False,"America's opportunity gap is not just about economic inequality. It is also about racial inequality, and we need to tackle both together.",,
1879,Feb 8,False,"""I am here because for nearly two years, Flint's water was poisoned.""https://amp.twimg.com/v/6ed63f9b-1e53-48d8-9973-80b4b7a47098 …",,
1880,Feb 8,False,"Pancakes, coffee, and laughs in Manchester, New Hampshire. pic.twitter.com",,
1881,Feb 8,False,Sending warmest wishes to everyone celebrating the Lunar New Year! May you have peace and prosperity in the year ahead. -H,,
1882,Feb 8,False,This is it: Your last chance to say you're with Hillary before the New Hampshire primary! Commit today:http://hrc.io/1VWYfyO ,,
1883,Feb 7,False,"""The children of Flint are just as precious as the children of any other part of America."" —Hillary in Flint today pic.twitter.com",,
1884,Feb 7,False,“Do not grow weary doing good. Do not get discouraged. Do not give up.” —Hillary in Flinthttps://amp.twimg.com/v/82b816a9-4c72-4ee8-9d75-013e9a2ab618 …,,
1885,Feb 7,False,"""This is not merely unacceptable or wrong, though it is both. What happened in Flint is immoral.""https://amp.twimg.com/v/676e0ce2-1c5f-4ab2-9245-f73072af4601 …",,
1886,Feb 7,False,Civil rights activist Fannie Lou Hamer dedicated her life to securing voting rights & ending racial injustice. #BHM pic.twitter.com,,
1887,Feb 6,False,Only reaction to #GOPdebate? Bring it on. pic.twitter.com,,
1888,Feb 6,False,".@RealDonaldTrump: “I’m the last person she wants to run against."" #GOPdebate pic.twitter.com",,
1889,Feb 6,False,"When Republican candidates describe deporting millions of immigrants & repealing the ACA as ""leadership."" #GOPdebate pic.twitter.com",,
1890,Feb 6,False,Confirmed. #GOPdebate pic.twitter.com,,
1891,Feb 6,False,Here we go. #GOPdebate pic.twitter.com,,
1892,Feb 6,False,"Knocking on doors and talking to voters in snowy Manchester, New Hampshire. pic.twitter.com",,
1893,Feb 6,False,"Well done, @NYGovCuomo. LGBT kids don't need to be ""cured"" of anything.https://twitter.com/NYGovCuomo/status/696020683894161408 …",,
1894,Feb 6,False,"A moment backstage in Manchester, NH: ""I'm taking care of my mom, she has Alzheimer's.""https://amp.twimg.com/v/07d6316b-eac1-4188-88dd-d3ad26092249 …",,
1895,Feb 5,False,"You should never have to choose between your family & your paycheck. Proud of all we accomplished with #FMLA23—next, paid leave for all. -H",,
1896,Feb 5,False,"""I’m a progressive who likes to get things done. And I’ve learned that you have to be both a dreamer and a doer."" —Hillary in NH",,
1897,Feb 5,False,"""Sen. Sanders & I share big, progressive goals for our country—but I believe I’ve laid out stronger plans for how to achieve them."" —Hillary",,
1898,Feb 5,False,"""We also need to break barriers of racism, sexism, discrimination against LGBT Americans, immigrants, & people with disabilities."" —Hillary",,
1899,Feb 5,False,Dedication. pic.twitter.com,,
1900,Feb 5,False,".@BernieSanders I won't cut Social Security. As always, I'll defend it, & I'll expand it. Enough false innuendos. http://hrc.io/socialsecurity  -H",,
1901,Feb 5,False,"“If the kids in a rich suburb of Detroit had been drinking contaminated water, there would have been action.”https://amp.twimg.com/v/b51cf494-97dd-462e-a901-c280049d684d …",,
1902,Feb 5,False,My heart is with @SybrinaFulton on Trayvon's birthday. Today I'm carrying the memories of his life she shared with me. -H,,
1903,Feb 5,False,"In 1968, Shirley Chisholm became the first African American woman elected to Congress. #BlackHistoryMonth pic.twitter.com",,
1904,Feb 4,False,Share this if you agree. #DemDebate pic.twitter.com,,
1905,Feb 4,False,There is no place in America for second-class citizenship. #DemDebate pic.twitter.com,,
1906,Feb 4,False,There are more Flints out there—overwhelmingly low-income communities of color. This is unconscionable. #DemDebate,,
