,date,retweet,text,,
0,Oct 9,False,Remember. #Debate pic.twitter.com,,
1,Oct 10,False,"If Trump stands by what he said about women as “locker room talk,” he's clearly not sorry. pic.twitter.com",,
2,Oct 9,False,She won.  http://hrc.io/2dQkjip  #Debate pic.twitter.com,,
3,15m15 minutes ago,False,"""We are Black, we are proud, and here’s why we are working to elect Hillary."" @HFA staffers on why they're with her:  http://hrc.io/2dCyF2E  pic.twitter.com",,
4,3h3 hours ago,False,"One adviser called Hillary's efforts to get kids health insurance a ""one-woman army inside the White House.""http://hrc.io/2e4221g ",,
5,5h5 hours ago,False,"""Everyone knows how bright she is and how resilient she is, but...they're going to see how much she cares."" —@JoeBiden pic.twitter.com",,
6,5h5 hours ago,False,"""All the progress we've made these last 8 years is on the ballot."" —@POTUS

Make sure you're ready to vote:http://IWillVote.com ",,
7,5h5 hours ago,False,"""You have a chance to reject the politics of fear. You can lift up again the politics of hope.” —@POTUS http://IWillVote.com ",,
8,5h5 hours ago,False,"""Change is possible, but it doesn’t just depend on one person—it depends on all of us.” —@POTUS http://hillaryclinton.com/volunteer  #StrongerTogether",,
9,5h5 hours ago,False,"""She knows that in a democracy as big and diverse as this, we can't demonize each other.” —@POTUS on Hillary",,
10,5h5 hours ago,False,"""He may be up at 3am, but it’s because he’s tweeting insults at somebody who got under his skin.” —@POTUS on Trump",,
11,5h5 hours ago,False,“She's got the knowledge and experience and the temperament to be the next Commander-in-Chief.” —@POTUS on Hillary,,
12,6h6 hours ago,False,"""She's in the arena for you, fighting every day to make sure everybody gets a fair shake.” —@POTUS on Hillary",,
13,6h6 hours ago,False,"""Hillary is one of the smartest, toughest, best-prepared, most experienced candidates to ever run for this job.” —@POTUS",,
14,6h6 hours ago,False,"""You can go vote early right now. Early voting started on Wednesday...go to http://IWillVote.com/locate ."" —@POTUS in Ohio",,
15,6h6 hours ago,False,"What's ""smart"" about not funding America's military, schools, or health care for kids?http://hrc.io/2e3q3Fq ",,
16,7h7 hours ago,False,"""If you vote for someone other than Hillary—or if you don't vote at all—then you are helping to elect her opponent."" —@FLOTUS pic.twitter.com",,
17,9h9 hours ago,False,"""If we let Hillary's opponent win this election, then we are sending a clear message to our kids."" —@FLOTUS  http://IWillVote.com  pic.twitter.com",,
18,Oct 12,False,We have to win this election.,,
19,Oct 11,False,"Coming out often takes incredible courage. On #NationalComingOutDay, let's honor that courage by showing LGBT Americans we're with them. pic.twitter.com",,
20,Oct 4,False,"""I can't imagine how Governor Pence can defend the insult-driven, selfish, me-first style of Donald Trump."" —@TimKaine #VPDebate",,
21,Oct 4,False,"Thanks for the kind words, Mike. #VPDebate pic.twitter.com",,
22,Oct 4,False,RT to let @TimKaine know you've got his back tonight. #VPDebate pic.twitter.com,,
23,Oct 4,False,"Number of times Trump has tweeted at @Rosie: 65

Number of times Trump has tweeted in support of Mike Pence, his running mate: 21 #VPDebate",,
24,Oct 4,False,".@TimKaine's spent his whole life fighting for working families, so I have no doubt he'll do the same tonight. Go get 'em, Tim. -H",,
25,Oct 4,False,"If Trump's decisiveness in choosing Mike Pence as his running mate is any indication, he'll be great at making hard decisions as president. pic.twitter.com",,
26,Oct 4,False,"Before Mike Pence takes the debate stage to defend his running mate, remember the time Trump couldn't decide whether he wanted him at all. pic.twitter.com",,
27,Oct 4,False,"Post-traumatic stress isn't something strong people can handle & weak people can't.

Trump’s comments aren't just ignorant, they’re harmful.",,
28,Oct 4,False,.@TimKaine is going to finish this campaign the same way he started his career—fighting for working families. pic.twitter.com,,
29,Oct 4,False,"Tonight, Mike Pence will either have to leave Trump out to dry—or try to justify the things they both believe. #VPDebate pic.twitter.com",,
30,Oct 4,False,"Contributing nothing to our military, public schools, kids' health care, and more doesn't make you ""smart."" pic.twitter.com",,
31,Oct 4,False,White people need to empathize and understand what it’s like for black parents to worry about their kids' safety.http://www.snappytv.com/tc/2941357 ,,
32,Oct 4,False,"""I've known Hillary since September of 1958...we were just thinking of the next Nancy Drew book."" —Hillary's lifelong friend, Betsy pic.twitter.com",,
33,Oct 4,False,"Mike Pence: a divisive, anti-woman, anti-LGBT, anti-worker extremist. 

No wonder Trump picked him. #VPDebate pic.twitter.com",,
34,Oct 3,False,".@TimKaine wears his ""F"" rating from the @NRA like a badge of honor.http://hrc.io/2dohCDY ",,
35,Oct 3,False,"A person who implies that veterans suffering from PTS are not ""strong"" is unfit to be Commander-in-Chief. Period.http://hrc.io/2dod68F ",,
36,Oct 3,False,"""She is far and away the choice for the presidency of the United States in 2016."" —@NYDailyNewshttp://hrc.io/2dNRS2k ",,
37,Oct 3,False,"""Hillary has always been a champion for children and their futures."" —@KingJameshttp://read.bi/2cL9Epl ",,
38,Oct 3,False,Trump’s campaign is bragging that not paying taxes makes him a “genius.” pic.twitter.com,,
39,Oct 3,False,"It’s Filipino American History Month, so lets honor their many contributions—from serving in WWII to strengthening our labor movement. -H",,
40,Oct 3,False,Veterans who experience PTS are stronger than we'll ever understand. We owe them nothing short of world-class care:http://hrc.io/2d9Fubu ,,
41,Oct 3,False,Millions of Americans work hard and pay their taxes. So why doesn't Donald Trump pay his? pic.twitter.com,,
42,Oct 3,False,"In one week, Trump has:
✓Lost a debate
✓Attacked a woman at 5 am on Twitter
✓Had his net worth downgraded
and more:http://hrc.io/2d8LJfS ",,
43,Oct 3,False,"""Hillary is running on the message of hope and unity that we need."" —@KingJameshttp://read.bi/2cL9Epl ",,
44,Oct 3,False,"Can a man who lost $1 billion in one year, stiffed small businesses, and may have paid no taxes really claim he's ""good at business""? pic.twitter.com",,
45,Oct 2,False,"According to @NYTimes, Trump may contribute less to our military and college students than the undocumented immigrants he wants to deport.",,
46,Oct 2,False,"Newspapers that have endorsed @realDonaldTrump:
1. ...
2. ...
3. (Uh, the National Enquirer?)http://hrc.io/2dL2gaJ ",,
47,Oct 2,False,"""Let's register to vote, show up to the polls, and vote for Hillary Clinton."" —@KingJames: http://IWillVote.com  http://read.bi/2cL9Epl ",,
48,Oct 2,False,Three pages of Trump's tax returns confirm he's a business failure who's gotten rich at your expense. Imagine what he’s hiding in the rest. pic.twitter.com,,
49,Oct 2,False,L'Shana Tovah to everyone celebrating Rosh Hashanah! May the coming year be filled with sweetness and joy. -H,,
50,Oct 2,False,"Reminder: While Trump probably pays no federal taxes, he wants a $4 billion tax break for his own family.  http://hrc.io/2d6Jk5j  pic.twitter.com",,
51,Oct 2,False,Now that's pretty rich coming from a guy who paid $0 in taxes for 18 years: http://hrc.io/2d6BTv0 https://twitter.com/realDonaldTrump/status/172772609627394049 …,,
52,Oct 2,False,"Try our new tool! See how much you'd pay in federal income taxes if you paid the same as ""billionaire"" Donald Trump:http://hrc.io/2d6wSlS ",,
53,Oct 2,False,.@TimKaine's favorite records—and 13 other things you should know about America's next vice president:http://hrc.io/2dkeRDO ,,
54,Oct 1,False,"Trump ""apparently got to avoid paying taxes for nearly two decades—while tens of millions of working families paid theirs."" pic.twitter.com",,
55,Oct 1,False,"“She’s just out there every day doing God’s work in her own way. You know? Making her parents proud.” —Betsy, Hillary's lifelong friend pic.twitter.com",,
56,Oct 1,False,Don't boo. Vote!  http://IWillVote.com  pic.twitter.com,,
57,Oct 1,False,"""It was overwhelming, in every sense of that word."" —Betsy, Hillary's oldest friend, on casting the Illinois delegation's votes at the DNC pic.twitter.com",,
58,Oct 1,False,Great step forward by the Obama administration. It’s past time for Congress to guarantee paid sick leave for everyone. -Hhttps://twitter.com/POTUS/status/782218662228942848 …,,
59,Oct 1,False,Nobody here was “having fun” except for Trump. pic.twitter.com,,
60,Oct 1,False,"For those few people knocking public service, hope you'll reconsider answering the call to help others. Because we're stronger together.",,
61,Oct 1,False,"Remember, don't believe the haters who describe America as hopeless and broken. We should lift each other up, not tear each other down.",,
62,Oct 1,False,It's 3:20am. As good a time as any to tweet about national service.http://hrc.io/2d35BB5 ,,
63,Sep 30,False,"Trump stood on a debate stage and lied to millions of Americans.

Chip in to make sure he never becomes president:  http://hrc.io/2df1kxe  pic.twitter.com",,
64,Sep 30,False,"When Ruline was born, women couldn't vote. Yesterday, at 103, she voted for Hillary. Make sure you're registered:  http://IWillVote.com  pic.twitter.com",,
65,Sep 30,False,Make sure @realDonaldTrump's bullying never reaches the White House. Chip in now:  http://hrc.io/2drc4ZK  pic.twitter.com,,
66,Sep 30,False,A man who can be provoked by a tweet should not be anywhere near the nuclear codes.,,
67,Sep 30,False,"""My view is we are already great, and if we work together, we will become even greater in the years ahead.” —Hillary in Florida",,
68,Sep 30,False,"Trump admits he ""can't say"" he treats women with respect.https://amp.twimg.com/v/08853b75-592e-4220-8802-ab8fb2332f87 …",,
69,Sep 30,False,"While Donald continues day 5 of his Machado meltdown, we'll be in Florida talking about national service. You'll want to watch.",,
70,Sep 30,False,"Trump on equal pay: ""Do as good a job"" as men.

Abortion? Should be ""punished.""

Pregnancy? An ""inconvenience.""

Wives working? ""Dangerous.""",,
71,Sep 30,False,Trump obsessively bullies Rosie O'Donnell—an accomplished actor. He insulted Kim Kardashian for her weight—when she was pregnant. Pathetic.,,
72,Sep 30,False,"When something gets under Donald's thin skin, he lashes out and can't let go. This is dangerous for a president.",,
73,Sep 30,False,"Alicia deserves praise for courageously standing up to Trump's attacks. And he has the gall to blame her—and say he ""helped""?",,
74,Sep 30,False,What kind of man stays up all night to smear a woman with lies and conspiracy theories?,,
75,Sep 30,False,"This is...unhinged, even for Trump. A few notes.https://twitter.com/realDonaldTrump/status/781788223055994880 …",,
76,Sep 29,False,"""Men and women.
Young and old.
Gay and straight.
Native-born and immigrant.

That's who the hell we are.""  http://IWillVote.com  pic.twitter.com",,
77,Sep 29,False,"“This is not me just going through the motions here.

I really, really, really want to elect Hillary.” —@POTUS:  http://IWillVote.com  pic.twitter.com",,
78,Sep 29,False,"""I will not raise taxes on anyone making less than $250,000.” —Hillaryhttp://hrc.io/2dold5y ",,
79,Sep 29,False,"Born before women could vote, Ruline just cast her ballot for Hillary in Iowa today. Join her:  http://IWillVote.com  pic.twitter.com",,
80,Sep 29,False,"Barack&
Michelle&
Joe&
Bernie&
Elizabeth&
You?

 http://IWillVote.com  pic.twitter.com",,
81,Sep 29,False,"Trump appears to have broken the law and acted against our nation's interest, all so he could line his own pockets.  http://hrc.io/2dnPh1j  pic.twitter.com",,
82,Sep 29,False,The images from the train derailment in NJ are horrifying. My prayers are with those who lost loved ones and the dozens who were injured. -H,,
83,Sep 29,False,"Donald Trump may lie, but the tape doesn't. pic.twitter.com",,
84,Sep 28,False,"""Hillary will be a president our kids can look up to."" —@FLOTUS pic.twitter.com",,
85,Sep 28,False,"At Monday's debate, Trump denied saying a lot of the things he's said. Let's set the record straight. pic.twitter.com",,
86,Sep 28,False,"With a mother in the Oval Office, we may finally catch up to the rest of the world on paid leave.http://hrc.io/2dAQKyQ ",,
87,Sep 28,False,"""If a candidate regularly and flippantly makes cruel and insulting comments about women...that's who that candidate really is."" —@FLOTUS pic.twitter.com",,
88,Sep 28,False,"""The president commands our nuclear arsenal. Trump can’t command his own rhetoric."" —@azcentralhttp://hrc.io/2d95w1u ",,
89,Sep 28,False,We should make public colleges tuition-free for working families and debt-free for everyone.,,
90,Sep 28,False,"""Thank you, @BernieSanders. Thank you for your leadership and your support in this campaign.” —Hillary",,
91,Sep 28,False,"""Whew, OK!”http://hrc.io/2dkCPiJ ",,
92,Sep 28,False,A man who bullies and shames a woman for her weight should never become president. pic.twitter.com,,
93,Sep 28,False,"For forty years, every presidential candidate has released their tax returns—except for Trump. What's he hiding?http://www.snappytv.com/tc/2891457 ",,
94,Sep 28,False,"In its 120-year history, @azcentral has never endorsed a Democrat.

Here's why the paper just endorsed Hillary: http://hrc.io/2d95w1u ",,
95,Sep 28,False,"""Hillary and I have lost a true and treasured friend."" —@BillClinton and Hillary on the passing of Shimon Peres pic.twitter.com",,
96,Sep 28,False,This election is a choice between an economy that benefits everyone or an economy that benefits...Donald Trump. pic.twitter.com,,
97,Sep 27,False,"Thank you, @_VicenteFdez. You're right—""su voz es su voto."" So grateful to have your support. #JuntosSePuedehttps://twitter.com/_vicentefdez/status/778672681096912896 …",,
98,Sep 27,False,"20 years after Donald bullied a beauty pageant winner for her weight, the real ""problem"" is...still Donald. pic.twitter.com",,
99,Sep 27,False,Donald Trump lied to the American people at least 58 times during the first presidential debate. (We counted.)http://hrc.io/2dhVg7q ,,
100,Sep 27,False,One candidate made it clear he wasn’t prepared for last night’s debate. The other made it clear she’s prepared to be president. pic.twitter.com,,
101,Sep 27,False,"“Donald just criticized me for preparing for this debate. And you know what else I prepared for?

I prepared to be president."" —Hillary pic.twitter.com",,
102,Sep 27,False,"When you have a really, really good night. #SheWon pic.twitter.com",,
103,Sep 27,False,"""I'm glad Trump found out that Crimea was part of Ukraine. By the way, I heard he was on the verge of acknowledging gravity."" —@JoeBiden",,
104,Sep 27,False,"""Anyone who complains about microphone problems is not having a good night."" —Hillary #SheWon",,
105,Sep 27,False,"Trump on Alicia, 1996: ""Miss Piggy.""

This morning: ""She gained a massive amount of weight...it was a real problem."" pic.twitter.com",,
106,Sep 27,False,Only one person on last night's stage is prepared to be Commander-in-Chief. Make sure she gets the chance:  http://IWillVote.com  #SheWon pic.twitter.com,,
107,Sep 26,False,43 days left. Let’s go win this thing:  http://hrc.io/2cRpjzJ  #DebateNight pic.twitter.com,,
108,Sep 26,False,"Donald Trump called her ""Miss Piggy"" and ""Miss Housekeeping.""

Her name is Alicia Machado. #DebateNight pic.twitter.com",,
109,Sep 26,False,The presidency isn't a reality show—it's as real as it gets. Make sure you're registered to vote:  http://IWillVote.com  #DebateNight pic.twitter.com,,
110,Sep 26,False,RT this if you're proud to be standing with Hillary tonight. #debatenight pic.twitter.com,,
111,Sep 26,False,Hillary just proved she's the only candidate who's ready to be president. Chip in now and let's go win this thing:http://hrc.io/2cRhEBi ,,
112,Sep 26,False,"When Donald Trump says he has a ""winning temperament."" #debatenight pic.twitter.com",,
113,Sep 26,False,The woman Trump called “Miss Piggy” has a name: Alicia. #debatenight pic.twitter.com,,
114,Sep 26,False,"""When Donald Trump spends 11 hours testifying in front of a congressional committee, he can talk to me about stamina."" —Hillary #debatenight",,
115,Sep 26,False,"Donald Trump's ""cavalier attitude about nuclear weapons is so deeply troubling.” #DebateNighthttp://www.snappytv.com/tc/2887608 ",,
116,Sep 26,False,.@realDonaldTrump: Barack Obama is your president too. #debatenight,,
117,Sep 26,False,A man who can be provoked by a tweet should not have his hands anywhere near the nuclear codes. #DebateNight,,
118,Sep 26,False,This should go without saying: Taking nuclear war lightly is disqualifying for anyone seeking to be President of the United States. pic.twitter.com,,
119,Sep 26,False,"""I hope the fact-checkers are turning up the volume. Donald Trump supported the invasion of Iraq.”https://twitter.com/PolitiFact/status/775412456839446528 …",,
120,Sep 26,False,"When Donald Trump goes low, we go high. #DebateNighthttp://www.snappytv.com/tc/2887363 ",,
121,Sep 26,False,"When a man is sued for discriminating against black tenants & pushes birtherism, he's giving you an idea of what kind of president he'd be.",,
122,Sep 26,False,"Donald Trump's answer for his five years of pushing the racist birther conspiracy theory?

""I say nothing."" #debatenight",,
123,Sep 26,False,"""Trump just criticized me for preparing for this debate. You know what else I prepared for? Being president."" #DebateNight",,
124,Sep 26,False,President Obama was born in the United States. He’s American. Trump only has one reason for refusing to admit it. #debatenight,,
125,Sep 26,False,Donald Trump is more concerned with pandering to the gun lobby than keeping families safe. #DebateNight pic.twitter.com,,
126,Sep 26,False,"The fact that Trump's answer to a question about racial injustice is just ""we need law and order"" pretty much says it all. #debatenight",,
127,Sep 26,False,We are not going to bring New York’s unconstitutional stop-and-frisk program nationwide. #debatenight,,
128,Sep 26,False,"Paying zero in taxes doesn’t make you ""smart.""

It makes you a tax evader.http://www.snappytv.com/tc/2887031 ",,
129,Sep 26,False,No wonder Donald Trump is hiding his tax returns. #debatenight pic.twitter.com,,
130,Sep 26,False,"""I never said that."" —Donald Trump, who said that. #debatenighthttps://twitter.com/realDonaldTrump/status/265895292191248385 …",,
131,Sep 26,False,"""That's called business."" —Donald Trump on the housing crash.

For millions of Americans it was called ""losing their home."" #DebateNight",,
132,Sep 26,False,Let's do this. #DebateNight pic.twitter.com,,
133,Sep 26,False,"No matter what Donald says at tonight's debate, we already know the real Trump.

Follow @TheBriefing2016 for the facts. #DebateNight pic.twitter.com",,
134,Sep 26,False,"“You didn’t blame Little John or Meat Loaf. You fired Gary Busey.

These are the kinds of decisions that would keep me up at night."" pic.twitter.com",,
135,Sep 26,False,Watch this before you watch tonight's debate. #DebateNight pic.twitter.com,,
136,Sep 26,False,"Trump told 31 outright lies just last week.

Keep him honest at tonight's debate: Follow @TheBriefing2016 to get the facts. #DebateNight pic.twitter.com",,
137,Sep 26,False,"These headlines on Trump's lies are from just one week of his campaign.

Imagine four years of his presidency. pic.twitter.com",,
138,Sep 26,False,A reminder heading into tonight's debate. #DebateNight pic.twitter.com,,
139,Sep 26,False,Our daughters deserve better. pic.twitter.com,,
140,Sep 26,False,Not a single living president has endorsed Donald Trump.http://hrc.io/2dtsbE1 ,,
141,Sep 26,False,Trump can't win tonight's debate by lying to the American people. pic.twitter.com,,
142,Sep 26,False,RT this if you've got Hillary's back tonight. #Debates2016 pic.twitter.com,,
143,Sep 25,False,"Today, the sacrifices of Gold Star families weigh heavier on my mind. Thank you. I will fight to get you the care & benefits you deserve. -H",,
144,Sep 25,False,"59 years ago, 9 brave students integrated Central High School, changing the course of history. Let's recommit to finishing their work. -H pic.twitter.com",,
145,Sep 25,False,Imagine Donald Trump sitting in the Situation Room making life or death decisions on behalf of the United States. pic.twitter.com,,
146,Sep 25,False,Our veterans and their families deserve a president who doesn't disrespect and disparage their sacrifices. pic.twitter.com,,
147,Sep 25,False,Gold Star families have made sacrifices most of us can't even fathom. They deserve our respect and our thanks. pic.twitter.com,,
148,Sep 25,False,Not one living president has said they believe Donald Trump has what it takes to be Commander-in-Chief. http://hrc.io/2d1agpY ,,
149,Sep 25,False,"""Our endorsement is rooted in respect for her intellect, experience, toughness and courage."" —@NYTimes on Hillary  http://nyti.ms/2cVyJ2o  pic.twitter.com",,
150,Sep 24,False,"The new @NMAAHC is an overdue tribute to African American history. Let's build a more open, inclusive future by reflecting on our past. -H",,
151,Sep 24,False,"""I thought, this woman—I want to ride with her."" —Roxie, a Republican and small business owner, on meeting Hillary pic.twitter.com",,
152,Sep 24,False,"RT if you believe that #LoveTrumpsHate

Then make sure you're registered to vote:  http://IWillVote.com  pic.twitter.com",,
153,Sep 23,False,"If the young women of this country have Donald Trump as their president, what will they think of themselves? pic.twitter.com",,
154,Sep 23,False,"Republicans are once again turning their backs on the people of Flint who have waited far too long for help. It's wrong, unfair, and unjust.https://twitter.com/RepDanKildee/status/779293316139651072 …",,
155,Sep 23,False,Charlotte should release police video of the Keith Lamont Scott shooting without delay. We must ensure justice & work to bridge divides. -H,,
156,Sep 23,False,"When Donald Trump speaks about women, our daughters can hear him. pic.twitter.com",,
157,Sep 23,False,Is this the president we want for our daughters? pic.twitter.com,,
158,Sep 22,False,"""He's 70 years old, and he's still a bully."" —Karen on @realDonaldTrump pic.twitter.com",,
159,Sep 22,False,Our favorite moments from Hillary's appearance on Between Two Ferns →  http://hrc.io/2cVhDPP  pic.twitter.com,,
160,Sep 22,False,"""I really regret doing this."" —Hillary on Between Two Ferns pic.twitter.com",,
161,Sep 22,False,Very concerned about the outage in Puerto Rico and the millions of families who don't have power. Hoping it's restored quickly. -Hhttps://twitter.com/AP/status/778898162371137536 …,,
162,Sep 22,False,The man who could be your next president may be deeply indebted to another country. Do you trust him to run ours? pic.twitter.com,,
163,Sep 22,False,"Most people who are bullies grow out of it. 

Donald Trump hasn't. pic.twitter.com",,
164,Sep 22,False,"""Donald Trump doesn't see people like me, he only sees disability. I honestly feel bad for someone with so much hate in his heart."" pic.twitter.com",,
165,Sep 22,False,"Donald Trump is really good at spending other people's money—on:

Legal settlements.
Payoffs.
Portraits of himself. pic.twitter.com",,
166,Sep 21,False,Trump should have to answer exactly why he refuses to believe that @POTUS is American.https://twitter.com/thehill/status/778756954613088257 …,,
167,Sep 21,False,"""You would think there is almost, like, something wrong."" —Donald Trump on Mitt Romney failing to release his tax returns, 2012 pic.twitter.com",,
168,Sep 21,False,We need a president who sees the best in all of us. pic.twitter.com,,
169,Sep 21,False,Every student should be able to graduate from college without taking on any debt.  http://hrc.io/2cDiWjm  pic.twitter.com,,
170,Sep 21,False,Keith Lamont Scott. Terence Crutcher. Too many others. This has got to end. -H,,
171,Sep 20,False,FACT: Donald Trump used his charitable foundation to purchase *multiple* six-foot-tall paintings of himself.http://hrc.io/2dfrxtt ,,
172,Sep 20,False,"A real headline about the Republican nominee: ""Trump used $258,000 from his charity to settle legal problems.""http://wapo.st/2cNm2nJ ",,
173,Sep 20,False,"Four months from today, our next president will walk into the Oval Office.

Help make sure it's not Donald Trump: http://hrc.io/2dfejgv ",,
174,Sep 20,False,"On this day in 1973, tennis champion Billie Jean King defeated Bobby Riggs in the “Battle of the Sexes.” pic.twitter.com",,
175,Sep 20,False,"""You can leave this ad muted—there's nothing to hear."" —@NyleDiMarco

 http://IWillVote.com  pic.twitter.com",,
176,Sep 20,False,Trump’s calls to torture and mistreat prisoners go against the very values we are fighting to defend. We’re better than this.,,
177,Sep 20,False,Donald hasn't given his own money to the Trump Foundation since 2008—but it's still paying his bills.http://wapo.st/2cNm2nJ ,,
178,Sep 20,False,Another unarmed Black man was shot in a police incident. This should be intolerable. We have so much work to do. #TerenceCrutcher -H,,
179,Sep 20,False,Donald Trump is using his foundation—funded by other people's money—to settle lawsuits. http://wapo.st/2cNm2nJ ,,
180,Sep 20,False,"""The voice of your vote is the greatest voice we have."" —@NyleDiMarco

 http://IWillVote.com  pic.twitter.com",,
181,Sep 19,False,Catch @FallonTonight at 11:35pm ET to see letters from some of Hillary's biggest fans. pic.twitter.com,,
