,date,retweet,text,,
2436,27 Oct 2015,False,Humorous!http://hrc.io/1LW7XeW ,,
2437,27 Oct 2015,False,There is no excuse for violence inside a school. The #AssaultAtSpringValleyHigh is unacceptable—schools should be safe places. -H,,
2438,27 Oct 2015,False,Giving students a world class education also means making sure adjunct faculty are paid fairly. #CampusEquityWeekhttp://hrc.io/1LydEC2 ,,
2439,26 Oct 2015,False,"Well done, Ole Miss. Symbols of hate have no business flying over a place of learning. -Hhttps://twitter.com/splcenter/status/658650544651636736 …",,
2440,26 Oct 2015,False,It's her  birthday!  http://hrc.io/1WelrYm  pic.twitter.com,,
2441,26 Oct 2015,False,Today is Hillary's birthday! Sign her card–it will make her day:  http://hrc.io/1NvRotb  pic.twitter.com,,
2442,26 Oct 2015,False,Hillary is fighting for all of us. #IDPJJ pic.twitter.com,,
2443,25 Oct 2015,False,"""If talking about equal pay, paid family leave, child care, & women's health is playing the gender card—deal me in.""https://amp.twimg.com/v/f8a11e2f-7626-456f-9f35-972693681103 …",,
2444,25 Oct 2015,False,Hillary's birthday is tomorrow—and she's still on track to be the youngest woman US president ever. Sign her card! http://hrc.io/HRCbirthday ,,
2445,25 Oct 2015,False,"Happy birthday, @KatyPerry!  pic.twitter.com",,
2446,25 Oct 2015,False,".@katyperry, you bring the campaign dress code to the next level. Thanks for hanging out with us in Iowa! -H pic.twitter.com",,
2447,25 Oct 2015,False,A roaring good time at the Iowa JJ. pic.twitter.com,,
2448,24 Oct 2015,False,Did Hillary rock at #IDPJJ? pic.twitter.com,,
2449,24 Oct 2015,False,"""Together we’re going to build an America where...a father can tell his daughter, 'you can be anything you want to be—including president.'""",,
2450,24 Oct 2015,False,"""I’ve spent my life working for children, women, families, and our country...and I’m just getting warmed up."" —Hillary at #IDPJJ",,
2451,24 Oct 2015,False,"Why Hillary fights to prevent gun violence: ""You should be safe when you go to school, when you go to the movies, when you go to church.""",,
2452,24 Oct 2015,False,"""Yes—Black Lives Matter."" —Hillary at #IDPJJ",,
2453,24 Oct 2015,False,"""When you short-change women, you short-change families and you short-change America."" —Hillary on why she's fighting for equal pay #IDPJJ",,
2454,24 Oct 2015,False,"""There is something wrong when the top 25 hedge fund managers make more than all the kindergarten teachers in America combined."" —Hillary",,
2455,24 Oct 2015,False,"""We need to defend the progress we’ve made under President Obama and build on it."" —Hillary at #IDPJJ",,
2456,24 Oct 2015,False,"""When there’s a Democrat in the White House, America creates more jobs, the economy grows faster, and deficits are smaller."" —Hillary",,
2457,24 Oct 2015,False,"Hillary on the GOP debates: ""It's reality TV—with a cast of characters who don't care much about actual reality."" #IDPJJ",,
2458,24 Oct 2015,False,"Thank you, @davidplouffe​. http://hrc.io/1KxwRQk  -H",,
2459,24 Oct 2015,False,"Agreed, President @billclinton! pic.twitter.com",,
2460,24 Oct 2015,False,"""Sometimes, you just have to ROAR!"" —Hillary after @katyperry's performance at the @HillaryforIA rally in Des Moines. #HillYes",,
2461,24 Oct 2015,False,"""I'm tired of the stranglehold that women have had on presidential spouse.” —President @billclinton at the @HillaryforIA rally in Des Moines",,
2462,24 Oct 2015,False,"SO EXCITED to see @katyperry—but while we wait, she's taking over Hillary's Instagram!  http://instagram.com/hillaryclinton/  pic.twitter.com",,
2463,24 Oct 2015,False,"Why #ImWithHer: I trust Hillary. She will make the world better for me, my husband, and my mom. #HillYes pic.twitter.com",,
2464,24 Oct 2015,False,"More than anyone, Hillary knows that the decisions she will make as President affect me and my family. #HillYes pic.twitter.com",,
2465,23 Oct 2015,False,Hillary on the stakes of this election on @maddow tonight: pic.twitter.com,,
2466,23 Oct 2015,False,"Post-hearing activities: ""We sat around eating Indian food and drinking wine & beer."" Tune in to @maddow at 9pm ET! pic.twitter.com",,
2467,23 Oct 2015,False,Anyone who’s sick of Hillary standing up for women had better get ready for a long campaign.http://hrc.io/1jZyl01 ,,
2468,23 Oct 2015,False,11 hours. One candidate who showed she’s ready to be president. pic.twitter.com,,
2469,23 Oct 2015,False,"To everyone in the path of #HurricanePatricia, follow @CENAPRED_mex for shelter locations and emergency info. Thinking of you—stay safe. -H",,
2470,23 Oct 2015,False,“I am a little feminist growing up to help all women with equal rights.” Meet Olivia:http://hrc.io/1kAD4Gc ,,
2471,23 Oct 2015,False,"""I'm running for President, because after listening to people across our country, your fights are my fights."" pic.twitter.com",,
2472,23 Oct 2015,False,"Thanks for your support, brothers & sisters of @AFSCME. You never stop fighting for working families, & I'll never stop fighting for you. -H",,
2473,23 Oct 2015,False,"Hillary on those who tell her to ""stop shouting"" on issues that matter. pic.twitter.com",,
2474,23 Oct 2015,False,"""I'm doing everything I can to make sure the issues that matter most to women and families are front and center in this election."" —Hillary",,
2475,22 Oct 2015,False,11 hours in → #ImWithHer  http://hrc.io/WithHillary  pic.twitter.com,,
2476,22 Oct 2015,False,"If you're standing with Hillary, let her know: http://hrc.io/201LiHD ",,
2477,22 Oct 2015,False,Hillary's email use can be summed up in four sentences: http://hillaryclinton.com/emails  #BenghaziCommittee,,
2478,22 Oct 2015,False,"If you're standing with Hillary today, let her know: http://hrc.io/201LiHD ",,
2479,22 Oct 2015,False,"As Secretary, Hillary implemented reforms to protect diplomats and help prevent future attacks. #BenghaziCommitteehttps://amp.twimg.com/v/663e6021-1867-40eb-b553-fcc67b48e089 …",,
2480,22 Oct 2015,False,"To truly honor those lost at Benghazi, we need to do everything in our power to ensure the safety of the brave Americans who do their work.",,
2481,22 Oct 2015,False,America must continue to lead in a dangerous world. To do otherwise would mean drawing the wrong lesson from the Benghazi tragedy.,,
2482,22 Oct 2015,False,A lesson from Benghazi: Congress needs to do its part to ensure that our diplomats in dangerous parts of the world are as safe as possible.,,
2483,22 Oct 2015,False,We need leadership that puts national security ahead of politics and ideology. #BenghaziCommitteehttps://amp.twimg.com/v/7d3d54c3-c40f-4856-9421-303a23f37666 …,,
2484,22 Oct 2015,False,Hillary this morning at the House Select Committee on Benghazi. pic.twitter.com,,
2485,22 Oct 2015,False,"""The American people expect us to lead. To learn the right lessons. To rise above partisanship and reach for statesmanship."" —Hillary",,
2486,22 Oct 2015,False,"""We should debate on the basis of fact, not fear. We should resist denigrating the patriotism or loyalty of those who disagree with us.""",,
2487,22 Oct 2015,False,"""I am here to honor the service of those four men...and the work their colleagues do every single day all over the world."" —Hillary",,
2488,21 Oct 2015,False,"Thank you, @POTUS, for taking these critical steps to end the quiet epidemic of substance abuse. http://hrc.io/1NV86oI  -H",,
2489,21 Oct 2015,False,"Tomorrow, Hillary will testify in front of @HouseBenghazi. Let her know you’re with her.  http://hrc.io/ImWithHer  pic.twitter.com",,
2490,21 Oct 2015,False,An investigation into the deaths of four Americans has been twisted into a partisan attack on Hillary. The facts:https://amp.twimg.com/v/1b385add-335f-4cfc-8c22-595b44e3c026 …,,
2491,21 Oct 2015,False,Hillary championed LGBT equality around the world: “The strongest defense ever in terms of gay rights.”https://amp.twimg.com/v/f8cc88fc-244a-4e11-aa8e-d34b3ad11b7b …,,
2492,21 Oct 2015,False,".@VP is a good friend and a great man. Today and always, inspired by his optimism and commitment to change the world for the better. -H",,
2493,21 Oct 2015,False,"Hillary is a longtime fighter for reproductive rights, education, and equal pay. pic.twitter.com",,
2494,21 Oct 2015,False,"As Secretary of State, Hillary prioritized the education of women & girls to build peaceful and prosperous nations.https://amp.twimg.com/v/5445a2c9-3054-4333-95d1-68615f5509e7 …",,
2495,20 Oct 2015,False,What did Hillary accomplish as Secretary of State? @SenSchumer weighs in: pic.twitter.com,,
2496,20 Oct 2015,False,"Before Hillary was running for president, Republicans had the nicest things to say about her.http://amp.twimg.com/v/0b036eea-f7fd-4840-92e5-b8b00da26f3d …",,
2497,20 Oct 2015,False,"Hillary has the experience, skills, and vision we need in our next Commander-in-chief. Just ask @madeleine: pic.twitter.com",,
2498,20 Oct 2015,False,Former Senior Advisor to President Obama @davidaxelrod on Hillary's greatest accomplishments as Secretary of State: pic.twitter.com,,
2499,19 Oct 2015,False,The world is a better place because Hillary was Secretary of State. Here’s why:  http://hrc.io/1LH56tU  pic.twitter.com,,
2500,19 Oct 2015,False,"""I don't think I have ever met someone more prepared to be president."" —@Madeleine Albrighthttps://amp.twimg.com/v/6ea81626-c3fe-4f56-9739-8509a565d035 …",,
2501,19 Oct 2015,False,Carly Fiorina challenged Democrats to name an accomplishment of Hillary’s. Senator @BarbaraBoxer accepted: pic.twitter.com,,
2502,19 Oct 2015,False,Hillary has what it takes to lead America. Watch the new video on her accomplishments as Secretary of State:https://amp.twimg.com/v/d1ba2c5c-b3e0-410f-98de-00420cb2c62c …,,
2503,18 Oct 2015,False,"“In 2016, the Latino community is going to play a critical role in electing our next president.” -Julián Castrohttps://amp.twimg.com/v/b5f027af-f1f0-4641-ac25-44a670670376 …",,
2504,17 Oct 2015,False,Attempting to deny citizenship to immigrants' children born here is wrong—and undermines who we are as a country. http://hrc.io/1LVt14z  -H,,
2505,17 Oct 2015,False,"As President, Hillary will take on the epidemic of gun violence—with or without Congress’s help.http://hrc.io/1QF03dr ",,
2506,17 Oct 2015,False,We can’t ignore America’s racial inequities. pic.twitter.com,,
2507,16 Oct 2015,False,"If you’re a progressive who believes in getting things done, sign up for your free sticker!  http://hrc.io/1G9KLNm  pic.twitter.com",,
2508,16 Oct 2015,False,"On Oct. 16, 1916, Planned Parenthood opened their first health center and changed life for women in America. Here's to the next 99 years. -H",,
2509,16 Oct 2015,False,"Yesterday in San Antonio, three-time mayor of San Antonio Julián Castro announced his support for Hillary. pic.twitter.com",,
2510,16 Oct 2015,False,"Transgender people deserve respect, safety, and equal treatment everywhere. Good move by @TSA.https://twitter.com/thehill/status/655013082985578496 …",,
2511,16 Oct 2015,False,"Brava, Jennifer. It's hard to speak up against inequity and risk being unpopular—but equal pay matters for us all.http://hrc.io/1LenzMV ",,
2512,16 Oct 2015,False,The number of American lives lost to gun violence is more than three times the rate as the next developed country. http://hrc.io/1PwoICu ,,
2513,15 Oct 2015,False,"Women still make less than men, with women of color facing an even bigger gap. This isn't just holding women back—it's holding America back.",,
2514,15 Oct 2015,False,"To everyone who's ever been bullied for being who you are: You're perfect, and I'm proud of you. #SpiritDay -H",,
2515,15 Oct 2015,False,"""I've been told by some to quit shouting about this. Well, I'll tell you: I will not be silenced...I will keep taking on the NRA."" —Hillary",,
2516,14 Oct 2015,False,She has a point: The economy does do better with a Democrat in the White House.https://amp.twimg.com/v/48be5f87-9b1d-46f9-af55-1135c101f3b3 …,,
2517,14 Oct 2015,False,The feeling when a GOP candidate says it's acceptable to be fired for being gay.  https://twitter.com/Philip_Elliott/status/654408017497182208 … pic.twitter.com,,
2518,14 Oct 2015,False,We can protect the Second Amendment while also protecting our families and communities from gun violence. pic.twitter.com,,
2519,14 Oct 2015,False,"Last night, Hillary showed that she has the vision, the plans, and the determination to move this country forward.https://amp.twimg.com/v/03a52862-dddd-44e9-89d1-2fd3a8a4563e …",,
2520,13 Oct 2015,False,"“Finally, fathers will be able to say to their daughters: you too can grow up to be president.” #DemDebatehttps://amp.twimg.com/v/8e426e34-5b1d-4494-812d-c0d81a79d156 …",,
2521,13 Oct 2015,False,A highlight of #DemDebate: Hillary stands up against Republican attacks on women's rights. #ImWithHerhttps://amp.twimg.com/v/f4e17fd1-3cad-4368-907e-b0cea1dbba79 …,,
2522,13 Oct 2015,False,RT this if you’re proud to stand with Hillary. #ImWithHer #DemDebate pic.twitter.com,,
2523,13 Oct 2015,False,Are you with Hillary? Let her know:  http://hrc.io/debate  #DemDebate #ImWithHer pic.twitter.com,,
2524,13 Oct 2015,False,We cannot go back to the failed policies of the past. We will not go back. America's best days are still ahead. #DemDebate,,
2525,13 Oct 2015,False,"""In this debate, we tried to deal with the very tough issues facing our country—in stark contrast to the Republicans."" -Hillary #DemDebate",,
2526,13 Oct 2015,False,Hillary has fought for women her whole life—and she's just getting started. #ImWithHer #DemDebate pic.twitter.com,,
2527,13 Oct 2015,False,"Hillary on the enemies she's proud to have made: ""The NRA, health insurance companies, drug companies, the Iranians...and the Republicans.""",,
2528,13 Oct 2015,False,We cannot afford to have a Republican succeed Barack Obama as President of the United States. #DemDebate,,
2529,13 Oct 2015,False,Attacks on Planned Parenthood are attacks on women's health and rights. We can't let them take us backwards. pic.twitter.com,,
2530,13 Oct 2015,False,"For too long, issues affecting women—from reproductive rights to paid leave—have been dismissed as ""women's issues."" Those days are over.",,
2531,13 Oct 2015,False,No politician should interfere with a woman's personal medical decisions. Full stop. #DemDebate #ImWithHer,,
2532,13 Oct 2015,False,"No matter what @carlyfiorina says, paid family leave is good for women, good for families, and good for America. #DemDebate",,
2533,13 Oct 2015,False,"Equal pay, paid leave, childcare: These aren't just ""women's issues,"" they're family issues and economic growth issues. #DemDebate",,
2534,13 Oct 2015,False,"""I can't think of anything more outsider than being the first woman president."" -Hillary #DemDebate",,
2535,13 Oct 2015,False,It's time the entire country stood up against the NRA. http://hrc.io/1PsaQJy  #DemDebate,,
2536,13 Oct 2015,False,We need to find the right balance between civil liberties and national security. #DemDebate,,
2537,13 Oct 2015,False,There is no place in America for second-class citizenship. #DemDebate pic.twitter.com,,
2538,13 Oct 2015,False,No student should have to borrow money to pay tuition at a public college. http://hrc.io/1Pek6l9 ,,
2539,13 Oct 2015,False,We need to make college more affordable. pic.twitter.com,,
2540,13 Oct 2015,False,No one is too big to jail–even on Wall Street. #DemDebate,,
2541,13 Oct 2015,False,Racial inequality is not merely a symptom of economic inequality.,,
2542,13 Oct 2015,False,We can't move forward until we tackle racial inequality that still exists—from economic opportunity to education to community safety.,,
2543,13 Oct 2015,False,We cannot keep imprisoning more people than anyone else in the world. #DemDebate,,
2544,13 Oct 2015,False,"""[Benghazi] committee is basically an arm of the RNC—I intend to keep talking about the issues that matter to the American people."" -Hillary",,
2545,13 Oct 2015,False,"“President Obama asked me to be his Secretary of State. He valued my judgment."" -Hillary #DemDebate",,
2546,13 Oct 2015,False,"We can't allow guns to fall into the hands of domestic abusers, violent criminals, and the seriously mentally ill. pic.twitter.com",,
2547,13 Oct 2015,False,We can protect the Second Amendment while also protecting our families and communities from gun violence. #DemDebate,,
2548,13 Oct 2015,False,"""This has gone on too long, and it's time that the entire country stood up against the NRA."" -Hillary on gun violence #DemDebate",,
2549,13 Oct 2015,False,We can't wait any longer to act on gun violence prevention. #DemDebate,,
2550,13 Oct 2015,False,"""I'm a progressive, but I'm a progressive who gets things done."" -Hillary #DemDebate",,
2551,13 Oct 2015,False,"""I've spent my entire adult life looking for ways to even the odds...to allow each child to live up to its potential."" -Hillary #DemDebate",,
2552,13 Oct 2015,False,Let's do this. #DemDebate pic.twitter.com,,
2553,13 Oct 2015,False,Hillary doesn’t give up and she'll never quit fighting for families—but she needs your help: http://hrc.io/1NbCVCj https://amp.twimg.com/v/218e28db-a7f1-4b84-b921-30b71e570764 …,,
2554,13 Oct 2015,False,One third of black men born today face the prospect of incarceration in their lifetimes. We can do better. pic.twitter.com,,
2555,13 Oct 2015,False,".@realDonaldTrump Glad you'll be watching. It's going to be ""huge.""",,
2556,13 Oct 2015,False,"Today we celebrate Dolores Huerta—teacher, organizer, activist—for her civic leadership and trailblazing spirit. pic.twitter.com",,
2557,12 Oct 2015,False,Hillary talks sexism in the workplace with @Buzzfeed’s @AnotherRound:  http://hrc.io/1LqzfNI  pic.twitter.com,,
2558,12 Oct 2015,False,Hillary's been debating important issues since high school. Let her know you’re on her team:  http://hrc.io/1WYkWEa  pic.twitter.com,,
2559,12 Oct 2015,False,“One of the merits is I am a woman.” pic.twitter.com,,
2560,12 Oct 2015,False,Thoughts and prayers aren’t enough—we must act to protect families from gun violence. pic.twitter.com,,
2561,12 Oct 2015,False,“As a woman...you’re expected to be both strong and vulnerable at the same time. That’s not easy to do.” -Hillaryhttp://hrc.io/1G9qhUG ,,
2562,12 Oct 2015,False,.@Pharrell: “It’s Hillary time.” http://hrc.io/1K4gjz9 https://amp.twimg.com/v/0b4d0301-3474-4a79-a5df-e2d1c64e9c62 …,,
2563,12 Oct 2015,False,Sending support to Tamir Rice's loved ones. Too many black families are mourning the loss of a child. We need to change that reality. -H,,
2564,11 Oct 2015,False,"Just 30% of girls around the world are enrolled in secondary school. Together, we can change that: http://dayofthegirl.org  #DayoftheGirl",,
2565,11 Oct 2015,False,"""You will surprise yourself with what you’re capable of and the incredible things you [do]."" #NationalComingOutDayhttps://amp.twimg.com/v/ae042611-5ea7-4222-86d3-7c9de74367a8 …",,
2566,11 Oct 2015,False,"40 years ago, I married the cute guy from the library. Happy anniversary, @billclinton—you've still got it! -H pic.twitter.com",,
2567,11 Oct 2015,False,"On #NationalComingOutDay, we remember that our work isn’t done until everyone can be who they are and is treated with dignity.",,
2568,10 Oct 2015,False,"The Republicans are spending millions to try and stop her, but Hillary will never quit fighting for you.https://amp.twimg.com/v/6d4644cf-c1a3-4d08-bfc1-6d2e5f930d06 …",,
2569,10 Oct 2015,False,"Thank you, @JerryBrownGov. Every state should follow your lead and make it easier to vote.https://twitter.com/latimes/status/652931347741310977 …",,
2570,10 Oct 2015,False,"This #WorldMentalHealthDay, let's commit to ending stigma and making sure those who seek treatment are supported and taken seriously.",,
2571,10 Oct 2015,False,We can protect the Second Amendment while also protecting our families and communities from gun violence. pic.twitter.com,,
2572,9 Oct 2015,False,"Racism is America's original sin. To those I met with today, thank you for sharing your ideas. -Hhttps://twitter.com/Ellevation_/status/652519323970441216 …",,
2573,9 Oct 2015,False,"Thank you, @repjohnlewis. pic.twitter.com",,
2574,8 Oct 2015,False,"If you work on Wall Street and commit a crime, you deserve to go to jail.  http://hrc.io/1L2ayFX  pic.twitter.com",,
2575,8 Oct 2015,False,.@NRA Stop taking advantage of responsible gun owners who want commonsense reform—including many of your own members.,,
2576,8 Oct 2015,False,Jeb should stop attacking voting rights and explain what about citizens exercising their right to vote scares him.https://twitter.com/IAStartingLine/status/652128692294938626 …,,
2577,8 Oct 2015,False,How about this @KevinMcCarthy for speaker instead?https://amp.twimg.com/v/ac9d2670-a452-4a95-9b14-6b5722d73eb4 …,,
2578,7 Oct 2015,False,"Hillary on standing up to the NRA: “We can’t just say, OK, nothing we can do about it...We have got to fight back.”https://amp.twimg.com/v/434fb15b-3bb9-4279-b237-59c186345a1b …",,
2579,7 Oct 2015,False,"""You were great on Saturday Night Live...so, can you do for us the Donald Trump impression?""https://amp.twimg.com/v/80887f0d-50e2-4531-bafc-089f0bd88092 …",,
2580,7 Oct 2015,False,It’s time to end discrimination against LGBT Americans once and for all. pic.twitter.com,,
2581,7 Oct 2015,False,Republicans say they don’t think Hillary has accomplished anything—so she sent them a gift.  http://hrc.io/1GwfKhm  pic.twitter.com,,
2582,7 Oct 2015,False,"Sorry about the mean tweets you’ve been getting, @KevinMcCarthy—been there! https://amp.twimg.com/v/ac9d2670-a452-4a95-9b14-6b5722d73eb4 …",,
2583,7 Oct 2015,False,Add your name if you think it’s time to take action on gun violence:  http://hrc.io/endgunviolence  pic.twitter.com,,
2584,6 Oct 2015,False,We need comprehensive immigration reform with a real path to full citizenship. There is no place in America for second-class citizenship.,,
2585,6 Oct 2015,False,Being a good parent has nothing to do with sexual orientation or gender identity. pic.twitter.com,,
2586,6 Oct 2015,False,"“It's time for us to say, we're better than this."" Hillary's plan to prevent gun violence:  http://hrc.io/1RqK8QB  pic.twitter.com",,
2587,5 Oct 2015,False,Protecting communities should be our number one priority—not the interests of the NRA. pic.twitter.com,,
2588,5 Oct 2015,False,We cannot sit by while more people die. pic.twitter.com,,
2589,5 Oct 2015,False,It’s time to act on gun violence. pic.twitter.com,,
2590,5 Oct 2015,False,"If Congress refuses to act to end this epidemic of gun violence, I'll take administrative action to do so. -H",,
2591,5 Oct 2015,False,"As president, I'll push to close background check loopholes like the ""Charleston loophole"" that let the shooter get a gun. -H",,
2592,5 Oct 2015,False,"It's time to act on gun violence. We simply cannot accept as normal 33,000 gun deaths a year. -H",,
2593,4 Oct 2015,False,"In this week's Facebook Q&A, Hillary took on Jeb’s claim that Democrats use ""free stuff"" to appeal to minorities. pic.twitter.com",,
2594,4 Oct 2015,False,LGBT rights are human rights and human rights are LGBT rights -- period. pic.twitter.com,,
2595,4 Oct 2015,False,We can’t wait any longer to act on gun violence prevention. pic.twitter.com,,
2596,4 Oct 2015,False,"""Let us then tap our fists in friendship."" pic.twitter.com",,
2597,3 Oct 2015,False,A vote for Hillary is a vote for four more years of Kate McKinnon's impression. #citizens pic.twitter.com,,
2598,3 Oct 2015,False,Hillary on the epidemic of gun violence. pic.twitter.com,,
2599,3 Oct 2015,False,"""Congress must pass the Federal Equality Act [to] finally outlaw discrimination against LGBT people basically everywhere."" -Hillary",,
2600,3 Oct 2015,False,"""It’s outrageous that, in 2015, you can still be fired for being gay...this kind of discrimination goes against everything we stand for.""",,
2601,3 Oct 2015,False,"""As President, I will push to cut off federal funding for any public child welfare agency that discriminates against LGBT people."" -Hillary",,
2602,3 Oct 2015,False,"""We need to say with one voice that transgender people are valued, they are loved, they are us"" -Hillary at @HRC today",,
2603,2 Oct 2015,False,"""Republicans keep refusing to do anything to protect our communities. They put the NRA ahead of American families. It is wrong."" -Hillary",,
2604,2 Oct 2015,False,"""We don't just need to pray...We need to act...Republicans and the NRA say, now is not the time to talk about guns. Yes, it is."" -Hillary",,
2605,2 Oct 2015,False,"""What is wrong with us that we can't stand up to the NRA and the gun lobby and the gun manufacturers they represent?"" -Hillary",,
2606,1 Oct 2015,False,Proud to have @wendydavis on Team Hillary. pic.twitter.com,,
2607,1 Oct 2015,False,"Another devastating shooting. We need sensible gun control measures to save lives, and I will do everything I can to achieve that. -H",,
2608,1 Oct 2015,False,The United States is the only country in the developed world without guaranteed paid leave. That has to change. pic.twitter.com,,
2609,30 Sep 2015,False,"In case you were wondering, you should be following hillaryclinton on Snapchat.  pic.twitter.com",,
2610,30 Sep 2015,False,You shouldn't have to worry about your paycheck or your job when you have a baby or someone in your family gets sick.,,
2611,30 Sep 2015,False,“Nobody in America should have to choose between buying the medicine they need and paying their rent.” -Hillaryhttps://amp.twimg.com/v/14914345-fbe9-4f9c-ac42-c552a753d9f9 …,,
2612,29 Sep 2015,False,"In school, I learned how to think creatively and stand up for myself. #62MillionGirls don't have that chance. http://62milliongirls.com  -H",,
