,date,retweet,text,,,,,
545,11 Aug 2014,False,"Mork from Ork: Rare evidence that aliens can be smart, clever, articulate & funny.  Robin Williams, RIP",,,,,
546,11 Aug 2014,False,"July’s full moon is to August's ""Super Moon” what a 16.0 inch pizza is to a 16.1 inch pizza. I’m just saying.",,,,,
547,8 Aug 2014,False,"Seems to me, as long as we don't program emotions into Robots, there's no reason to fear them taking over the world.",,,,,
548,3 Aug 2014,False,"When other mammals get bored, I wonder if they use this free time to contemplate their place in the universe, as humans do.",,,,,
549,3 Aug 2014,False,Dracula & other undead people who sleep in coffins must have good abs. They always rise up flat-backed when the casket opens.,,,,,
550,29 Jul 2014,False,The @UPS tracking uses 17 digits & one letter. Enough for 2.6 quintillion packages. That's 370 million per person on Earth.,,,,,
551,29 Jul 2014,False,"When a coincidence seems amazing, that's because the human mind isn’t wired to naturally comprehend probability & statistics.",,,,,
552,25 Jul 2014,False,"If @Comic_Con people ruled the world, the future would be invented daily & warfare would be bar-fights with toy light-sabers.",,,,,
553,25 Jul 2014,False,Space Aliens better not land in SanDiego this week. Nobody would take notice. They'd blend right in with @Comic_Con attendees,,,,,
554,25 Jul 2014,False,"In cartoons, Lobsters & other Crustaceans that talk are typically drawn Red. But they’re that color only after you boil them",,,,,
555,21 Jul 2014,False,"The more oddly shaped your City's buildings are, the more likely they will be featured In photos for Travel Brochures.",,,,,
556,13 Jul 2014,False,RT @Sara2Dee2:  pic.twitter.com // Gotta love data.,,,,,
557,13 Jul 2014,False,"Good thing Spanish fútbol sportscasters don’t announce basketball, they’d spend 1/3 of playing time saying “Goooooooooooool”",,,,,
558,13 Jul 2014,False,Learned from Sportscasters on @Univision network that the word “Goal” in Spanish requires a full ten seconds to say.,,,,,
559,13 Jul 2014,False,"Dear @TheTweetOfGod, after World Cup controversial calls, in what language do players&referees argue? Any lessons from Babel?",,,,,
560,13 Jul 2014,False,Laws of physics describing gravity & energy conspire to make spheres (like the soccer ball) a common shape in the Universe.,,,,,
561,13 Jul 2014,False,"64 games, 32 countries, 1 month of distraction from the workday. I wonder how much the world’s GDP drops during the World Cup",,,,,
562,9 Jul 2014,False,I wonder what Rugby players think every time they see a Soccer player crying in pain from being grazed by another player.,,,,,
563,7 Jul 2014,False,"Never liked the term “nonfiction"".  The truth should have its own word, and not be shackled to its antonym.",,,,,
564,5 Jul 2014,False,"In the sky this summer's eve, find high & nice, what many call a half Moon. ""First Quarter"" to be precise. It rose at noon.",,,,,
565,4 Jul 2014,False,Enjoying colorful fireworks tonight? Thank Aluminum Barium Calcium Chlorine Copper  Iron Nitrogen Oxygen Sodium & Strontium.,,,,,
566,4 Jul 2014,False,"Seasons are caused by the 23.5-degree tilt in Earth’s axis. Without it, fashion would need a different excuse to change.",,,,,
567,4 Jul 2014,False,"Earth is closest to the Sun in January -- ""Perihelion"".  But USA Astronomers celebrate the July 4th Aphelion with fireworks.",,,,,
568,4 Jul 2014,False,"July 4, 2014. At 94.5-million miles, Earth, in its oval orbit, is at ""Aphelion"" --  our farthest distance from the Sun.",,,,,
569,25 Jun 2014,False,"Humans kill one another so often, for all reasons including none, I wonder how we'd treat a peaceful alien who visited Earth.",,,,,
570,18 Jun 2014,False,Q: Where do Attorneys got to get a drink?  A: The Bar,,,,,
571,18 Jun 2014,False,Just came up with a stupid joke that i'm compelled to share: Q: Where do Elephants go to get a drink?  A: The Ba-Bar.,,,,,
572,17 Jun 2014,False,"When aliens arrive on Earth & study our web infrastructure, they'd likely conclude cute cats are the engines of our Internet.",,,,,
573,13 Jun 2014,False,"There’s a very large array of radio telescopes in New Mexico.  As seen in the film Contact. We call it the “Very Large Array""",,,,,
574,13 Jun 2014,False,"Want More?  The far side of the Moon is called “The Far Side of the Moon""",,,,,
575,13 Jun 2014,False,No other scientific field rivals astrophysics in the transparency of its lexicon.,,,,,
576,13 Jun 2014,False,"The titanic explosion that birthed all of space, time, matter, and energy we call the “Big Bang""",,,,,
577,13 Jun 2014,False,"Jupiter’s big red spot is called “Jupiter’s Red Spot""",,,,,
578,13 Jun 2014,False,"Generally in the universe we name things in ways that minimize confusion.  e.g. Spots on the Sun are called “Sun Spots""",,,,,
579,13 Jun 2014,False,Never knew why phobias are given long complicated names.  Afraid of today? Friday the 13th? You are Friggatriskadekaphobic.,,,,,
580,13 Jun 2014,False,"June's Full Moon crosses the sky lower than any other in the year, taking on an amber hue.  Granting the label “Honey Moon”.",,,,,
581,8 Jun 2014,False,"After filming the #CosmosFinale, @SethMacFarlane & I knocked back a cold one on the crescent Moon. pic.twitter.com",,,,,
582,8 Jun 2014,False,"Cosmos was a labor of love, an offer of hope, and a vision of a future that could be. Thanks for joining my SpaceTime Odyssey",,,,,
583,8 Jun 2014,False,"While filming #Cosmos, parting the sedimentary layers of the Grand Canyon was harder than it looked. pic.twitter.com",,,,,
584,8 Jun 2014,False,Between scenes on #Cosmos. Hadrian’sVilla. Surely the cover art for my nonexistent album of love songs pic.twitter.com,,,,,
585,8 Jun 2014,False,"Yeah, I’m self-aware that the ShipOfTheImagination on the #CosmosFinale & the entire series is Badass. pic.twitter.com",,,,,
586,8 Jun 2014,False,"By the time the #CosmosFinale ends, the beginning of the program will have passed Jupiter, en route to the depths of space.",,,,,
587,8 Jun 2014,False,"Because #Cosmos aired on broadcast television and not cable, all 13 programs have escaped Earth at the speed of light.",,,,,
588,8 Jun 2014,False,"#Cosmos was conceived not to tell the you what is true, but to share how we have come to learn what is true.",,,,,
589,8 Jun 2014,False,"Ep 1 of #Cosmos, “Waking Up in the Milky Way” aired 14 weeks ago. Those TV signals are now entering the Oort Cloud of comets.",,,,,
590,8 Jun 2014,False,"By week’s end, the #CosmosFinale will have aired in 181 countries in 46 languages — 47 if you include the language of Science",,,,,
591,7 Jun 2014,False,Never presume that just because you disagree with an idea that you must be correct.,,,,,
592,6 Jun 2014,False,"Last night @JimmyFallon  “accused"" me of being a nerd.  But on his Twitter page he's an astrophysicist pic.twitter.com",,,,,
593,1 Jun 2014,False,The last segment of tonight’s #Cosmos may blow your mind.  It blew mine.,,,,,
594,1 Jun 2014,False,"Taking a break between shots, on location at the White Cliffs of Dover, UK.  For #Cosmos. pic.twitter.com",,,,,
595,1 Jun 2014,False,Yeah.  it’s #Cosmos time.,,,,,
596,1 Jun 2014,False,"After a @NASCAR postponement for Memorial Day weekend, #Cosmos returns on @FoxTV Sunday evening. Be there or be Dark Matter.",,,,,
597,1 Jun 2014,False,"At Santa Fe Studios, in New Mexico, while filming #Cosmos, I never grew tired of looking at the Chairs pic.twitter.com",,,,,
598,1 Jun 2014,False,"At #AMillionWays party in Santa Fe, I re-met @KaleyCuoco from @BigBang_CBS. Friend of @SethMacFarlane pic.twitter.com",,,,,
599,1 Jun 2014,False,The film #AMillionWays to Die in the West would be numerically accurate if named A Million Occasions to Utter the Word F%&K,,,,,
600,1 Jun 2014,False,"Apart from a badly oriented full moon, I give #AMillionWays an “A” for its sweeping & romantic portrayals of the night sky.",,,,,
601,1 Jun 2014,False,"Was ready to count up to 1,000,000.  But #AMillionWays short-changed me. It showed only twenty-two ways to die in the west.",,,,,
602,1 Jun 2014,False,The block of ice portrayed in #AMillionWays would weigh about 2.5 tons. Enough to squash pretty much anything it fell on.,,,,,
603,28 May 2014,False,"""I know Why the Caged Bird Sings” - In the cacophony of life, a voice that will not soon be replaced. Maya Angelou: 1928-2014",,,,,
604,26 May 2014,False,As any Country that has fought for it knows — Freedom Isn’t Free.,,,,,
605,25 May 2014,False,"Now that @NASA isn’t launching SpaceShuttles, would be cool if @NASCAR allowed drivers to attach unused solid rocket boosters",,,,,
606,25 May 2014,False,"If the Charlotte Motor Speedway increased their banking angle from 24 to 31 degrees, the cars could do the turn at 200 mph.",,,,,
607,25 May 2014,False,"I don't ride, but I imitated how bikers pose on our Relativity bike. On location in Italy. @CosmosOnTV pic.twitter.com",,,,,
608,25 May 2014,False,I drove an electric Tesla roadster once for @NOVAPBS. Neck-snapping acceleration of 0-60mph in 3.9sec. pic.twitter.com,,,,,
609,25 May 2014,False,"At 200mph, a nice @NASCAR speed, it’d take 1200hrs (50days) to drive to the Moon. And drivers would never need to turn left.",,,,,
610,25 May 2014,False,I'm quite sure I'm the last person in the universe to have learned that RACECAR spelled backwards is RACECAR,,,,,
611,25 May 2014,False,"Cosmos postponed a week for NASCAR. During the 9-10pm ET time slot, I suppose I'll tweet the physics of fast-moving things.",,,,,
612,22 May 2014,False,Parents who are no longer curious are not as alive as the children they raise who are.,,,,,
613,22 May 2014,False,Hit 2-million followers earlier today—even after reminding people I’m an astrophysicist. A sure sign that science is trending,,,,,
614,18 May 2014,False,We didn’t actually film on Mars.  That’s what Director @BrannonBraga told me to say to you all.  #WatchingCosmos,,,,,
615,17 May 2014,False,"If we all had twelve fingers, I wonder if Moses would have brought twelve commandments down from Mt. Sinai instead of ten.",,,,,
616,16 May 2014,False,"I may be biased, but wouldn’t it be cool if “Cosmos: A SpaceTime Odyssey” redefined the meaning of Reality TV.",,,,,
617,13 May 2014,False,"If you're told what's the same but see what’s different, or told what's different but see what’s the same, you’re a scientist",,,,,
618,11 May 2014,False,"Newton’s AppleTree at his home. Hold an Apple nearby & you rise weightless, they say. #WatchingCosmos pic.twitter.com",,,,,
619,11 May 2014,False,Gesturing to a GreenScreen star field though the Ship's window. Bill Pope on camera. #WatchingCosmos. pic.twitter.com,,,,,
620,11 May 2014,False,"On location in Woolsthorpe Manor, UK, Isaac Newton’s birthplace. #WatchingCosmos. pic.twitter.com",,,,,
621,11 May 2014,False,"To the nearly half the population of the USA that lives in the Eastern Time Zone ""It’s Cosmos Time""  9pm ET/ 8 Central",,,,,
622,9 May 2014,False,If interested: My short DVD lecture series “The Inexplicable Universe”  http://bit.ly/1jHYIEk  can now be streamed on Netflix.,,,,,
623,8 May 2014,False,The Soviet KGB would have admired all the ways America -- land of the free -- now conducts surveillance on its own citizens.,,,,,
624,4 May 2014,False,"The plains of Africa, created on set at Santa Fe Studios, New Mexico. #WatchingCosmos pic.twitter.com",,,,,
625,4 May 2014,False,Concept illustration of SOTI - Ship Of The Imagination. #WatchingCosmos pic.twitter.com,,,,,
626,4 May 2014,False,What the Cosmic Calendar looked like to me — on set. #WatchingCosmos pic.twitter.com,,,,,
627,4 May 2014,False,May the 4th be with you all.,,,,,
628,1 May 2014,False,Our Common Sense is not derived from what's true in Nature but from what our senses perceive to be true in Nature.,,,,,
629,30 Apr 2014,False,"With comments such as ""lay with them but don't take photos"" Donald Sterling doesn't even qualify as a rational bigot.",,,,,
630,29 Apr 2014,False,"Earth Day was a week ago. But when you think about it, every day should be Earth Day — until we live on more than one planet.",,,,,
631,25 Apr 2014,False,"Not that anybody asked, but when the Moon is in the 7th house, & Jupiter aligns with Mars, nothing will happen because of it.",,,,,
632,23 Apr 2014,False,The limits on your enlightenment come not from the age you stopped going to school but from the age you stopped being curious,,,,,
633,20 Apr 2014,False,Ozzie and I wish all Christians and Bunny lovers of the world a Happy Easter. pic.twitter.com,,,,,
634,16 Apr 2014,False,"As best as I can figure, if the evening news ever needs to show a fuzzy snapshot of you, you are probably missing or dead.",,,,,
635,13 Apr 2014,False,"Decisions,.Decisions. #Cosmos vs #GameOfThrones. Hmm. I think I'll watch the Universe and DVR those ""Middle-Earth Sopranos”.",,,,,
636,13 Apr 2014,False,"Apr13: On this date in 2029 stadium-sized asteroid Apophis buzz-cuts Earth at 45,000 km/hr below our communication satellites",,,,,
637,13 Apr 2014,False,Lunar Eclipses are visible from the entire Earth hemisphere facing the Moon. That’s billions & billions of people  : - ),,,,,
638,13 Apr 2014,False,"At 3.5 hrs, Total Lunar Eclipses are long & boring. Wait for the Moon to enter the deepest part of Earth's shadow: 1:58am ET.",,,,,
639,13 Apr 2014,False,"Total Eclipses occur every couple of years or so. If anyone calls them ""rare"", ask if they feel that way about the Olympics.",,,,,
640,10 Apr 2014,False,"FYI: Tonight's Moon, a waxing gibbous, is the same phase as that of Earth in this Apollo 8 @NASA photo pic.twitter.com",,,,,
641,7 Apr 2014,False,Curious that only in the world of politics is your importance measured by the number of people who want to kill you.,,,,,
642,6 Apr 2014,False,"Yes, #Cosmos: A SpaceTime Odyssey continues. Episode 5: “Hiding in the Light”  Tonight. Be there. @FOXTV 9pm / 8pm Central.",,,,,
643,4 Apr 2014,False,"USA to Russia: “We’re imposing sanctions on you!! But please still allow us on your Soyuz so we can reach our Space Station""",,,,,
644,26 Mar 2014,False,"If your sentence contains the word ""Hope"" then you've confessed no control over the outcome you're hoping for.",,,,,
645,26 Mar 2014,False,ThereY’go:  RT @wlk92  How about this: a redneck turtle burger... pic.twitter.com,,,,,
646,26 Mar 2014,False,I don’t know that I’ve ever seen a fat turtle.,,,,,
647,25 Mar 2014,False,Just an FYI: The Indian Ocean covers half as much area as all the continents of Earth.,,,,,
648,23 Mar 2014,False,Evidence humans are smarter than cats: We don't chase dots on the floor made by lasers.,,,,,
649,21 Mar 2014,False,"What the world needs now, is a little more rhyme and a little more reason.",,,,,
650,20 Mar 2014,False,Oh yeah. And happy Autumn Equinox to the 15% of all humans and 100% of free penguins who live down under.,,,,,
651,20 Mar 2014,False,"March 20, 2014: GeekSpeak: Sun crosses the celestial equator from south to north.   NormalSpeak: Happy Spring Equinox to all.",,,,,
652,18 Mar 2014,False,"Since mega- is the metric prefix for a million, ""Mega Millions"" state lottery jackpots should really be paying trillions.",,,,,
653,17 Mar 2014,False,"If this morning's LA quake was less than Mag 5, note such quakes occur more than 10,000 times per year somewhere in the word.",,,,,
654,17 Mar 2014,False,Happy #StPatricksDay President Barack O’Bama.,,,,,
655,16 Mar 2014,False,"FYI: In #Cosmos episode 2, those are real wolves that I really chase away with a real flaming torch — but my stubble is fake.",,,,,
656,16 Mar 2014,False,"#Cosmos offers access to the operations of nature – big & small – where what’s true is true, whether or not you believe in it",,,,,
657,14 Mar 2014,False,"Famous people who lived through crazy Pi day of March 14, 1592; EIizabeth I, Galileo, Kepler, Shakespeare, Bruno.",,,,,
658,14 Mar 2014,False,"I think of March 14th as 22/7ths day since 22/7 = 3.141414... But Pi = 3.1415926... , so a crazy Pi day was: March 14, 1592.",,,,,
659,13 Mar 2014,False,"If our blood used Copper instead of Iron, turning it green, I wonder what color we would have made stop lights & stop signs.",,,,,
660,10 Mar 2014,False,"When the universe lands in a GQ shoot, you know science is trending in the world. pic.twitter.com",,,,,
661,10 Mar 2014,False,For those who don’t remember when they last saw a TV show on a TV:  The full COSMOS premiere on line: http://bit.ly/1hFYJGU ,,,,,
662,9 Mar 2014,False,"Hello West Cost USA. ""Cosmos: A SpaceTime Odyssey"" awaits you. I hope you enjoy it. Thanks for being part of my twitterverse.",,,,,
663,9 Mar 2014,False,"14 Billion years in the making: ""Cosmos: A SpaceTime Odyssey” tonite on @FOXTV & later this week in 181 countries on @NatGeo.",,,,,
664,9 Mar 2014,False,RT @MatthewSievert: The aliens already know we are idiots.,,,,,
665,9 Mar 2014,False,What would aliens say if told that Earthlings shift clocks by an hour to fool themselves into thinking there's more sunlight,,,,,
666,2 Mar 2014,False,I'm beginning to feel the Gravity of the situation,,,,,
667,2 Mar 2014,False,The element Helium was discovered on the Sun before it was discovered on Earth. Was thus named for Helios the Greek Sun god.,,,,,
668,2 Mar 2014,False,"The Moon Song just performed during the Oscars was either sung in the Southern Hemisphere, or the rising Moon was upside down",,,,,
669,28 Feb 2014,False,"A @BarackObama sandwich-selfie at the @WhiteHouse, earlier today with Bill Nye @TheScienceGuy pic.twitter.com",,,,,
670,28 Feb 2014,False,"If interested: My occasionally ranting interview, posted yesterday, w/ @NPR’s Fresh Air. [Audio 40min] http://n.pr/1pzb1oR ",,,,,
671,27 Feb 2014,False,Gangnam Style on YouTube is rising through 1.9 billion views. About 20x larger than the number of cells in the human retina.,,,,,
672,27 Feb 2014,False,".@esjabe But you can’t cheat laws of physics. When the cars turn or stop, Earth fully recovers the lost rotational momentum.",,,,,
673,27 Feb 2014,False,".@esjabe If all cars aligned west-to-east & floored it, would there be enough torque to slow Earth’s rotation? // Yes.",,,,,
674,27 Feb 2014,False,.@thisiswhyimhotz FYI: Not to worry. That distance is 100-billion times larger than the smallest possible measurable distance,,,,,
675,27 Feb 2014,False,".@thisiswhyimhotz  Just to clarify, in my previous tweet, “wee” = six sextillionths of a millimeter.",,,,,
676,27 Feb 2014,False,".@thisiswhyimhotz: If you do a push up on Earth, does Earth move away from you? Do you push Earth down? // Yes. By a wee bit.",,,,,
677,26 Feb 2014,False,The Latest @StarTalkRadio interview: MythBusters [Pt 2] @donttrythis & @JamieNoTweet now on iTunes & http://bit.ly/1hidC2E ,,,,,
678,25 Feb 2014,False,You are not biased any time you ever speak the truth.,,,,,
679,21 Feb 2014,False,I occasionally wonder whether people who are good at Olympic Curling are also good at sweeping out the basement.,,,,,
680,21 Feb 2014,False,When I shop for fruit & melons I like to hold a grape next to a cantaloupe & think of Earth next to Jupiter. Then I eat Earth,,,,,
681,20 Feb 2014,False,Fan of @MissMayim Bialik?  She’s joining me live at BAM for an all Neuroscience StarTalk show. For tickets: http://bit.ly/1c33AgE ,,,,,
682,19 Feb 2014,False,"""You Maniacs! You **flooded** it! Ah, damn you! God damn you all to hell!”  --Charlton Heston, when he comes back.",,,,,
683,19 Feb 2014,False,"HOWEVER: If you melt all the land ice & glaciers, especially Greenland & Antarctica, Statue of Liberty would be waist deep.",,,,,
684,19 Feb 2014,False,"And while we’re there: If all the Arctic Ocean’s floating ice & icebergs melted, Earth’s sea level would remain unchanged.",,,,,
685,19 Feb 2014,False,"You can’t compress ice. If you try, it instantly liquefies to occupy less volume, as under the hi-pressure of a skate blade.",,,,,
686,19 Feb 2014,False,"As anybody who freezes food knows, water becoming ice expands by about 10%. Also why 10% of an iceberg sits above the water.",,,,,
687,19 Feb 2014,False,Obscure Fact: Skating is possible only because compressed ice melts. So skaters glide on slippery water not on slippery ice.,,,,,
688,19 Feb 2014,False,In the NYC metro area next week?  We’re taking @StarTalkRadio live to BAM.  Monday night. Be there. http://bit.ly/1c33AgE ,,,,,
689,17 Feb 2014,False,"Is it just me, or do the Aussie wall sockets resemble The Scream mask? pic.twitter.com",,,,,
690,17 Feb 2014,False,QUESTION:  What were the very first straws made of?  ANSWER: Straw.,,,,,
691,15 Feb 2014,False,"If @RealJeffreyRoss and other comedians honored @SnoopDogg, would that be a “Pot Roast”?",,,,,
692,15 Feb 2014,False,"Without a space program that discovers, tracks & deflects killer asteroids, our extinction is assured by one. Have a nice day",,,,,
693,15 Feb 2014,False,"The Russian meteor injured 1500 people, most running to the window, not remembering that blast waves travel slower than light",,,,,
694,15 Feb 2014,False,"Had the 15 February 2013 Russian meteor exploded 0.6 km high, as in Hiroshima, no person in Chelyabinsk would have survived.",,,,,
695,15 Feb 2014,False,"The 15 Feb 2013 Russian meteor, carried 25X the energy of the Hiroshima bomb.  Exploding 30km up, it “only” shattered windows",,,,,
696,12 Feb 2014,False,"Nothing like being overexposed.  No, literally, they could have dropped an f/stop or two on this photo pic.twitter.com",,,,,
697,9 Feb 2014,False,"WINTER OLYMPICS: The continuous display of Earth's gravity, coupled with the absence of friction --  plus occasional gunfire.",,,,,
698,5 Feb 2014,False,Some claim the Snow in Atlanta was fake. Evidence of unfamiliarity with the thermal properties of crystallized precipitation.,,,,,
699,4 Feb 2014,False,"Felix Baumgartner's ""Edge of Space” jump, if scaled to a schoolroom globe, begins 1mm above its surface. I'm just saying.",,,,,
700,2 Feb 2014,False,"Parting is such sweet sorrow, that I shall say goodnight to this universe, ’til it be morrow.",,,,,
701,2 Feb 2014,False,"Denver's official elev. is 5280 ft, enabling most residents to earn easy membership to the otherwise exclusive Mile High Club",,,,,
702,2 Feb 2014,False,In search of a cosmically consoling thought for Denver Fans...,,,,,
703,2 Feb 2014,False,"If gridiron were a timeline, w/ Big Bang at one goal, then cavemen to now spans thickness of single turf-blade at other goal.",,,,,
704,2 Feb 2014,False,Bowl names still unused: SaladBowl SoupBowl ChileBowl HollywoodBowl CerealBowl TidyBowl FishBowl ToiletBowl BowlWeevil,,,,,
705,2 Feb 2014,False,Almost Forgot - Today’s Groundhog Day. Evidence that meteorologists haven't yet convinced people they can predict the future.,,,,,
706,2 Feb 2014,False,A 50-yard field goal in MetLife stadium will deflect nearly 1/2 inch due to Earth’s rotation — meet the Coriolis force.,,,,,
707,2 Feb 2014,False,"( No need to ask me where I looked up these numbers - I didn’t. I calculated them myself. It's called the ""Brain App” )",,,,,
708,2 Feb 2014,False,"If 335lb Terrance Knighton of the Broncos hits you at 10 mph, it's 40x the momentum of a 12 gauge shotgun blast to your chest",,,,,
709,2 Feb 2014,False,"Scientology & Astrology. Just because you can append an “-ology” to a word, does not make it based in objective reality.",,,,,
710,2 Feb 2014,False,"Can you feel the universe? @FoxTV airs half-time promo for ""Cosmos: A SpaceTime Odyssey"" & halftime show is a guy named Mars",,,,,
711,2 Feb 2014,False,"From the Ad, it’s clear that all VW German engineers who get wings when a Volkswagen hits 100,000 miles are Men.",,,,,
712,2 Feb 2014,False,"WARNING: In two years, for the 50th game, the Roman numerals shrink in the cold to hardly anything — ""Super Bowl L""",,,,,
713,2 Feb 2014,False,That Cosmos Promo was fast.  But I feel another one coming.  The night is young.,,,,,
714,2 Feb 2014,False,"Just an FYI: There’s a Rumor that FOX will air a Promo for ""Cosmos: A SpaceTime Odyssey"" during the Super Bowl.",,,,,
715,2 Feb 2014,False,Momentum Transfer. Elastic & Inelastic Collisions. Spin-stabilized projectiles. There’s nothing like Physics & Football.,,,,,
716,2 Feb 2014,False,The Super Bowl: One of the finest expressions of Newton's laws of motion in the entire universe.,,,,,
717,31 Jan 2014,False,Bad Joke I just made up but am compelled to share:What happens if too many aliens come for dinner? You have extraterrestrials,,,,,
718,30 Jan 2014,False,"Born after 1995 -- the year the first planet outside our solar system was discovered? Then you are ""Generation Exoplanet"" #BucknellU",,,,,
719,29 Jan 2014,False,A shout out to Canadians for putting your versatile robotic Space Arm on your $5 note: pic.twitter.com,,,,,
720,28 Jan 2014,False,Do we really need the President to report on the State of the Union?  The State of the Union seems pretty obvious to me.,,,,,
721,28 Jan 2014,False,"The spelling of “misspelled” should be changed to “mispelled"" so that when people mispell it, they won't have misspelled it.",,,,,
722,27 Jan 2014,False,Your State taxes at work. pic.twitter.com,,,,,
723,26 Jan 2014,False,"Astrophysicists are monitors of extreme adjectives.  Which is why ""Miss Universe"" to us is just ""Miss Earth"".",,,,,
724,26 Jan 2014,False,I think the winner of the Pro Bowl should play the winner of the Super Bowl in a new event called the Super Duper Bowl.,,,,,
725,25 Jan 2014,False,"Yup, Dogs & Cats are genetically modified organisms. So are practically all foods we eat — 10,000 years of agriculture.",,,,,
726,25 Jan 2014,False,"We’re delighted to see videos of cute cats & dogs doing cute things, forgetting, perhaps, that we bred them to be that way.",,,,,
727,22 Jan 2014,False,Yup. This Orwellian commercial aired only once. During the SuperBowl. Thirty years ago today. http://bit.ly/1aq7Awz ,,,,,
