,date,retweet,text,,,,,
1792,17 Dec 2010,False,"More than a tweet, on the passing of Ambassador Richard Holbrooke:  http://nyti.ms/g0r5CZ",,,,,
1793,17 Dec 2010,False,CosmicPerspectiveFri: Science literacy is less about what you know & more about how your brain is wired for asking questions>,,,,,
1794,16 Dec 2010,False,"1. @JRichardGott ""Sizing Up the Universe"" My jacket blurb for it: A feast for the eyes and a banquet for the mind.",,,,,
1795,16 Dec 2010,False,"2. @PlutoKiller Mike Brown has confessed, first in his Twitter handle, now in ""How I Killed Pluto & Why it Had it Coming""",,,,,
1796,16 Dec 2010,False,"4. @ProfBrianCox ""Why Does E=mc2?: (And Why Should We Care?)""  Warm up here:  http://bit.ly/gEcqq8 Then buy his book.",,,,,
1797,16 Dec 2010,False,"5. @TheRealBuzz Aldrin ""Magnificent Desolation: The Long Journey Home from the Moon"". Moving memoir of an American Hero.",,,,,
1798,16 Dec 2010,False,"SciLiterate humor via @SethMacFarlane -Hey Nature, the Doppler effect sounds like a lame DJ gimmick. Just play the damn sound",,,,,
1799,15 Dec 2010,False,"A thought to disturb restful slumber - The exact letters that spell ""eleven plus two"" also spell ""twelve plus one""",,,,,
1800,15 Dec 2010,False,"Galaxy NGC1300, 65million light yrs from Earth.  http://yfrog.com/gzqh8tj  Light from dying dinosaurs just now reaching them.",,,,,
1801,15 Dec 2010,False,".@Mikey_N Yup, with mondo telescopes, aliens in a galaxy 65mil light yrs away would today see Earth's Dinosaurs going extinct",,,,,
1802,13 Dec 2010,False,Hypersonic pebbles from space - Geminid Meteor Shower tonite (Mon). Hayden's own JoeRao takes you there  http://bit.ly/hhXood,,,,,
1803,12 Dec 2010,False,"Without physics there'd be no Fashion Channel -- there'd be no TV. But w/o fashion, physicists might just be naked. Not good.",,,,,
1804,11 Dec 2010,False,Watching a Zamboni clear an ice rink  Took 10min at about  3mph. Nothing a pair of NASA Solid Rocket Boosters couldn't solve.,,,,,
1805,11 Dec 2010,False,.@chinashpmatador Quite sure I'll fail trying to explain tidal locks in 140 characters. Next best thing:  http://bit.ly/e2lq1L,,,,,
1806,10 Dec 2010,False,"CosmicPerspectiveFriday: As the area of our knowledge grows, so too does the perimeter of our ignorance.  http://bit.ly/9LG7XQ",,,,,
1807,8 Dec 2010,False,"If someone does you a favor, returning it closes off goodness from the cosmos. Passing it forward compels the world to thrive",,,,,
1808,8 Dec 2010,False,"In life, we should all age gracefully, like a fine wine, developing complexities with time.",,,,,
1809,7 Dec 2010,False,"In Terminator, only living things can time-travel. But hair is dead. So Arnold should've landed in LA not only naked but bald",,,,,
1810,6 Dec 2010,False,At a fine Italian restaurant this evening. Served grappa at meal's end. @NASA should study it as a replacement rocket fuel.,,,,,
1811,6 Dec 2010,False,A UFO for some. An IFO for others. Planet Venus graces the pre-dawn night. Sparkling. Majestic. You'd think it took flight.,,,,,
1812,6 Dec 2010,False,"December 6, 2010: The 65th anniversary of the microwave oven. Science Literacy: Knowing not to dry your wet poodle in it.",,,,,
1813,5 Dec 2010,False,Most extinct life can blame natural forces beyond its control. But when we go extinct all we'll get to blame is our stupidity,,,,,
1814,5 Dec 2010,False,Out of market? SarTalk Radio streams live on  http://startalkradio.net/,,,,,
1815,5 Dec 2010,False,Was part of fun @wnycRadioLab on the force of Gravity and falling cats. Segments starts about 14m in:   http://bit.ly/eGcqgv,,,,,
1816,5 Dec 2010,False,#AmericanIdol moving to Wed/Thu nites. Opposite The Big Bang Theory on Thu. My guess: #TBBT won't lose a single viewer,,,,,
1817,2 Dec 2010,False,RT @paulrpotts: I for one welcome our arsenic-eating overlords. I'm sure their rule will be firm but fair. And...smell bad.,,,,,
1818,2 Dec 2010,False,"Hi radiation, hi temp, hi pressure, hi acid, & arsenic kills humans. But doesn't mean microbes can't do the back-stroke in it",,,,,
1819,2 Dec 2010,False,"Like Carbon&Silicon in PeriodicTable, Phosphorus&Arsenic sit above&below one another, making them kindred souls of chemistry",,,,,
1820,1 Dec 2010,False,"WordsWednesday: Wasn't just an A-Z typing task. Proof that ""The quick brown fox jumps over the lazy dog""  http://bit.ly/2ByF7",,,,,
1821,1 Dec 2010,False,.@elgc45 Stay Calm. The Moon won't tidally lock Earth until billions of years after Sun's death. We'll be incinerated by then,,,,,
1822,28 Nov 2010,False,Seasonal geek humor via @schierholz - What do you get when you divide a pumpkin's circumference by its diameter? Pumpkin Pi,,,,,
1823,27 Nov 2010,False,Sorry to not be clearer. 12 stitches in NBA: you're a hero. 12 stitches in pickup game at the White House: you're a geek.,,,,,
1824,27 Nov 2010,False,Evidence that the President is actually a geek: needed 12 stitches after a pickup game of basketball at White House,,,,,
1825,25 Nov 2010,False,"If turkey dinners were as tasty as many declare, they'd be in places other than cafeterias. But not even Denny's offers it.",,,,,
1826,25 Nov 2010,False,"Turkey dinners never excite me. I eat them exactly once per year, which may be too often. Am I alone in this confession?",,,,,
1827,25 Nov 2010,False,"Thanksgiving dinner, a few years ago, each in turn thanked God for food. I thanked scientists for improved farming. Got booed",,,,,
1828,24 Nov 2010,False,Exoplanet count now up to 504. And Wednesday isn't over yet. Wanna track 'em? Free Exoplanet App:  http://bit.ly/dHCLNH,,,,,
1829,24 Nov 2010,False,"Wednesday Word Arithmetic: Always found it curious that ""Now"" + ""Here""  =  ""Nowhere""",,,,,
1830,24 Nov 2010,False,.@ArmaVirumque All stars are plasma. So is most fire. Nothing mysterious. Just gas molecules in a soup of freed electrons.,,,,,
1831,24 Nov 2010,False,Mag. fields cannot cross w/o severe distortion. So then all you'd need to confuse a LightSaber is a jumbo horseshoe magnet,,,,,
1832,22 Nov 2010,False,Fan of Geek Food? Fractal broccoli from my last trip to Fairbanks:  http://yfrog.com/63us9kj  http://yfrog.com/dymeygj,,,,,
1833,22 Nov 2010,False,"GeeksOnly: Light easily crosses itself. If StarWars saber is made of light energy, the saber is poor defense vs. other sabers",,,,,
1834,20 Nov 2010,False,Don't miss the Full Moon this night -- big and round and high and bright.,,,,,
1835,20 Nov 2010,False,"A crisp 55-deg day in NYC, with tree leaves donning Autumn colors. Gotta love early October. Oops, my bad. It's late November",,,,,
1836,19 Nov 2010,False,Cosmic Perspective Friday: Simple reflections on DNA and human intelligence [4min 45s] http://bit.ly/dxy5lw,,,,,
1837,19 Nov 2010,False,Einstein's Relativity in #HarryPotter: Seventy-five min of content time-dilates into a 2.5 hour film.,,,,,
1838,17 Nov 2010,False,"Boston, NYC, Newark, Philly, Pitt, DC, Detroit, Atlanta, Miami -- half pop of USA. Should rename Eastern Time to ""City Time""",,,,,
1839,17 Nov 2010,False,"Words Wednesday: Curious & perhaps cruel that if you speak with a lisp, you cannot pronounce the word ""lisp"" without a lisp",,,,,
1840,16 Nov 2010,False,"Thurs morn, Earth plows thru remnant trail of Comet Tempel-Tuttle. We call these events ""meteor showers""  http://bit.ly/bffVo3",,,,,
1841,15 Nov 2010,False,The waxing gibbous moon visits Jupiter this night. They grace the evening sky -- high above after twilight,,,,,
1842,14 Nov 2010,False,Weekend Sound Banquet: Stuff I say when talking to science-career-bound students [1hr 30min]:  http://bit.ly/j1Eb3,,,,,
1843,12 Nov 2010,False,"Actual names: mllion, billion, trillion, quadrillion, quintillion, sextillion, septillion, octillion, nonillion, decillion",,,,,
1844,11 Nov 2010,False,".@heraisthekey How big is a zillion, you ask? It's a 1000 times larger than a squillion, but only 1/1000th of a bezillion.",,,,,
1845,10 Nov 2010,False,"Word Wednesday: Good thing for French. Instead of ""Red Stick,"" Louisiana, we get to call it ""Baton Rouge.""",,,,,
1846,9 Nov 2010,False,"Nov 9, 2010: Carl Sagan's 76th Birthday. My first encounter with him, retold here [1 min 40 sec]:  http://bit.ly/4fEcin",,,,,
1847,8 Nov 2010,False,Congrats to @ConanOBrien now on TBS. Told him three years ago to fix Moon on his set:  http://bit.ly/bH32pN Looks like he did.,,,,,
1848,6 Nov 2010,False,"Weekend Sound Banquet: ""Life the Universe & Everything""  SciCafé. My place. This past summer [90 min]:  http://bit.ly/aevGhI",,,,,
1849,5 Nov 2010,False,"New Moon this eve, which means no Moon in sight. Leaving stars & planets alone, in splendor against the darkness of night",,,,,
1850,5 Nov 2010,False,"Cosmic Perspective Friday: If you cram a herd of 50-million elephants into a thimble, you get the density of a neutron star",,,,,
1851,4 Nov 2010,False,"TONIGHT: My cameo debut on #TheBigBangTheory. And yes, I get into a kerfuffle with Sheldon - over Pluto's planetary status",,,,,
1852,3 Nov 2010,False,"Wednesday Word Arithmetic: Superstition lingers in our language.  ""Disaster"" = ""Dis"" + ""Aster.  Latin for ""Bad Star""",,,,,
1853,2 Nov 2010,False,The best evidence that Christine O'Donnell is not a Witch is that she's losing the Delaware race for Senator.,,,,,
1854,1 Nov 2010,False,At Friends Seminary in NYC. About to tell 300 people why America is breeding a land of scientifically illiterate people.,,,,,
1855,1 Nov 2010,False,Cosmic Perspective Friday: Smartest 25% of people in China outnumbers the entire population of the United States of America.,,,,,
1856,31 Oct 2010,False,"While trick-or-treating tonite, look for Jupiter -- high in the sky & bright as a plane. Also, half-Moon rises around 1 a.m.",,,,,
1857,29 Oct 2010,False,"Just an FYI: If you removed all of a person's veins and arteries, and laid them end to end, then that person will die.",,,,,
1858,29 Oct 2010,False,Just an FYI:  The smartest 25% of people in China outnumber the entire population of the United States of America.,,,,,
1859,27 Oct 2010,False,Wednesday Word Arithmetic:  Was always curious to me that:   s + laughter = slaughter,,,,,
1860,26 Oct 2010,False,Back from taping #TheBigBangTheory  http://yfrog.com/534nvj My episode airs Nov 4. Full Album:  http://on.fb.me/9FPqeO,,,,,
1861,24 Oct 2010,False,".@ripped_strings You ask, ""Are planets and stars perfectly spherical?"" Check out ""On Being Round"" -   http://bit.ly/99oJ4d",,,,,
1862,24 Oct 2010,False,Changes in gravity do move at speed of light. Lose the Sun and 500 sec later Earth becomes a cosmic vagabond in void of space,,,,,
1863,24 Oct 2010,False,".@ericdb0 If Sun suddenly vanished, we would not know it for 500 sec -- the light & gravity travel time from Sun to Earth",,,,,
1864,23 Oct 2010,False,"Feliz, the 22-yr old Texas pitcher, struck out A-Rod for last out. His 2010 salary equals what A-Rod earns in two games.",,,,,
1865,22 Oct 2010,False,CosmicPerspectiveFriday: Weight of pillow on your head at night exceeds tidal force of Moon+Planets by factor of 7-trillion,,,,,
1866,21 Oct 2010,False,"If you missed it: ""The Poetry of Science"" a chat w/ @RichardDawkins at Howard Univ. (1hr 20m):   http://youtu.be/9RExQFZzHXQ",,,,,
1867,21 Oct 2010,False,".@Himmathand In space, not only can nobody hear you scream, nobody can hear you explode either.",,,,,
1868,20 Oct 2010,False,"The nearly-full Moon visits Jupiter this night. Together, they rule all that's in sight.",,,,,
1869,20 Oct 2010,False,"Wednesday Word Arithmetic:  Always found it curious that the word 'Lie"" is the exact middle of the word ""Believe""",,,,,
1870,18 Oct 2010,False,"Time to get my Geek on: @BillPrady, co-creator of #TheBigBangTheory, has officially asked me to appear on the show.",,,,,
1871,17 Oct 2010,False,We praise the surviving miners. We heap media & money upon them. Yet we ignore loved ones of untold miners who die each year.,,,,,
1872,17 Oct 2010,False,If the surviving miners are heroes (rather than victims) then what do you call the NASA & Chilean Engineers who saved them?,,,,,
1873,15 Oct 2010,False,"When you've never had Physics 101, the world looks mystical to you. Just ask Double-Rainbow Guy:  http://youtu.be/OQSNhk5ICTI",,,,,
1874,15 Oct 2010,False,"Physics of rainbows leaves them always face-on to viewer, so can never visit endpoints. Best-place-ever to hide pots of gold.",,,,,
1875,14 Oct 2010,False,"To divide by zero is ""undefined."" Still waiting for somebody to define it so we can all get on with our calculations.",,,,,
1876,13 Oct 2010,False,"We celebrate the rescue of miners, yet we do not lament the fact that we still use humans to hew resources from Earth's crust",,,,,
1877,12 Oct 2010,False,.@ihatetthisname You accuse me of opining against religion. No. Citing facts should never be confused with having an opinion.,,,,,
1878,11 Oct 2010,False,"Italy valued cathedrals while Spain valued explorers. So worldwide, five times as many people speak Spanish than Italian",,,,,
1879,11 Oct 2010,False,"Columbus Day today. Italian Americans come out in droves to celebrate. But why? Spain, not Italy, paid for his voyages.",,,,,
1880,8 Oct 2010,False,Are you smarter than a 2-year old?  (2 min)   http://youtu.be/DPubhxZXC9g,,,,,
1881,8 Oct 2010,False,"In case anybody wondered, the study of the universe is, indeed, the **second** oldest profession.",,,,,
1882,7 Oct 2010,False,"Don't know if it's good or bad that a Google search on ""Big Bang Theory"" lists the sitcom before the origin of the Universe",,,,,
1883,5 Oct 2010,False,MUST SEE:  The Onion. Video on education reform (2 min):   http://onion.com/9xnQEV,,,,,
1884,4 Oct 2010,False,.@ishowyouapple Wondering if intelligent life exists on Gliese 581g? I'm still wondering if intelligent life exists on Earth,,,,,
1885,1 Oct 2010,False,State lotteries are a tax on all those who did not do well in mathematics in school.,,,,,
1886,30 Sep 2010,False,If interested: Will be on @NBCnightlynews (Brian Williams) tonite & TODAY Show Fri morn. Topic: Newly-found Earthlike planet,,,,,
1887,30 Sep 2010,False,".@USAirForce has styled bird wings as symbol. But we now fly at speeds that'd vaporize a bird, & in space, wings are useless.",,,,,
1888,29 Sep 2010,False,Cut an apple in half across its middle. Five seed chambers in view. Apple orchard flowers have five petals. Cool.,,,,,
1889,28 Sep 2010,False,Police dogs. Combat guards w/assault rifles. ID checks. 1960s SovietUnion? 1940s Germany? No. Amtrak NYC to DC - America 2010,,,,,
1890,28 Sep 2010,False,"Astro-educators remain busy undoing damage caused by 1973 hit album ""Dark Side of the Moon."" Nope. All sides get sunlight.",,,,,
1891,27 Sep 2010,False,"If interested: ""Poetry of Science"" I'll be live on stage w/ @RichardDawkins. Noon Tue Sept 28 WashDC  http://bit.ly/bWR3Sn",,,,,
1892,26 Sep 2010,False,"Just Netflixed ""2012."" Six Billion people dead at film's end. Was prepared because PG-13 rating warned of ""Mild Violence""",,,,,
1893,24 Sep 2010,False,"CosmicPerspFri: The more astrophysics you learn, the more the cosmos becomes food the mind as well as poetry for the heart.",,,,,
1894,23 Sep 2010,False,"Try as I might, I can't resist the space-time continuum vibe, calling me to watch tonite's premiere of CBS's TheBigBangTheory",,,,,
1895,23 Sep 2010,False,Harvest Moon Tonite - closest full moon to equinox. Wonder how full moons affect humans? (2m 30s)  http://youtu.be/bVk-2XAd-kI,,,,,
1896,22 Sep 2010,False,"Oh, and happy Spring to the 15% of Earth's human population who live in the Southern Hemisphere.",,,,,
1897,22 Sep 2010,False,Sep 22. 11:09pm ET. Geekspeak: Sun along the ecliptic crosses celestial equator going south. Everybody else: Fall begins,,,,,
1898,21 Sep 2010,False,"More Geek Metric Humor: A voyage that's ""1/100th Mental"" is surely a ""Centi-mental Journey""",,,,,
1899,21 Sep 2010,False,"GeekHumor: ""Two Thousand Mocking Birds"" = metric version of Harper Lee's ""Two Kilo-Mockingbird.""  Happy 50th anniv. to novel.",,,,,
1900,21 Sep 2010,False,MUST SEE: Zoomable graphic of observable universe. Accurate enough.  http://bit.ly/cw5MwT,,,,,
1901,20 Sep 2010,False,"It's best to never say ""never,"" except, of course, when you say ""never"" say never.",,,,,
1902,20 Sep 2010,False,When you're interviewed by people from the United Nations they ask different questions: (Podcast 30m)  http://bit.ly/9pgr6t,,,,,
1903,15 Sep 2010,False,"Flattered to appear in the new Twitter video  http://bit.ly/aqTHfE But alas, as it should be, it's the Moon they honor and not I",,,,,
1904,12 Sep 2010,False,Been wishing on first star you see at night & your wishes not coming true?  That's because it's a planet: Jupiter,,,,,
1905,11 Sep 2010,False,"At 110 stories tall, Sun set 2min later for people at top of #WTC Towers than for those at bottom:  http://bit.ly/9iyotA",,,,,
1906,10 Sep 2010,False,"Likely source of all conflict in world: believing what you want or what feels good, rather than what is objectively true.",,,,,
1907,8 Sep 2010,False,"I stand in silent gaze under a star-filled Moonless sky. With Jupiter, big and bright. And the Milky Way crossing the night.",,,,,
1908,3 Sep 2010,False,"State Lotteries are not a ""tax on the poor"" but a tax on all those people who never did well in mathematics.",,,,,
1909,1 Sep 2010,False,THIS JUST IN: Best 2-min video on how sci-discovery has influenced you wins trip for 2 to NYC. Details  http://bit.ly/9tMVgr,,,,,
1910,31 Aug 2010,False,"Nothing to tweet today, except for all those who wanted more space, universe continues to expand at 74 km/s per Megaparsec",,,,,
1911,30 Aug 2010,False,"Animal barbarism: everything we eat (except salt) was extracted from something alive. Or was once alive, then killed for food",,,,,
1912,29 Aug 2010,False,Too much page-turning by musicians in Orchestras. Could wear heads-up dispays like fighter pilots. And it would look cool.,,,,,
1913,28 Aug 2010,False,"Another thought to disturb restful slumber, especially if you are vain: in a mirror you can kiss yourself only on the lips",,,,,
1914,27 Aug 2010,False,Cosmic Perspective Friday: More bacteria live & work in 1 cm of your lower colon than the sum of all humans ever born.,,,,,
1915,26 Aug 2010,False,"Must See: Discovery of Asteroids from 1980 to 2010, capturing the exponential increase over time  http://youtu.be/S_d-gs0WoUw",,,,,
1916,26 Aug 2010,False,"Victim of the ""Two Moons"" Mars e-mail?  Here's the antidote:  http://bit.ly/aYICWC",,,,,
1917,26 Aug 2010,False,Sun heats Earth surface. Earth surface heats air. Time delay makes PM hotter than Noon and August hotter than June.,,,,,
1918,25 Aug 2010,False,"Star light, star bright, first star you see tonight. Been wishing on it? Wishes not coming true? It's a planet - Jupiter",,,,,
1919,24 Aug 2010,False,How to exaggerate: Prettiest in New York: Miss New York. Prettiest in USA: Miss America. Prettiest on Earth: Miss Universe,,,,,
1920,23 Aug 2010,False,"To cameras, which do not suffer brain failures like humans, the Moon is the same size on the horizon as at the top of sky.",,,,,
1921,23 Aug 2010,False,Upside down bldgs & mountns & trees don't register as familiar objects. Depth perception not confounded. Scene appears normal,,,,,
1922,23 Aug 2010,False,"Next time you're stunned by large Moon on horizon, bend over and view it between your legs. The effect goes away entirely.",,,,,
1923,22 Aug 2010,False,"More thoughts to disturb slumber: If Pinoccio declared ""My nose is about to grow!"" what would actually happen?",,,,,
1924,21 Aug 2010,False,Why do aliens always disembark via ramp? Do they have problems with stairs? Or are flying saucers just handicap-accessible?,,,,,
1925,19 Aug 2010,False,"Curious facts that sometimes keep me awake at nite: ""twelve plus one"" uses same letters that spell ""eleven plus two""",,,,,
1926,18 Aug 2010,False,"Remarkable that it's routine for 40tons of metal to fly 500mph at 37,000ft for 2,000mi. Yet we complain we don't get a pillow",,,,,
1927,15 Aug 2010,False,".@NickSwisher Dry air is mostly N2 & O2, atomic weights 28 & 32. Moist air has lighter H20, weight 18, displacing dry air.",,,,,
1928,14 Aug 2010,False,".@sagzz13 Infinity bugs you? Like quantum, nobody actually understands the idea. You grow accustomed to calculating with it.",,,,,
1929,14 Aug 2010,False,.@kajnielsen Good starterbook on Isaac Newton (if you seek his words more than that of a biographer):  http://amzn.to/bnsIic,,,,,
1930,13 Aug 2010,False,Cosmic Perspective Friday: How and why a Black Hole can kill you (3m30s):  http://youtu.be/uNc-JLysk9Y,,,,,
1931,11 Aug 2010,False,A bullet fired level from a gun will hit ground at same time as a bullet dropped from the same height. Do the Physics.,,,,,
1932,10 Aug 2010,False,".@Armo15 Seek a cosmic themed restaurant?  Got one in midtown Manhattan: ""Mars 2112"" Teleporter entrance. Martian waitstaff.",,,,,
1933,10 Aug 2010,False,FYI:  Hayden's own Joe Rao blogs about the Perseids.  Includes stuff you never thought to ask.   http://bit.ly/crViyT,,,,,
1934,10 Aug 2010,False,.@apachedisco Perseid Meteor Shower FYI: 1AM the nights of Aug 11th & 12th is same as 1AM the mornings of August 12 & 13th,,,,,
1935,10 Aug 2010,False,"Annual summer favorite: Perseid meteor shower. Nights of Aug 11 & 12. Peak rate of 1 per min. Good in eve, but best after 1am",,,,,
1936,8 Aug 2010,False,"For this, my 1,000th tweet, I offer a reminder of our relationship to the cosmos (2min):  http://youtu.be/pbfmNpekveA",,,,,
1937,7 Aug 2010,False,.@leechdemon Chemistry's all about how many electrons are available to give or share -- and how tightly you hang onto them,,,,,
1938,7 Aug 2010,False,Weekend Sound Banquet: Physics of water films in Zero-G on the ISS w/ Dr. Don Pettit. (47min)   http://youtu.be/jXYlrw2JQwo,,,,,
1939,6 Aug 2010,False,"Causes of death worldwide in past three months: Starvation: 9,000,000. Malaria: 750,000. Car Crash 300,000. Quakes 21",,,,,
1940,6 Aug 2010,False,"Aug 6,1945 Hiroshima A-bomb kills 100,000. Tokyo firebombs 5 months before kill as many. Bombs kill, no matter what's in them",,,,,
1941,5 Aug 2010,False,"Thought to Delay Slumber: Odd that in the child's game Hangman, you murder an innocent person just because you can't spell.",,,,,
1942,5 Aug 2010,False,Inadvertent primer on @NASA JamesWebbSpaceTelescope via latest HubbleGotchu rap video on @JimmyFallon  http://bit.ly/9in4pG,,,,,
1943,4 Aug 2010,False,"Humans count in base 10 with 10 fingers, breeding pointless fascination with multiples of 10: Congrats to A-Rod on HR no. 600",,,,,
1944,4 Aug 2010,False,".@meganquinlan Scientists don't require ""Faith in Science"" because Science works whether or not you believe in it.",,,,,
1945,4 Aug 2010,False,"Inner-Geek shines through: Queen's BrianMay (Astrophysics PhD) scored ""WeWillRockYou"" using PrimeNumbers:  http://n.pr/d2EC5T",,,,,
1946,3 Aug 2010,False,"Must-see for Geek Skeptics: ""The Periodic Table of Irrational Nonsense"" via Crispian Jago  http://bit.ly/dcGlXJ",,,,,
1947,2 Aug 2010,False,Antidote to Mars Virus for readers (360words):  http://bit.ly/aYICWC  And non-readers (1m45s):  http://youtu.be/f3v1GSWfsBw,,,,,
1948,2 Aug 2010,False,.@ColonelKernel Everything we know about stars says Sun swells to RedGiant in 5billion yrs. Earth vaporizes. Have a nice day.,,,,,
1949,1 Aug 2010,False,"Antidote to the perennial ""Mars Virus""  http://bit.ly/aYICWC",,,,,
1950,30 Jul 2010,False,More air molecules in breath of air than breaths of air in Earth's atmosphere. Some air you inhale was exhaled by Cleopatra.,,,,,
1951,29 Jul 2010,False,SciFi author Ray Bradbury turns 90 on Aug 22. A fan? Send birthday wishes via The Planetary Society:  http://bit.ly/aMBlsf,,,,,
1952,29 Jul 2010,False,.@OldSpice guy wants to know what space smells like?  Close to a star: incinerated flesh. Elsewhere: nothing.,,,,,
1953,28 Jul 2010,False,"Kudos to Jimmy Dean sausage TV ad. People dressed as Sun & planets. Eight planets, that is:  http://youtu.be/pvHj0vovQHI",,,,,
1954,27 Jul 2010,False,"Classical Geek 101: A ""milli-"" is metric prefix for 1/1000, so a milli-Helen is just enough beauty to launch a single ship.",,,,,
1955,26 Jul 2010,False,".@wadedismukes At 900-deg F, Venus is too hot to cook large things like roasts w/o burning. But thin food like pizza is ideal",,,,,
1956,25 Jul 2010,False,Venus still sparkles in western twilight. Pretty. But greenhouse gases there make 900-deg F air. Would cook a pizza in 9 sec,,,,,
1957,25 Jul 2010,False,"Video version of TIME mag ""10 Questions"" interview is much shorter and heavily edited (6 min):  http://youtu.be/wiOwqDmacJo",,,,,
1958,25 Jul 2010,False,"Nothing better to do with 42min of your life? Audio podcast of a ""10 Questions"" interview with TIME mag.  http://bit.ly/bCWJ13",,,,,
1959,24 Jul 2010,False,"Okay. Here's my 27min talk on ID, inspired by that 3000word essay, for the non-readers out there.   http://bit.ly/9fan1Q",,,,,
1960,24 Jul 2010,False,"For those who still read, I offer my most downloaded essay -- on Intelligent Design. 3000words:  http://bit.ly/9LG7XQ",,,,,
1961,23 Jul 2010,False,Not all views are best conveyed via YouTube. My highest expression of Cosmic Perspective (2500words):  http://bit.ly/9DeLb1,,,,,
1962,23 Jul 2010,False,The @BadAstronomer gets badder.  http://youtu.be/yiSJ73pckw4  Long-deserved exposure for Phil Plait's personal mission.,,,,,
1963,21 Jul 2010,False,I'm not normally opinionated. This rant counts as an exception. On science in SciFi films (7 min)  http://youtu.be/ICsgjqVvtM0,,,,,
1964,20 Jul 2010,False,"Animal barbarism: everything we eat (except salt) was extracted from something alive. Or was once alive, then killed for food",,,,,
1965,18 Jul 2010,False,How to convince a #skeptic that you've been abducted by Aliens (9min 30 sec):  http://youtu.be/zfAzaDyae-k,,,,,
1966,18 Jul 2010,False,.@geofftuttle Yup. If rainbow guy  http://youtu.be/OQSNhk5ICTI saw this eclipse  http://bit.ly/bNsMiy his head might explode.,,,,,
