,date,retweet,text,,,,,
0,Aug 21,False,"Moon’s shadow landfalls Oregon, crosses USA at 1800mph, exits SCarolina. Behold ‘Muuurica’s Eclipse. pic.twitter.com",,,,,
1,Oct 9,False,"@huggy_panda  Oink, oink.   : - )",,,,,
2,Oct 9,False,"Future headlines from the Multiverse: Nov 9, 2016: “Trump: How I Got Hillary Elected while Dismantling the Republican Party.”",,,,,
3,Oct 7,False,Awww. That’s the nicest thing anybody has said to me in a long while. https://twitter.com/ayeshatron/status/784441432652320769 …,,,,,
4,Oct 6,False,"If ComicCon people ruled the world, international conflicts would be resolved entirely by plastic  light saber fights in bars",,,,,
5,Oct 5,False,"On Pluto, with its 248-year orbit around the Sun, birthdays are incompatible with human physiology.",,,,,
6,Oct 5,False,@ivychat Maybe I‘m floating in an atmospheric balloon in Saturn’s atmosphere.,,,,,
7,Oct 2,False,The urge to want some bit of information to be true often clouds our ability to assess why that information may be false.,,,,,
8,Sep 29,False,"Evidence that internet Cats are rapidly achieving cosmic consciousness, soon to become our Overlords: https://www.youtube.com/watch?v=LJSH6Ru1xRk&feature=share …",,,,,
9,Sep 23,False,A word of our times: DELUSION -- Being sure something is true in the face of all evidence that says it is not.,,,,,
10,Sep 16,False,Odd that our measures of animal intelligence are often tests of what humans do best rather than of what they do best.,,,,,
11,Sep 6,False,In 5-billion yrs the Sun will expand & engulf our orbit as the charred ember that was once Earth vaporizes. Have a nice day.,,,,,
12,Aug 31,False,Objective truths are established by evidence. Personal truths by faith. Political truths by incessant repetition.,,,,,
13,Aug 21,False,All you need to know about next year’s Total Solar Eclipse across USA. From Hayden’s own @JoeRao12: http://www.space.com/33798-great-american-solar-eclipse-one-year-away.html …,,,,,
14,Aug 18,False,There’s more that 300 metric tons of it embedded in every 500-meter metallic asteroid that orbits the Sun. #ThatsGold,,,,,
15,Aug 18,False,"So malleable, you can hammer a cubic foot of the stuff into a sheet large enough to gild Rio’s Olympic stadium. #ThatsGold",,,,,
16,Aug 16,False,"Effective Advertising: My sister just bought a Dodge Truck.  When I stepped inside, my voice dropped an entire octave.",,,,,
17,Aug 16,False,Just once. Just once. I want to see a TV commercial for a Truck where the announcer has a high pitch voice.,,,,,
18,Aug 14,False,"If interested, Larry @KingsThings asked me about the afterlife [video; 7m]: https://www.youtube.com/watch?v=Ndj5KjKyr3E …",,,,,
19,Aug 12,False,"If you set a World Record in the Olympics, might be classy if they gave you a Platinum medal instead  Gold.",,,,,
20,Jul 31,False,Schools often fail to simultaneously train students how to be skeptical of claims & how to embrace the weight of evidence.,,,,,
21,Jul 30,False,Sometimes I find that Red & Blue are simply on opposite sides of the spectrum from one another.,,,,,
22,Jul 25,False,Met @GameOfThrones star @Isaac_H_Wright @Comic_Con. Card-carrying geek. He recited Pi to 40 decimals. pic.twitter.com,,,,,
23,Jul 22,False,"Eternal Geek Wisdom: In life and in the Universe, may your signal be high, and your noise be low.",,,,,
24,Jul 18,False,"Apparently, Red & Blue have been fighting one another for decades: pic.twitter.com",,,,,
25,Jul 4,False,Will enjoy colorful fireworks tonight? Thank Aluminum Barium Calcium Chlorine Copper Iron Nitrogen Oxygen Sodium & Strontium.,,,,,
26,Jun 29,False,"Earth needs a virtual country: #Rationalia, with a one-line Constitution: All policy shall be based on the weight of evidence",,,,,
27,Jun 24,False,Comment-Thread Virus: The urge to argue vociferously even when you have no actual idea of what you are talking about.,,,,,
28,Jun 21,False,Some of my best friends -- actually every one of my best friends -- are made of chemicals.,,,,,
29,Jun 20,False,"June 20 vs June 21:  Solstices (& Equinoxes) annually migrate 6-hrs later, until a Leap Year, when they reset 24-hrs earlier.",,,,,
30,Jun 14,False,And sometimes you will find colors of the Rainbow on flags. pic.twitter.com,,,,,
31,Jun 14,False,A Rainbow forms only broadside to your line of sight. That's why the pot of Gold at its base remains eternally out of reach.,,,,,
32,Jun 14,False,Rainbows are always the same angular size in the sky — they are various segments of a circle that is 84-degrees across.,,,,,
33,Jun 14,False,"The exact Rainbow any of us sees in the sky is entirely our own -- a personal, yet communal gift from the laws of optics.",,,,,
34,Jun 12,False,"Odd how many Americans invoke the 2nd Amendment to justify gun ownership, rather than explore whether or not it's a good idea",,,,,
35,Jun 10,False,"Common Evidence of Bias: Your candidate is the best, and you can find absolutely nothing good to say about other candidates.",,,,,
36,Jun 6,False,"From the top of Burj Khalifa in Dubai, daytime Ramadan fasting lasts 2-min longer due later sunsets. pic.twitter.com",,,,,
37,Jun 4,False,"In any election, there are only ever two kinds of voters: those who are informed and those who are not.",,,,,
38,Jun 3,False,"His may be the Greatest of 20th century American stories. Muhammad Ali, rest In peace 1942-2016",,,,,
39,Jun 3,False,Sometimes I wonder if common sense is actually uncommon in the land. Maybe it's a rare commodity to be cultivated & cherished,,,,,
40,May 31,False,"Many problems appear hard., but only because we are not yet smart enough to solve them.",,,,,
41,May 28,False,Odd: Many who want less government in our lives nonetheless want the government to dictate who you sleep with & who you marry,,,,,
42,May 25,False,Met @NBCSNL’s @JayPharoah in flight. Reminder that comedy can give more lift than aerodynamics itself pic.twitter.com,,,,,
43,May 20,False,"As an astrophysicist, I suppose my day job is actually my night job.",,,,,
44,May 16,False,"A skeptic will question claims, then embrace the evidence. A denier will question claims, then reject the evidence.",,,,,
45,May 14,False,"Note to Space-Alien greeters: If they arrive in flying saucers, they won’t need runway lights. pic.twitter.com",,,,,
46,May 12,False,More than half of its volume is ice.  So nobody should be surprised it shares properties with comets. https://twitter.com/JennaWareMSW/status/730715489614368768 …,,,,,
47,May 11,False,Nobody doesn’t love exoplanets. https://twitter.com/BadAstronomer/status/730420136696369156 …,,,,,
48,May 10,False,"To tell you the truth, beginning a sentence with “To tell you the truth” throws into question all else you’ve previous said.",,,,,
49,May 9,False,"Candidate Endorsements matter if you’d rather have a famous person, an organization, or media entity do your thinking for you",,,,,
50,Apr 29,False,Gotta love the classic Chevy Nova. But not sure if General Motors knew the car shared a name with stars that just exploded.,,,,,
51,Apr 29,False,Subaru is what Japanese call the Pleiades cluster. The car's logo evokes its six brightest stars. pic.twitter.com,,,,,
52,Apr 28,False,"Always wanted to call people who don’t like astronomy “Galactos Intolerant""",,,,,
53,Apr 22,False,"Odd that #EarthDay exists as a day at all. Instead, maybe it should be extended to the whole year, and then repeated annually",,,,,
54,Apr 22,False,"Many refer to our Planet as ""Mother Earth"", ignoring how much of a killing force hurricanes, earthquakes, & tsunamis can be.",,,,,
55,Apr 22,False,"“Save the Earth” really means “Save the Humans” or ""Save the Life on Earth”.  Earth the planet will outlast all extinctions.",,,,,
56,Apr 22,False,"We’re short so Mountains seem tall. We’re mortal, so Earth seems eternal. Our spacecraft are slow, so the Universe seems vast",,,,,
57,Apr 22,False,"Earth gets slammed by a hundred tons of meteors per day. Most, harmlessly vaporizing in the atmosphere as ""shooting stars”.",,,,,
58,Apr 22,False,THIN AIR: The size of Earth’s atmosphere relative to Earth is the same as the skin of an Apple relative to the Apple.,,,,,
59,Apr 22,False,"April 22, 2016:  Earth Day is graced with a Full Moon. Occurs, on average, every thirty years.",,,,,
60,Apr 22,False,"Earth feels big because we’re little. Pour a million Earths into a hallowed out Sun, and you’d still have room for more.",,,,,
61,Apr 22,False,EARTH DAY: Founded in 1970 during the Apollo Moon missions — when we looked back & discovered Earth for the first time,,,,,
62,Apr 22,False,Feelin’ Earthy today…,,,,,
63,Apr 21,False,Only now do we know what it sounds like When Doves Cry — the absence of music from loss of The Artist. RIP Prince (1958-2016),,,,,
64,Apr 20,False,Computer voices that countdown to destruction are curiously calm. Wouldn't want to panic just before the end of the World,,,,,
65,Apr 19,False,JUST POSTED: @BillNye puts his climate money where his mouth is: [video: 2m 45s] https://www.youtube.com/watch?v=C4bDk-pPgbs …,,,,,
66,Apr 17,False,"Nephew from Idaho, puzzled by locks on my NYC apt door. I asked, Don't you have locks at home? He replied, No, just Shotguns.",,,,,
67,Apr 17,False,"JustPOSTED @StarTalkRadio Cosmic Queries ""Science & Morality” w/ @MichaelShermer on @iTunesPodcasts &  http://bit.ly/1MytXCQ ",,,,,
68,Apr 16,False,"@NHPatsFan72 Looks like Slag - the waste product of smelted ore.  Almost all meteorites, including rocky ones, will attract a magnet.",,,,,
69,Apr 16,False,"When the Greenland & Antarctic ice sheets melt, sea levels will rise to the Statue of Liberty’s iPad. pic.twitter.com",,,,,
70,Apr 15,False,"If I ever met a Space Alien, I’d resist shaking its extended appendage, not knowing for sure the details of alien anatomy.",,,,,
71,Apr 15,False,@Sweetling Thanks for that Zooey correction! -NT,,,,,
72,Apr 9,False,"JustPOSTED @StarTalkRadio “Unravelling @Reddit w/ @AlexisOhanian.” Also @JeffJarvis; @iTunesPodcasts,  http://bit.ly/1TGRKSL ",,,,,
73,Apr 8,False,"When you train your mind how to think, you inoculate yourself against those who desperately want to tell you what to think.",,,,,
74,Apr 5,False,"With all this Red vs Blue politics in America, sometimes I find myself in a Purple haze.",,,,,
75,Apr 4,False,"“Get Your Ass to Mars” — Yup, earlier today I got to touch the @TheRealBuzz Aldrin’s ass. pic.twitter.com",,,,,
76,Mar 31,False,"And as any child knows, it’s time for a new number: “Eleventy""; We’re also overdue for a new dinosaur called the “Thesaurus""",,,,,
77,Mar 31,False,"As any toddler knows, we're overdue for a new word:  ""elemeno"" —  the letter between K and P in the alphabet.",,,,,
78,Mar 29,False,"Never seen a bar fight break out while people are drinking wine. Beer, yes. Hard liquor, yes. But not wine.",,,,,
79,Mar 25,False,"In @BatmanvSuperman, the question remains, would the @realDonaldTrump deport Superman for being an illegal alien in the USA?",,,,,
80,Mar 25,False,"In @BatmanvSuperman, I've gotta side with Superman. He’s a space alien from an exoplanet. In astrophysics, that’s how we roll",,,,,
81,Mar 25,False,Met Superman a few years ago at the Hayden Planetarium. I helped him find Krypton. A very nice man. pic.twitter.com,,,,,
82,Mar 22,False,"Not that anybody asked, but Gregorian calendar rules unintentionally prevent eclipses from ever occurring on Easter Sunday",,,,,
83,Mar 22,False,"FYI: Tonight is the first full Moon after the March equinox. By Gregorian calendar rules, the Sunday that follows is Easter.",,,,,
84,Mar 21,False,"Happy 10th birthday Twitter. Note however, that the trending #LoveTwitter hashtag grossly overstates my emotions for you.",,,,,
85,Mar 21,False,Always wondered how Dr. Dolittle's push-me-pull-you Llama is supposed to poop. pic.twitter.com,,,,,
86,Mar 20,False,"Equinox is “Equal Night” in Latin, but refraction in Earth’s atmosphere adds minutes of extra sunshine at sunrise & sunset.",,,,,
87,Mar 19,False,"Happy March Equinox to all residents of planet Earth: First day of Spring North of the Equator;  First day of Autumn, South.",,,,,
88,Mar 17,False,"Happy Saint Patrick's day, President Barack O'Bama.",,,,,
89,Mar 16,False,Mother Nature has been genetically modifying organisms for nearly four-billion years. Farmers for ten-thousand years.,,,,,
90,Mar 14,False,"Happy Pi-day to all. Posted my best Pi-tweets a year ago. So today, I’ll just wish a happy 137th Birthday to Albert Einstein.",,,,,
91,Mar 13,False,I wonder if we’d all be living like the Flintstones - modern stoneage families -  if metal were never discovered on Earth.,,,,,
92,Mar 12,False,People who are anti-Trump are actually anti-Trump supporters — they oppose free citizens voting for the @realDonaldTrump.,,,,,
93,Mar 12,False,"If you have a gene for celibacy, you didn’t inherit it.",,,,,
94,Mar 11,False,I occasionally wonder whether the entire Universe is nothing more than a snow-globe on the living room mantle of an Alien.,,,,,
95,Mar 9,False,"I also recreationally consume large quantities of dihydrogen monoxide. On the street, I pay up to $2,000 per megagram for it.",,,,,
96,Mar 9,False,"I’m simultaneously flattered and disturbed when, after posting various tweets, people tweet back wondering if I’m on drugs.",,,,,
97,Mar 9,False,"The closest thing to fatally passing through a portal into another dimension is when fish get yanked out of water, then eaten",,,,,
98,Mar 8,False,I hear that the flat-Earth movement may be gaining momentum all around the globe.,,,,,
99,Mar 4,False,"Maybe Wolves also love riding in cars & hanging their heads out the window, but my sense is that they’d rather eat the driver",,,,,
100,Mar 4,False,Who'd have thought altering Wolf genes to create Dogs would imbue delight for riding in cars with their head out the window.,,,,,
101,Mar 2,False,"Welcome back to Earth, Scott Kelly. After a year in orbit, Relativity says you’re 1/100 sec younger than you’d otherwise be.",,,,,
102,Mar 1,False,"With my 5,000,000th follower, I reaffirm that it’s an honor and a privilege to rub your geek underbellies in the Twitterverse",,,,,
103,Mar 1,False,"Who would Jesus vote for? To him walls, wealth, & torture are non-starters, so probably the Jewish New Yorker from Vermont.",,,,,
104,Feb 29,False,Don’t like Leap Days? We could instead wait 28 years and insert a “Leap Week”.  Or 112 years and insert a “Leap Month”.,,,,,
105,Feb 29,False,"The Leap Day is misnamed. We’re not leaping anywhere. The calendar is simply, and abruptly, catching up with Earth’s orbit",,,,,
106,Feb 29,False,"Born on a leap day? You’ve had 1/4 as many birthdays as the rest of us, but sorry, you’re not 1/4th as old.",,,,,
107,Feb 29,False,Earth takes nearly 365 1/4 days to orbit the Sun. Bank the fraction. Every 4 years add a whole day back to the neediest month,,,,,
108,Feb 29,False,"Welcome Twitterverse, to the 105th leap day of the Gregorian Calendar...",,,,,
109,Feb 26,False,Follow me only if you seek hodgepodge brain droppings of an intellectually restless astrophysicist. You’ve been forewarned.,,,,,
110,Feb 26,False,Exterminators: The only profession in which you put yourself out of business by being really good at your job.,,,,,
111,Feb 24,False,One's quest in life should not solely be the search for answers. Why not find pleasure in posing the questions themselves.,,,,,
112,Feb 21,False,"Let's just confess that our best 4D portal, through which products are transported, is the drive-thru window at McDonalds.",,,,,
113,Feb 20,False,Maybe what I really want is wormhole-shipping. Buy something online. A 4D portal opens and a person hands you the product.,,,,,
114,Feb 18,False,I wonder if workplaces contain too many bosses basking in compliments given by people who rely on them for their paychecks.,,,,,
115,Feb 14,False,"I wonder what Cannibals & Aztecs would say, watching civilized people eat symbolic hearts of loved ones on Valentine’s Day.",,,,,
116,Feb 14,False,From Venus? Then you’re Venusian. But the proper term is Venereal. Unfortunately Doctors nabbed it before Astrophysicists did,,,,,
117,Feb 14,False,Venus is the Roman goddess of love & sexuality. And so medical doctors assigned Venereal - “of Venus” to all related diseases,,,,,
118,Feb 13,False,1916: Einstein predicts Gravity Waves. 1917: He lays the foundation for Lasers. 2016: Gravity Waves discovered using Lasers.,,,,,
119,Feb 10,False,"If you never make mistakes then you are not on the frontier of discovery, for there is where mistakes are made all the time.",,,,,
120,Feb 8,False,Today is the first New Moon after Jan  21sr. Happy New Year to Chinese people and all who choose to be Chinese for a day.,,,,,
121,Feb 7,False,I wonder what Referees look like to Zebras.,,,,,
122,Feb 7,False,If Earth rotated 10x faster in the opposite direction then Coriolis forces would’ve helped the @Panthers make that Field Goal,,,,,
123,Feb 7,False,"FYI: ""Deplorably bouncy once""  is an anagram of @Beyonce, @Coldplay, and Bruno.",,,,,
124,Feb 7,False,Already tweeted about @Beyonce during Super Bowl XLVII.  I have nothing to add to my analysis of her energetics.,,,,,
125,Feb 7,False,"FYI: Roman Numerals have no Zero. Invented after the Empire, which is why the traditional Christian calendar has no year Zero",,,,,
126,Feb 7,False,"A triumph of Arabic numerals:  After forty-nine Super Bowls enumerated by Roman Numerals, we hashtag #SB50 and not #SBL",,,,,
127,Feb 7,False,"If #SB50’s football field were a cosmic timeline, then cavemen to present day spans a turf-blade's thickness in the end-zone.",,,,,
128,Feb 7,False,"Every day where someone could have made a discovery but cultural or political forces impede it, is a sad day for civilization",,,,,
129,Feb 5,False,"In science, when human behavior  enters the equation, things go nonlinear. That's why Physics is easy and Sociology is hard.",,,,,
130,Feb 5,False,"Four decades of Reasons for Devotion & Gratitude. RIP Maurice White, a Shining Star (1941-2016) founder of Earth, Wind & Fire",,,,,
131,Jan 30,False,It is time: Just re-watched Ridley Scott’s 1982 film Blade Runner. FYI: Three of the Replicants have inception dates in 2016.,,,,,
132,Jan 30,False,Chillin’ with @LarryWilmore seconds after the “mic-drop”  http://bit.ly/1PH13v3  on the @NightlyShow pic.twitter.com,,,,,
133,Jan 28,False,"January 28, 2016:  Thirty years Ago Today — “Ode To Challenger"" pic.twitter.com",,,,,
134,Jan 26,False,"Dear @bobatl, as an astrophysicist I don’t rap, but I know people who do. This one has my back: https://soundcloud.com/drtyson/flat-to-fact …",,,,,
135,Jan 25,False,"The Cosmos is knowable. When childhood curiosity persists as an adult, it inoculates against others telling you what to think",,,,,
136,Jan 25,False,@bobatl Duude — to be clear: Being five centuries regressed in your reasoning doesn’t mean we all can’t still like your music,,,,,
137,Jan 25,False,@bobatl Flat Earth is a problem only when people in charge think that way. No law stops you from regressively basking in it.,,,,,
138,Jan 25,False,"@bobatl Polaris is gone by 1.5 deg S. Latitude. You’ve never been south of Earth’s Equator, or if so, you've never looked up.",,,,,
139,Jan 25,False,@bobatl Earth's curve indeed blocks 150 (not 170) ft of Manhattan. But most buildings in midtown are waaay taller than that.,,,,,
140,Jan 23,False,If anybody is still unsure of what an “Objective Truth” is:   http://huff.to/2169ARA ,,,,,
141,Jan 19,False,Seedless grapes. Seedless oranges. Seedless watermelons. All good. My vote for the next fruit to invent: Seedless pomegranate,,,,,
142,Jan 17,False,Curious how we’re more like to bond with one another based on what we believe is true rather than on what is objectively true,,,,,
143,Jan 13,False,"With Lotteries funding State education budgets, the best way to sustain them is to NOT teach probability&statistics in school",,,,,
144,Jan 13,False,"In case anybody was wondering, the Astrophysicist with the highest twitter following is @JimmyFallon pic.twitter.com",,,,,
145,Jan 11,False,"A Cinematic Hypothesis:  The more Film Festivals that a movie wins, the fewer guns, chase scenes, & explosions it contains.",,,,,
146,Jan 11,False,I wonder if some forms of creativity can only be generated by a Space Oddity that Falls to Earth. RIP #DavidBowie (1947-2016),,,,,
147,Jan 7,False,"FYI:  Crude Oil is just as “natural” as Natural Gas. They both derive from buried, long-dead, decomposed plants & animals.",,,,,
148,Jan 6,False,"This Wednesday morn, are you early to rise? Then look East. The Crescent Moon joins Venus & Saturn. Afloat in dawn skies.",,,,,
149,Jan 5,False,Space aliens would surely think it odd that one way humans express affection is the simultaneous exchange of saliva.,,,,,
150,Jan 3,False,"January 2nd / 3rd :  Merry Perihelion to all. The time of the year where Earth, in its oval orbit, passes closest to the Sun.",,,,,
151,Dec 31,False,To all those who reckon time on the Gregorian Calendar - Happy New Year!  (FYI:  January 1 is astronomically  insignificant.),,,,,
152,31 Dec 2015,False,"True Science Literacy is less about what you know, and more about how your brain is wired for processing information.",,,,,
153,28 Dec 2015,False,There's nothing you can ever tell scientists about the natural world that will hurt their feelings.,,,,,
154,25 Dec 2015,False,"Christmas Full Moon tonight.  Happens, on average, about once every thirty years. Same for every other day of the month.",,,,,
155,25 Dec 2015,False,"FYI:  By the end of the Twelve Days of Christmas song, your home is crammed with 23 flying Birds and 50 hyperactive Humans.",,,,,
156,25 Dec 2015,False,"I've always preferred the Two-Horse Open Sleighs, myself.",,,,,
157,25 Dec 2015,False,"Male & female Reindeer grow antlers, but males lose them in winter. All Santa’s reindeer, Rudolph too, are therefore female.",,,,,
158,25 Dec 2015,False,"If people left carrots, celery, & hot tea for Santa on the table rather than milk & cookies, I bet he’d be much, much thinner",,,,,
159,25 Dec 2015,False,Never understood why an overweight Arctic toymaker delivers Christmas gifts rather than representations of the Three Wise Men,,,,,
160,25 Dec 2015,False,Santa is pale because he’s in the middle of six months of darkness on Earth’s North Pole. And he delivers gifts only at night,,,,,
161,25 Dec 2015,False,"As Earth warms, and Arctic ice melts, Santa will lose his habitat too. Soon we’ll see photos of him clutched to an ice floe.",,,,,
162,25 Dec 2015,False,"Since the Northern Arctic is just ocean, Santa’s North Pole workshop has only ever existed on a floating sheet of ice.",,,,,
163,25 Dec 2015,False,"All this talk about Polar Bears suffering with Global Warming -- nobody thinks about Santa, the Arctic’s most famous resident",,,,,
164,25 Dec 2015,False,"Merry Christmas to the world’s Christians, and to all the non-Christians who celebrate Christmas just for the heaven of it.",,,,,
165,21 Dec 2015,False,December 21 / 22: Happy Summer Solstice to 15% of all Humans and 100% of free Penguins who dwell in the Southern Hemisphere.,,,,,
166,21 Dec 2015,False,"Both at age 19, my wife saw @StarWars in 1977 & our daughter saw #TheForceAwakens in 2015. I don’t know what that means.",,,,,
167,21 Dec 2015,False,"In @StarWars #TheForceAwakens, the Storm Troopers still run as though they’re carrying a full load of poop in their diapers.",,,,,
168,21 Dec 2015,False,"Never seen Romanescu Broccoli?  Fractal Earth food befitting a tale of long ago and far, far away. pic.twitter.com",,,,,
169,21 Dec 2015,False,"In @StarWars #TheForceAwakens, once again I felt isolated and inadequate for not understanding Wookiee-speak.",,,,,
170,21 Dec 2015,False,In @StarWars #TheForceAwakens the TIE fighters made exactly the same sound in the vacuum of space as in planetary atmospheres,,,,,
171,21 Dec 2015,False,"In @StarWars #TheForceAwakens, BB-8, a smooth rolling metal spherical ball, would have skidded uncontrollably on sand.",,,,,
172,21 Dec 2015,False,"In @StarWars #TheForceAwakens, BB-8 is waaaaay cuter than R2D2.",,,,,
173,21 Dec 2015,False,"In @StarWars #TheForceAwakens, I’m reminded that Red & Blue teams cooperate with one another. Rare in American Politics.",,,,,
174,16 Dec 2015,False,"Recent evidence indicates that Earth is indeed bi-polar, as we’ve always suspected.",,,,,
175,10 Dec 2015,False,I was once anti-biotic. But lately I've been more pro-biotic after reading more about their culture.,,,,,
176,9 Dec 2015,False,"There is power in Knowledge, but there is greater power in Wisdom",,,,,
177,9 Dec 2015,False,“We all came from the sea”  — JFKennedy (1962).  Back when US politicians understood basic Biology.,,,,,
178,4 Dec 2015,False,"As climate change reshapes the World’s coastlines, rich people lose their second homes. Poor people lose their only homes.",,,,,
179,3 Dec 2015,False,Odd that we live in a world where even objective truths count as controversial subjects.,,,,,
180,1 Dec 2015,False,"The cutest thing ever, in the history of the universe. https://twitter.com/Lyraull/status/669435381184614400 …",,,,,
181,30 Nov 2015,False,i wonder if fewer people would eat Rabbit Stew if it was instead called Bunny Rabbit Stew.,,,,,
182,29 Nov 2015,False,"Starship Enterprise versus Millennium Falcon. Oh yeah, I went there [video - 1m 40s]: https://www.youtube.com/watch?v=TMH1vDDd1xc&sns=tw …",,,,,
183,28 Nov 2015,False,There is nothing in the US Constitution that protects you from being offended by the truth.,,,,,
184,24 Nov 2015,False,Odd that dangerous travel alerts increase when military actions are in progress that are intended to make us all feel safer.,,,,,
185,23 Nov 2015,False,I wonder why nobody has ever called pre-historic cave paintings Graffiti. Maybe that’s precisely what it was back then.,,,,,
