,date,retweet,text,,,,,
1087,25 Aug 2012,False,"Neil A. Armstrong 1930-2012. Farewell my friend. And now, perhaps more than ever, I bid you godspeed.",,,,,
1088,25 Aug 2012,False,"Apollo 11, July 1969.  No other act of human exploration ever laid a plaque saying ""We Come In Peace For All Mankind""",,,,,
1089,25 Aug 2012,False,"""Men Walk On Moon"" - The only positive event in the last 50 yrs for which everyone remembers where they were when it happened",,,,,
1090,25 Aug 2012,False,"Neil Armstrong was the spiritual repository of spacefaring dreams & ambitions. In death, a little bit of us all dies with him",,,,,
1091,24 Aug 2012,False,"Ausgust 24, 2012: The 5th anniversary of Pluto's ""Dwarf Planet"" reclassification. May the little fella RIP (Revolve in Peace)",,,,,
1092,22 Aug 2012,False,"If aliens did visit us, I'd be embarrassed to tell them we still dig up fossil fuels from the ground as a source of energy.",,,,,
1093,21 Aug 2012,False,It seems that we're better at finding someone to blame for our problems than we are at finding creative solutions to fix them,,,,,
1094,18 Aug 2012,False,"Hidden cannibalistic urges? Words of affection referencing sweet food: honey, cupcake, pumpkin, cutie pie, sugar, eye candy.",,,,,
1095,16 Aug 2012,False,"Creative people know no bounds when the universe serves as their daily muse. ""We're NASA & We Know It"" http://bit.ly/N0o4Qh ",,,,,
1096,15 Aug 2012,False,"In the 2012 #Olympics, USA won 104, Jamaica 12 medals. If Jamaica had the population of the USA, they'd have won 1382 medals.",,,,,
1097,11 Aug 2012,False,"Meteor Shower this weekend. After midnight, expect a shooting star per minute in the NE skies. Be there:  http://bit.ly/9bKNXx ",,,,,
1098,10 Aug 2012,False,If the West Coast had settled before the East Coast then cities like Chicago in the Mid-West would instead be the Middle-East,,,,,
1099,9 Aug 2012,False,"Tasty Cosmos: Milky Way bar, MoonPie, Eclipse gum, Orbit gum, Sunkist, Celestial Seasonings, Mars bar. No food named Uranus.",,,,,
1100,8 Aug 2012,False,"Enough on Mars. Must get back to making Earth hotter, cutting science budgets & killing each other over religious differences",,,,,
1101,7 Aug 2012,False,Censored by NASA: The actual first image taken by @MarsCuriosity from the surface of Mars.pic.twitter.com/cWLV4K53,,,,,
1102,6 Aug 2012,False,"Curiosity Rover's first image, Gale Crater, MARS: A reminder of what it looks like ""to boldly go""pic.twitter.com/gG6jyMTC",,,,,
1103,6 Aug 2012,False,"Jet Propulsion Labs, NASA: A reminder of what it feels like ""to boldly go""pic.twitter.com/oUohiGzg",,,,,
1104,4 Aug 2012,False,"The day we stop exploring is the day we commit ourselves to live in a stagnant world, devoid of curiosity, empty of dreams.",,,,,
1105,4 Aug 2012,False,"Dear @MarsCuriosity, As for your complicated landing on Mars Sunday night 10:30pm PT -- do not try, do.",,,,,
1106,4 Aug 2012,False,"Dear @MarsCuriosity, We've got the #Olympics back here on Earth. But many of us will be focussed on you and your landing. Do us proud.",,,,,
1107,4 Aug 2012,False,"Dear @MarsCuriosity, What are your instructions if a Martian crawls onto your back and rides you like a Rodeo Bull?",,,,,
1108,4 Aug 2012,False,"Dear @MarsCuriosity, Scientists conceived you, engineers designed you. But seriously, who do you like better, Scientists or Engineers?",,,,,
1109,4 Aug 2012,False,"Dear @MarsCuriosity, You've been traveling for nine months. How did you pass your time? Did they let you play ""Angry Birds Space""?",,,,,
1110,4 Aug 2012,False,"Dear @MarsCuriosity, Wait a minute. You travelled a 100-million miles in space & hit an area 12x4 miles? Cool. Way better than a hole-in-one",,,,,
1111,4 Aug 2012,False,"Dear @MarsCuriosity, Neil deGrasse Tyson here on Earth, tweeting you, via a wormhole, through deep space.  Do you copy?",,,,,
1112,4 Aug 2012,False,Mars on my mind...Thinking of forging a wormhole through the Twitterverse and having a conversation with the Rover en route.,,,,,
1113,2 Aug 2012,False,"Just an FYI: Michael Phelps has as many Medals in the #Olympics - all time - as the country of India, with 1.2 billion people",,,,,
1114,2 Aug 2012,False,Congratulations to all medal winners in the 2012 #Olympics: Gold Silver & Bronze (copper+tin). All forged in exploding Stars,,,,,
1115,2 Aug 2012,False,"Weightlifters, whose sole job is to raise barbells from planets that attracts them, on Mars achieve 2.6x their personal bests",,,,,
1116,2 Aug 2012,False,"Gymnastics: On Mars, with only 38% of Earth's gravity, the Vault & other spring-assisted leaps would resemble circus cannons.",,,,,
1117,2 Aug 2012,False,"If there was Swimming on Mars, the low temperature & low air pressure would force the pool to simultaneously freeze & boil.",,,,,
1118,2 Aug 2012,False,"How about a Mars #Olympics? Yes, all athletes would suffocate. Ignoring that complication -- way cooler than Earth #Olympics.",,,,,
1119,2 Aug 2012,False,"In three days, a robotic emissary arrives & lands on Mars to perform science experiments. That's just a sweet sentence to say",,,,,
1120,2 Aug 2012,False,FullMoon: Only phase that rises at sunset & sets at sunrise. A splendor shared by all on Earth who summon the urge to look up,,,,,
1121,31 Jul 2012,False,"I'm often asked whether I believe in Global Warming.  I now just reply with the question: ""Do you believe in Gravity?""",,,,,
1122,30 Jul 2012,False,One of the great forces of delusion is under-informed pride of country -- Kudos to @HBO & the #Newsroom: http://bit.ly/KCqwoS ,,,,,
1123,27 Jul 2012,False,"Top 4 collaborations of Nations: 1) The Waging of War, 2) International Space Station, 3) Large Hadron Collider, 4) Olympics.",,,,,
1124,26 Jul 2012,False,"Just an FYI:  If you removed all veins, arteries, & capillaries from your body and laid them end to end, you will die.",,,,,
1125,25 Jul 2012,False,".@JTKerk:I saw my first shooting star tonight. Happy for me? // No, I'm disappointed.  It means you've hardly ever looked up.",,,,,
1126,24 Jul 2012,False,Odd that only in world politics is the number of people who want to kill you a measure of your importance.,,,,,
1127,22 Jul 2012,False,"A crescent Moon, thin yet bright, graces the skies of this evening's twilight.",,,,,
1128,20 Jul 2012,False,"July 20, 1969 -- A remembrance to which I can neither add nor subtract [4m 30s]: http://bit.ly/uDTNVM ",,,,,
1129,20 Jul 2012,False,"""Men Walk On Moon"" - The only positive event in the last 50 yrs for which everyone remembers where they were when it happened",,,,,
1130,18 Jul 2012,False,"Scientific Method is doing whatever it takes not to fool oneself into thinking what's true is false, or what's false is true.",,,,,
1131,16 Jul 2012,False,RT @bfibbs: Live your life in such a way that the Westboro Baptist Church will want to picket your funeral.,,,,,
1132,15 Jul 2012,False,"Met an actual alien at ComicCon 2012, but people assumed she was just a human in a costume.pic.twitter.com/5cu7iMob",,,,,
1133,14 Jul 2012,False,"If I were ever to become a Hip-hop DJ,I think I'd choose the name ""MC-squared""",,,,,
1134,14 Jul 2012,False,"At Comic-Con now -- my first time.  Leaving me with but one thought: ""And the Geek shall inherit the Earth""",,,,,
1135,12 Jul 2012,False,"Just an FYI:  Today is ""Thursday the 12th"" and it's just as common as ""Friday the 13th""",,,,,
1136,11 Jul 2012,False,"Every now and then, when the spirit of the Universe moves me, I feel compelled to Textify.",,,,,
1137,10 Jul 2012,False,"Hand-stitched balls, rubbing mud, leather mitts, wooden bats, pine tar. Baseball: a game untouched by modern materials.",,,,,
1138,10 Jul 2012,False,FYI: Laws of physics show that it takes twice as much energy to throw a baseball 100 mph than it does to throw one at 70 mph.,,,,,
1139,10 Jul 2012,False,"Slowest pitch in Baseball to reach catcher? 30 mph, thrown at 45-deg angle. Any slower and at any other angle hits the ground",,,,,
1140,10 Jul 2012,False,"Does it disturb anyone else that ""The Los Angeles Angels"" baseball team translates directly to ""The The Angels Angels""?",,,,,
1141,10 Jul 2012,False,"In Baseball, if a pitch hits you on ball four, you should get to advance to second base.",,,,,
1142,10 Jul 2012,False,"In the 1960s, when we still dreamed, we named a dome, a baseball team, and even the artificial turf they played on ""Astro""",,,,,
1143,8 Jul 2012,False,1) The Inexplicable Universe - VIDEO:  Six lectures highlighting profound areas of cosmic ignorance.  http://bit.ly/MI8567 ,,,,,
1144,7 Jul 2012,False,A poster the Dinosaurs ignored:pic.twitter.com/Q8gNePkn,,,,,
1145,4 Jul 2012,False,"Curious how across cultures and throughout time, freedom has never been free.",,,,,
1146,4 Jul 2012,False,"Tonight: Earth reaches aphelion, the farthest from the Sun in its oval orbit. Astro-folks in USA celebrate it w/ fireworks.",,,,,
1147,4 Jul 2012,False,"In all countries I know, more of their citizens have come to live in America than Americans have left to live in theirs.",,,,,
1148,4 Jul 2012,False,"July 4 - Happy Birthday USA. Celebrating the day we declared Independence, and not the day we actually achieved it.",,,,,
1149,4 Jul 2012,False,"NewEngland, NewYork, NewHampshire, NewLondon, NewBrunswick, NewBedford... The British colonists in America had no imagination",,,,,
1150,4 Jul 2012,False,The Higgs discovery makes me feel heavier already. What we need instead is the anti-Higgs. A particle that takes mass away.,,,,,
1151,4 Jul 2012,False,"But seriously, congrats to CERN on the Hiiggs discovery. Another particle in the pocket. Another forded frontier of Nature.",,,,,
1152,4 Jul 2012,False,"You just wait Europe, science in America will rise again -- some time this millennium.",,,,,
1153,3 Jul 2012,False,Saw Spider-Man. The starless night skies were accurate. Not much is visible from NYC's light-polluted steel & glass canyons.,,,,,
1154,3 Jul 2012,False,Two opposite ways to market science to girls (or anyone): 1)  http://bit.ly/Lfgqdq   2)  http://bit.ly/LHfsLy   I vote for No. 2.,,,,,
1155,1 Jul 2012,False,Just saw Ted. @SethMacFarlane cared enough to get the night sky over Boston correct. The rest of the movie must also be real.,,,,,
1156,1 Jul 2012,False,What a Leap Second looks like in the USA Eastern Time Zonepic.twitter.com/XCwpT7ul,,,,,
1157,1 Jul 2012,False,Going to see @SethMacFarlane's Ted tonight.  I'm told there's a Night Sky scene in it.  I'll be on the lookout.,,,,,
1158,30 Jun 2012,False,"How are Leap Seconds added? At the Prime Meridian, 12:00:00 normally follows 11:59:59pm but will instead follow 11:59:60pm",,,,,
1159,30 Jun 2012,False,"A Bar-bet you can win tonight:  Today's Leap Second makes June 30, 2012 the longest 24-hour day of the year.",,,,,
1160,30 Jun 2012,False,"June 30, 2012: Today's final minute gets a LeapSecond. to account for sloshing tides on coastlines, slowing Earth's rotation.",,,,,
1161,28 Jun 2012,False,"Revisiting my professor roots. Six-lectures just released:""The Inexplicable Universe: UnsolvedMysteries""  http://bit.ly/MI8567 ",,,,,
1162,27 Jun 2012,False,"If you seek only easy problems to solve, then ultimately, there'll be nothing about you to distinguish yourself from others.",,,,,
1163,25 Jun 2012,False,I love the smell of the universe in the morning.,,,,,
1164,24 Jun 2012,False,"A bit of Astro Humor: If we ever send humans to the Sun, it's best to go at night.",,,,,
1165,21 Jun 2012,False,"First full day of summer -- longest daylight of the year. Which means days get shorter, not longer in summer. Do the Astro.",,,,,
1166,20 Jun 2012,False,"June 20  7:09pm ET.  Oh, and happy Winter Solstice to the 15% of Earth's human population that lives South of the Equator.",,,,,
1167,20 Jun 2012,False,June 20  7:09pm ET. Geekspeak: Sun reaches north-most spot on ecliptic above celestial equator. Everyone else: Summer begins.,,,,,
1168,18 Jun 2012,False,"Just an FYI: Until the Methods & Tools of science were developed, people hardly knew anything about anything.",,,,,
1169,16 Jun 2012,False,"Love the air-pressure physics of new punch-top cans. But unlike ketchup, I never knew beer had problems exiting its container",,,,,
1170,16 Jun 2012,False,Time elapsed before the launch of a female astronaut:  USSR: 2 years.  China: 9 years.  USA: 21 years.,,,,,
1171,15 Jun 2012,False,'@EdwardJack2: What year do we make contact w/Aliens?' Never. They've concluded there's no sign of intelligent life on Earth.,,,,,
1172,14 Jun 2012,False,"Jun 14. Flag Day in USA. In space, a frontier for all, there is no air, and so Flags do not wave. A lesson from the cosmos.",,,,,
1173,13 Jun 2012,False,"Congrats to the LAKings' NHL title. Is it just me, or does the HubbleTelescope look like the StanleyCup?pic.twitter.com/vAtggdUk",,,,,
1174,10 Jun 2012,False,Imagine if NASA could advertise the urge to explore in us all [ 30sec ]: http://bit.ly/62tkjd ,,,,,
1175,8 Jun 2012,False,"Prometheus goes 35 light yrs into space, but CharlizeTheron gaffes ""We're a half billion miles from Earth""- just past Jupiter",,,,,
1176,8 Jun 2012,False,Attended a midnight showing of Prometheus. The takeaway? Occasions arise when being curious is bad for your life expectancy.,,,,,
1177,6 Jun 2012,False,"Creative imaginative visionary. A dreamer, like so many of the best science fiction authors. Ray Bradbury (1920-2012), R I P",,,,,
1178,5 Jun 2012,False,"Wouldn't it be cool if, right about now, silhouettes of spaceships were seen escaping Venus, visible against the glowing Sun.",,,,,
1179,5 Jun 2012,False,"In the era of the Telescope, there's been 258 Total Solar Eclipses but only eight Venus Transits, including today's.",,,,,
1180,5 Jun 2012,False,"Later today, for nearly six hours, sunlight we receive dims by 0.1% as Venus crosses Earth's line of sight to the Sun.",,,,,
1181,4 Jun 2012,False,"I continue to be moved by what creative videographers have done with my words: ""WeStoppedDreaming-Part1"" http://bit.ly/LftDCo ",,,,,
1182,3 Jun 2012,True,"""@thiseye: Any idea why our solar system doesn't have a name? We name everything else.""  I call it Home.",,,,,
1183,3 Jun 2012,True,"""@OtterlyLindz: Why does our moon have no real name?"" Ah, but it does. So too Earth & Sun. Official names: Luna, Terra, & Sol",,,,,
1184,2 Jun 2012,False,"GettingMarried? June's full Moon crosses the sky in a low arc. Atmospheric dust creates an Amber hue. Behold the ""HoneyMoon""",,,,,
1185,1 Jun 2012,False,True wisdom has a curious way of revealing to yourself your own true ignorance.,,,,,
1186,31 May 2012,False,Q: What do you call Alternative Medicine that survives double-blind laboratory tests?  A: Regular Medicine.,,,,,
1187,27 May 2012,False,If Interested: Ten things I would put in a survival kit and bring to a desert Island [Audio 30min]  http://bit.ly/IpjjWN ,,,,,
1188,26 May 2012,False,"How to turn UFOs into IFOs: Take one course in Stargazing, another in Atmospheric Phenomena, and a third in Cognitive Bias.",,,,,
1189,25 May 2012,False,Odd that many who embrace the discoveries of science will disagree only when results conflict with their politics or religion,,,,,
1190,25 May 2012,False,"Flight Attendants say: ""Cabin pressurized for your comfort & safety."" What they mean is: ""otherwise you'd freeze & suffocate""",,,,,
1191,23 May 2012,False,"Feeling heavy?  If you cram a herd of 50-million elephants into a thimble, you get the density of a Pulsar.  I'm just saying.",,,,,
1192,20 May 2012,False,"Black cloth absorbs 98% of sunlight. Graduation robes: good for cold, dank British prep schools. Bad for outdoor graduations.",,,,,
1193,19 May 2012,False,Knowing how to think empowers you far beyond those who know only what to think.,,,,,
1194,18 May 2012,False,"Simple Logic:  If you have a gene for celibacy, you didn't inherit it.",,,,,
1195,17 May 2012,False,"The likelihood that a person uses the word ""toxin"" correlates strongly with how much Chemistry the person does *not* know",,,,,
1196,15 May 2012,False,The website for people who hate technology **and** who don't know what time it is:   http://clock.msurma.net/ ,,,,,
1197,15 May 2012,False,"If interested, reflections on being curious about the natural world & on the future of robots [3m 30s]: http://bit.ly/ILnMWH ",,,,,
1198,14 May 2012,False,How to terrify your cow: Tell her that McDonalds has sold about as many Hamburgers as there are Stars in our Milky Way galaxy,,,,,
1199,10 May 2012,False,"If the 2010s continue as they have, we'll remember the decade only as 50`yr anniversaries of stuff that happened in the 1960s",,,,,
1200,8 May 2012,False,My Father's history with the 1960s Civil Rights Miovement compels me to share this time-sensitive video http://bit.ly/IF1UzZ ,,,,,
1201,5 May 2012,False,"May 5, 1925. Dayton, Tennessee. Science & math teacher JohnScopes teaches Darwinian Evolution in Biology class. Gets arrested",,,,,
1202,4 May 2012,False,"Moon Lunacy strikes again: The impending Supermoon is to an average full Moon what a 16"" Pizza is to a 15"" Pizza. So chillax.",,,,,
1203,4 May 2012,False,"I've tried to resist, but a galaxy far, far away has taken control of this tweet: ""May the 4th be with you.""",,,,,
1204,4 May 2012,False,"""@marycucumber What are some problems with visiting Mercury? Is it just the temperature?"" No. You need a space program too.",,,,,
1205,1 May 2012,False,"To those bacteria, humans are simply an anaerobic vessel of fecal matter. Disturb them & they'll remind you who you work for.",,,,,
1206,1 May 2012,False,FYI: Who's in Charge? More Bacteria live & work in one centimeter of your lower colon than the sum of all humans ever born.,,,,,
1207,30 Apr 2012,False,Only when you love an agency deeply can you conceive of a joke this tragically funny: http://onion.com/IJjCO8 ,,,,,
1208,27 Apr 2012,False,"I thought I saw this guy exiting Enterprise just after it landed, but I could be mistaken.pic.twitter.com/4e5MBSUu",,,,,
1209,27 Apr 2012,False,"Welcome Space Shuttle Enterprise to New York City, your new home.pic.twitter.com/j8TC7OX0",,,,,
1210,24 Apr 2012,False,Enough Physics ranting for the day: NationalPhysicsDay. May the (three) forces be with you. (You'd disintegrate without them),,,,,
1211,24 Apr 2012,False,"Everything we know and understand about the Universe is driven by just three forces:  Strong-Nuclear, Electro-Weak, & Gravity",,,,,
1212,24 Apr 2012,False,The Physcis equations on the background white-boards of #BigBangTheory are real and changed according to each show's theme.,,,,,
1213,24 Apr 2012,False,"Physics of rainbows leave them always face-on to viewer, so can never visit endpoints. Best-place-ever to hide pots of Gold.",,,,,
1214,24 Apr 2012,False,Just an FYI: In Physics there's such thing as Flux & such a thing as a Capacitor but there's no such thing as a FluxCapacitor,,,,,
1215,24 Apr 2012,False,"The likelihood that a person uses the term ""Energy Field"" correlates strongly with how much Physics the person does not know.",,,,,
1216,24 Apr 2012,False,Just a reminder from Physics class:  Some (probably all) of your best friends are made of quarks.,,,,,
1217,24 Apr 2012,False,"Bugs Bunny can throw a slower pitch. That's because he's subject instead to ""Cartoon Laws of Physics""  http://bit.ly/3v7hcN ",,,,,
1218,24 Apr 2012,False,TrajectoryPhysics: Slowest pitch in Baseball to reach catcher? 30mph at 45deg angle. Any slower at another angle hits ground,,,,,
1219,24 Apr 2012,False,"My five favorite physicists, in order:  Isaac Newton, Albert Einstein, Galileo Galileo, James Clerk Maxwell, Richard Feynman.",,,,,
1220,24 Apr 2012,False,"In case you hadn't figured this out yet, the hit game-App ""Angry Birds"" is all about the Physics of parabolic trajectories.",,,,,
1221,24 Apr 2012,False,"In RaidersOfTheLostArk, auditorium chalkboard shows accurate physics formulas before Indiana flips it to draw the staff of Ra",,,,,
1222,24 Apr 2012,False,There is no true understanding of Biology without Chemistry. And there's no true understanding of Chemistry without Physics.,,,,,
1223,24 Apr 2012,False,".@atexdelite How has E=mc^2 changed the way we look at the cosmos, you ask? ""InTheBeginning"" [2800words]  http://bit.ly/gRBDAo ",,,,,
1224,22 Apr 2012,False,What I say when my audience is 3000 space professionals. Keynote speech from last week: [40m + 20m Q&A] http://bit.ly/I3Khbm ,,,,,
1225,22 Apr 2012,False,"April 22, 2012 #EarthDay. Founded 1970. The year after we walked on Moon, looked back home, & discovered Earth for first time",,,,,
1226,20 Apr 2012,False,"Saw Jim Cameron's Titanic on April 15th. This time around, delirious Rose on the wooden plank did indeed see the correct sky.",,,,,
1227,18 Apr 2012,False,"No luck wishing on first star you see? Because it's Venus, currently 250x brighter than Sirius - brightest star in night sky.",,,,,
1228,16 Apr 2012,False,Venus's 900deg air would cook a 16in pepperoni pizza in 9sec & vaporize you.  RunawayGreenhouse: Good for pizza. Bad for life,,,,,
1229,14 Apr 2012,False,"Fan of Jazz? Got an hour? Interviewed on the intersection of Math, Science, & Music on ""Jazz Inspired""   http://bit.ly/Ip0Cm8 ",,,,,
1230,13 Apr 2012,False,Short words that conjure big ideas are more impressive than big words that don't. e.g: Explore versus Paraskavedekatriaphobia,,,,,
1231,12 Apr 2012,False,On N. Korea's Rocket: To fail in what you've yet to achieve is more the spirit of exploration than to make no attempt at all.,,,,,
1232,12 Apr 2012,False,"April 12, 1961: first human in orbit. April 12, 1981: first flight of SpaceShuttle. April 12, 2012: Snooki in 2nd trimester.",,,,,
1233,11 Apr 2012,False,Just an FYI: Stars in the Universe far outnumber all sounds & words ever uttered by all humans who ever lived.,,,,,
1234,9 Apr 2012,False,"It's just unfair that ""a lot"" is still two words, yet ""inasmuch"" ""heretofore"" ""unforeseen"" & ""stomachache"" are each one.",,,,,
1235,7 Apr 2012,False,Fond of bow ties & hats. Handbag is bigger on the inside. Talks to variety of creatures. Evidence Mary Poppins is a Time Lord,,,,,
1236,7 Apr 2012,False,Difference between religion & science: Clergy executed those with powers of Mary Poppins. Scientists would have studied them.,,,,,
1237,7 Apr 2012,False,"Mary Poppins, star nanny. But takes kids into park at night & hangs out with a homeless drifter. Would never get a job today",,,,,
1238,7 Apr 2012,False,MaryPoppins on ABCFamily now. Merely sliding up the bannister would have been sufficient to be burned as a witch in the 1600s,,,,,
1239,7 Apr 2012,True,"""@le_procyon: You should copyright the sky & make some real money"" One of a few differences between Astrophysics & Capitalism",,,,,
1240,7 Apr 2012,True,"""@pmccasky: I saw Titanic last night and I couldn't pay attention to anything but @neiltyson's sky.""  No, it's your sky too.",,,,,
1241,6 Apr 2012,False,FYI: Full Moon today. Gregorian Calendar rules: Easter is the first Sunday after the first Full Moon after the Spring Equinox,,,,,
1242,5 Apr 2012,False,"We don't measure Rocket performance in units of PlanePower, so I'm puzzled we (still) measure Car performance in HorsePower.",,,,,
1243,26 Mar 2012,False,Don't Christian monks wear hoodies?,,,,,
1244,24 Mar 2012,False,Speaking of Zombies -- After reviewing the Mayan Apocalypse for 2012 it's clear that a Zombie Apocalypse is much more likely.,,,,,
1245,23 Mar 2012,False,"If Romans knew that emotions were of mind and not of heart, maybe Cupid would have instead shot arrows through lovers' brains",,,,,
1246,23 Mar 2012,False,".@ProducerSAF What'd happen if Earth stopped spinning, you ask? At your latitude you'd all fall over & roll due east 900mph.",,,,,
1247,22 Mar 2012,False,I'm just trying to create a place where the Twitterverse meets the Universe. I'm happy to know that I occasionally succeed.,,,,,
1248,22 Mar 2012,False,Just learned that  http://TIME.com  once again chose my Twitter stream as among the world's top 140:  http://ti.me/GFFaNP ,,,,,
1249,21 Mar 2012,False,In 7-billion years our Milky Way collides with the Andromeda galaxy. Not to worry. Sun burns Earth to crisp well before then,,,,,
1250,20 Mar 2012,False,"""Testing Fundamental Theories of Physics"" 2012 Isaac Asimov Panel debate Tonite. 7:30pm ET. Live Stream:  http://bit.ly/lqbqZ2 ",,,,,
1251,20 Mar 2012,False,March 20: Happy Autumnal Equinox to the 20% of Earth's human population (& 100% of free Penguins) living south of the equator,,,,,
1252,18 Mar 2012,False,Long overdue.  “@pannikos: Any thoughts on this?  http://bit.ly/ysamtx ”,,,,,
1253,17 Mar 2012,False,Cool. And look for when it breaks Mach-1 around 700mph: MT @bfibbs: Shuttle Booster launch & splashdown http://youtu.be/2aCOyOvOw5c ,,,,,
1254,17 Mar 2012,False,"The Hulk is GREEN from a potent, accidental dose of Gamma Rays. Actually, he would have died within weeks from organ failure.",,,,,
1255,17 Mar 2012,False,Our eyes are about 10x more sensitive to GREEN light than Red. So watt-for-watt GREEN lasers look much brighter than Red ones,,,,,
1256,17 Mar 2012,False,"The peak sensitivity of the Human Retina is GREEN, matching the peak spectral output of the Sun.",,,,,
1257,17 Mar 2012,False,The Sun emits more GREEN light than any other band of light in the rainbow.,,,,,
1258,17 Mar 2012,False,"Curiously, light-loving GREEN plants reject the Sun's GREEN light, reflecting it back at you, which is why they look GREEN.",,,,,
1259,17 Mar 2012,False,"The laws of physics conspire to prevent GREEN stars in the universe. They basically come in three colors: Red, White, & Blue.",,,,,
1260,17 Mar 2012,False,Curious associations w/ Christian festivals. Easter: DyedChickenEmbryos. Christmas: ObeseArcticToyMaker. StPatrick'sDay: Beer,,,,,
1261,17 Mar 2012,False,"Happy Saint Patrick's day, President Barack O ' Bama",,,,,
1262,14 Mar 2012,False,"Anyone from Venus is formally a Venereal, but Doctors got to the word before astrophysicists, so we invented Venutian instead",,,,,
